title,description,source,published_date,url
The FTC Wants More Control Over Online Speech. That’s A Big Problem,"Late last month, the U.S. Federal Trade Commission (FTC) announced a request for public comment on so-called “tech censorship.” America has a vibrant and successful market-driven system for content moderation, enabled by Section 230 of the Communications Dece…",Techdirt,2025-03-17T22:43:07Z,https://www.techdirt.com/2025/03/17/the-ftc-wants-more-control-over-online-speech-thats-a-big-problem/
UK Online Safety Act comes into force today,"From today, online platforms must start putting in place measures to protect people in the UK from criminal activity, while Ofcom has launched its latest enforcement programme to assess industry compliance.",Ofcom.org.uk,2025-03-17T16:34:17Z,https://www.ofcom.org.uk/online-safety/illegal-and-harmful-content/enforcing-the-online-safety-act-platforms-must-start-tackling-illegal-material-from-today/
"After Election Chaos, Romania Proposes Platforms Invent Magic Wand As Content Moderation Solution","When faced with a difficult technology policy challenge, policymakers can respond in one of two ways: with careful analysis of what’s technically possible, or by demanding Silicon Valley simply wave a magic wand and make all problems disappear. Romania has ch…",Techdirt,2025-03-18T19:10:29Z,https://www.techdirt.com/2025/03/18/after-election-chaos-romania-proposes-platforms-invent-magic-wand-as-content-moderation-solution/
Reddit Is Restricting Luigi Mangione Discourse—but It’s Even Weirder Than That,The website is attacking the users that made it the front page of the internet.,Slate Magazine,2025-03-13T20:34:23Z,https://slate.com/technology/2025/03/reddit-elon-musk-luigi-mangione-censorship.html
Ctrl-Alt-Speech: The Comedy Of Errors,"Ctrl-Alt-Speech is a weekly podcast about the latest news in online speech, from Mike Masnick and Everything in Moderation‘s Ben Whitelaw. Subscribe now on Apple Podcasts, Overcast, Spotify, Pocket Casts, YouTube, or your podcast app of choice — or go straigh…",Techdirt,2025-02-27T23:35:03Z,https://www.techdirt.com/2025/02/27/ctrl-alt-speech-the-comedy-of-errors/
Ctrl-Alt-Speech: The TAKE IT DOWN Takedown,"Ctrl-Alt-Speech is a weekly podcast about the latest news in online speech, from Mike Masnick and Everything in Moderation‘s Ben Whitelaw. Subscribe now on Apple Podcasts, Overcast, Spotify, Pocket Casts, YouTube, or your podcast app of choice — or go straigh…",Techdirt,2025-03-13T22:30:08Z,https://www.techdirt.com/2025/03/13/ctrl-alt-speech-the-take-it-down-takedown/
Ctrl-Alt-Speech: E Pluribus Chaos,"Ctrl-Alt-Speech is a weekly podcast about the latest news in online speech, from Mike Masnick and Everything in Moderation‘s Ben Whitelaw. Subscribe now on Apple Podcasts, Overcast, Spotify, Pocket Casts, YouTube, or your podcast app of choice — or go straigh…",Techdirt,2025-03-07T03:23:45Z,https://www.techdirt.com/2025/03/06/ctrl-alt-speech-e-pluribus-chaos/
"Ctrl-Alt-Speech: Once You Slop, You Can’t Stop","Ctrl-Alt-Speech is a weekly podcast about the latest news in online speech, from Mike Masnick and Everything in Moderation‘s Ben Whitelaw. Subscribe now on Apple Podcasts, Overcast, Spotify, Pocket Casts, YouTube, or your podcast app of choice — or go straigh…",Techdirt,2025-03-20T22:51:09Z,https://www.techdirt.com/2025/03/20/ctrl-alt-speech-once-you-slop-you-cant-stop/
Bluesky Dubs AI Video of Trump Sucking Elon Musk’s Toes ‘Non-Consensual Explicit Material’,The platform has since reinstated the videos.,Gizmodo.com,2025-02-27T14:00:25Z,https://gizmodo.com/bluesky-dubs-ai-video-of-trump-sucking-elon-musks-toes-non-consensual-explicit-material-2000569031
The ADL’s Misguided Attack On Steam,"Last November, the Anti-Defamation League (ADL) released Steam-Powered Hate, accusing Valve’s game launcher, Steam, of fostering extremism. The report dropped just before Senator Mark Warner, a SAFE TECH Act proponent, threatened Steam’s owner, raising concer…",Techdirt,2025-02-28T22:57:01Z,https://www.techdirt.com/2025/02/28/the-adls-misguided-attack-on-steam/
Reddit is cracking down on users who upvote violent content,"Reddit is intensifying its crackdown on users upvoting rule-violating content, aiming to maintain a space for civil discussion amid rapid user growth.",Business Insider,2025-03-09T00:09:51Z,https://www.businessinsider.com/reddit-cracks-down-on-users-upvoting-violent-content-2025-3
How Democrats’ Attack On Section 230 Plays Right Into Trump’s Censorial Plans,"Like clockwork, lawmakers are once again rallying around the idea of eliminating Section 230. That Republicans are leading this charge is hardly surprising—repealing Section 230 is explicitly laid out in the Project 2025 playbook. But what’s surprising, and i…",Techdirt,2025-03-25T22:49:04Z,https://www.techdirt.com/2025/03/25/how-democrats-attack-on-section-230-plays-right-into-trumps-censorial-plans/
Why is X suing the Indian government as Musk woos Modi?,X has filed a lawsuit alleging that New Delhi is unlawfully censoring content online.,Al Jazeera English,2025-03-22T14:26:39Z,https://www.aljazeera.com/news/2025/3/22/why-is-x-suing-the-indian-government-as-musk-woos-modi
‘American Sweatshop’ Review: A Thoughtful but Artless Descent into Online Hell,"Cinematographer and TV director Uta Briesewitz moves into features with 'American Sweatshop,' an artless descent into online hell. Read our review.",IndieWire,2025-03-09T16:06:59Z,https://www.indiewire.com/criticism/movies/american-sweatshop-review-uta-briesewitz-1235102314/
Democratic Senators Team Up With MAGA To Hand Trump A Censorship Machine,"At the exact moment when Donald Trump and his MAGA allies are actively dismantling democratic institutions and working to silence critics, a group of Democratic Senators have decided to collaborate with Trump’s supporters to make it easier to censor speech on…",Techdirt,2025-03-21T22:32:57Z,https://www.techdirt.com/2025/03/21/democratic-senators-team-up-with-maga-to-hand-trump-a-censorship-machine/
California Dropped Part Of Social Media Law After Musk Challenge,X has previously convinced a federal appeals court that forcing social media companies to disclose their content moderation and other policies was unconstitutional.,Forbes,2025-03-03T18:55:02Z,https://www.forbes.com/sites/petersuciu/2025/03/03/california-dropped-part-of-social-media-law-after-musk-challenge/
"Trump Promises To Abuse Take It Down Act For Censorship, Just As We Warned","During his address to Congress this week, Donald Trump endorsed the Take It Down Act while openly declaring his plans to abuse it: “And I’m going to use that bill for myself too, if you don’t mind, because nobody gets treated worse than I do online, nobody.” …",Techdirt,2025-03-06T17:21:00Z,https://www.techdirt.com/2025/03/06/trump-promises-to-abuse-take-it-down-act-for-censorship-just-as-we-warned/
My New Podcast ‘Otherwise Objectionable’ Explains Why Everyone’s Wrong About Section 230,"At a moment when it feels like everyone is racing to “reform” Section 230, while fundamentally misunderstanding the law, and often in pursuit of conflicting goals, it’s more important than ever that people actually learn about Section 230. To that end, we’re …",Techdirt,2025-03-12T22:22:17Z,https://www.techdirt.com/2025/03/12/my-new-podcast-otherwise-objectionable-explains-why-everyones-wrong-about-section-230/
Reddit cofounder Alexis Ohanian teams with Kevin Rose to resurrect Digg,"Kevin Rose and Reddit cofounder Alexis Ohanian have acquired Digg, which will relaunch with a mobile-first design and new AI content tools.",Digiday,2025-03-05T11:00:00Z,http://digiday.com/media/reddit-cofounder-alexis-ohanian-teams-with-kevin-rose-to-relaunch-digg/
Talking About Bluesky And Putting Power & Choice Back Into Users’ Hands At SXSW,"When 1,700 people pack a room at SXSW (with hundreds more relegated to overflow spaces) to hear about a decentralized social media protocol, it’s clear something interesting is happening. The crowd that showed up for my conversation with Bluesky CEO Jay Grabe…",Techdirt,2025-03-14T22:35:38Z,https://www.techdirt.com/2025/03/14/talking-about-bluesky-and-putting-power-choice-back-into-users-hands-at-sxsw/
House Judiciary Committee subpoenas Apple over AI censorship,"The Republican chairman of the House Judiciary Committee has issued a subpoena to Apple, as part of an investigation into whether the Biden administration influenced Big Tech to censor artificial intelligence.US Capitol. Image Credit: Alejandro BarbaThe House…",AppleInsider,2025-03-16T18:43:14Z,https://appleinsider.com/articles/25/03/16/house-judiciary-committee-subpoenas-apple-over-ai-censorship
Telegram founder allowed to leave France following arrest,The billionaire has been accused of failing to properly moderate his app to reduce criminality.,BBC News,2025-03-17T15:12:21Z,https://www.bbc.com/news/articles/cg703lz02l0o
UK starts enforcing the Online Safety Act from today,The UK's digital regulator will start enforcing the Online Safety Act from today; based on a previous statement. Companies have had three months to perform risk assessments. Read more...,Neowin,2025-03-17T07:08:01Z,https://www.neowin.net/news/uk-starts-enforcing-the-online-safety-act-from-today/
File-Sharing Services Set For Scrutiny Under U.K. Online Safety Act,"As the U.K.'s Online Safety Act comes into force today, regulator Ofcom has launched a new enforcement program.",Forbes,2025-03-17T12:26:08Z,https://www.forbes.com/sites/emmawoollacott/2025/03/17/file-sharing-services-set-for-scrutiny-under-uk-online-safety-act/
UK's Online Safety Act: Ofcom Can Now Issue Sanctions,"From March 17, Ofcom will enforce rules requiring tech platforms operating in the UK to remove illegal content, including child abuse material",Infosecurity Magazine,2025-03-17T17:00:00Z,https://www.infosecurity-magazine.com/news/uk-online-safety-act-ofcom/
Meta to test ‘Community Notes’ using algorithm from Elon Musk’s X,Tech giant says it expects new feature to be 'less biased' than previous third-party fact-checking program.,Al Jazeera English,2025-03-14T07:13:34Z,https://www.aljazeera.com/economy/2025/3/14/meta-to-test-community-notes-using-algorithm-from-elon-musks-x
Social Media’s Impact on Young People,"Social media plays a central role in teenagers’ lives, shaping how they connect, communicate, and...
The post Social Media’s Impact on Young People appeared first on Social Media Explorer.",Socialmediaexplorer.com,2025-03-07T08:44:33Z,https://socialmediaexplorer.com/content-sections/social-medias-impact-on-young-people/
The most innovative companies in social media for 2025,"This past year has been one of revivals. Low-rise jeans are back in style, digital cameras are the new favorite way to filter photos, and several cellphone companies even pushed us to buy flip phones again. The trend has been true for social media, too. Parti…",Fast Company,2025-03-18T11:00:00Z,https://www.fastcompany.com/91270177/social-media-most-innovative-companies-2025-duolingo-bluesky-boston-celtics-pinterest-partiful-planoly-sesame-workshop-feeld-strava-yelp
US House panel subpoenas Alphabet over content moderation,"The U.S. House Judiciary Committee subpoenaed Alphabet on Thursday seeking its communications with former President Joe Biden's administration about content moderation policies. House Judiciary Committee Chairman Jim Jordan, a Republican, also asked the YouTu…",CNA,2025-03-06T19:22:29Z,https://www.channelnewsasia.com/business/us-house-panel-subpoenas-alphabet-over-content-moderation-4983281
Human rights investigators race to document Syria killings on social media,"Hundreds of people have been killed amid armed clashes in Syria, with many of those deaths filmed and published on the internet. CBC’s visual investigations team has verified three of those deaths. The practice of publicizing killings is both shocking and an …",CBC News,2025-03-13T22:16:35Z,https://www.cbc.ca/news/canada/syria-killings-videos-verified-1.7481921
"As AI images flood the internet, can these tools help you tell what's real?",AI image detector tools are only growing in popularity as it becomes more difficult to tell if online images or videos are real or fake. CBC News’ Visual Investigations team tested some of the most popular free tools online to see how effective they are — and…,CBC News,2025-03-14T08:00:00Z,https://www.cbc.ca/news/canada/ai-detector-tools-test-1.7482913
"Three years after Russia’s invasion, a global online army is still fighting for Ukraine",The North Atlantic Fella Organisation has devised creative ways to support the Ukrainian cause – while navigating the complexities of content moderation.,The Conversation Africa,2025-03-16T19:24:45Z,https://theconversation.com/three-years-after-russias-invasion-a-global-online-army-is-still-fighting-for-ukraine-251480
The Rise and Fall of Terrorgram: Inside a Global Online Hate Network,"by A.C. Thompson, ProPublica and FRONTLINE, and James Bandler, ProPublica 
 

 
 This story contains references to homophobia, antisemitism and racism, as well as mass shootings and other violence.

 

 


 
 
 ProPublica is a nonprofit newsroom that investig…",ProPublica,2025-03-15T09:00:00Z,https://www.propublica.org/article/rise-and-fall-terrorgram-inside-global-online-hate-network-frontline-telegram
Californiaâs social media censorship law struck down: A victory for free speech or a threat to online safety?,"California’s Assembly Bill 587 (AB 587), a controversial social media transparency law, has been significantly weakened by the courts. The ruling, following a legal challenge by Elon Musk’s X (formerly Twitter), preserves only minimal reporting requirements. …",Naturalnews.com,2025-03-06T06:00:00Z,https://www.naturalnews.com/2025-03-06-californias-social-media-censorship-law-struck-down.html
Yet Another Columnist Claims Bluesky Is A Liberal Echo Chamber Because Its Users Keeping Kicking Nazis Out Of The Bar,"Editor’s note: Mike Masnick is on the board of Bluesky, and took no part in editing or reviewing this piece. Here it is: the dumbest take to date on Bluesky v. xTwitter. There’s been plenty of stupid offered up before by bitter xTwitter users who are trying t…",Techdirt,2025-03-20T20:46:46Z,https://www.techdirt.com/2025/03/20/yet-another-columnist-claims-bluesky-is-a-liberal-echo-chamber-because-its-users-keeping-kicking-nazis-out-of-the-bar/
Meta Tests 'Community Notes' To Replace Fact-checkers,"Social media giant Meta on Thursday announced it would begin testing its new ""Community Notes"" feature across its platforms on March 18, as it shifts away from third-party fact-checking toward a crowd-sourced approach to content moderation.",International Business Times,2025-03-13T14:06:07Z,https://www.ibtimes.com/meta-tests-community-notes-replace-fact-checkers-3766172
Billionaire Frank McCourt Wants To Buy TikTok — And Use It To Fix The Internet,McCourt believes owning TikTok could spark a digital revolution. But can a social media app really shift power back into the hands of its users?,Forbes,2025-03-21T10:35:42Z,https://www.forbes.com/sites/esatdedezade/2025/03/21/billionaire-frank-mccourt-wants-to-buy-tiktok---and-use-it-to-fix-the-internet/
EFF’s Reflections from RightsCon 2025,"EFF was delighted to once again attend RightsCon—this year hosted in Taipei, Taiwan between 24-27 February. As with previous years, RightsCon provided an invaluable opportunity for human rights experts, technologists, activists, and government representatives…",EFF,2025-03-19T18:34:49Z,https://www.eff.org/deeplinks/2025/03/effs-reflections-rightscon-2025
The Digital Garden,"Our brains are wired for negativity, but in the digital age, it’s time to rewire. Here’s how.",Psychology Today,2025-03-02T22:09:09Z,https://www.psychologytoday.com/intl/blog/beyond-school-walls/202503/the-digital-garden
New Content Moderation Rules On Reddit Somehow Led To The Name 'Luigi' Getting Auto-Flagged For Violence,"Reddit's ""Luigi"" Ban refers to discussions about Reddit's updated content moderation tools flagging the word ""Luigi"" on some subreddits, which led to controversy on the platform in March 2025. The discussions emerged after a moderator on the subreddit /r/PopC…",Knowyourmeme.com,2025-03-10T20:27:13Z,https://knowyourmeme.com/memes/events/reddits-luigi-ban
"Image doesn't show 'world's oldest pyramid,' Gunung Padang, in Indonesia","An image shared online authentically shows ""the world's oldest pyramid,"" Gunung Padang, in Indonesia.",Snopes.com,2025-03-25T10:00:00Z,https://www.snopes.com//fact-check/pyramid-indonesia-gunung-padang/
Report: China's TikTok Profits from Child Pornography,"China's TikTok is reportedly profiting from sexual livestreams involving children, while the platform's moderation policies are too weak to pick up on the explicit content, according to an investigation by the BBC.
The post Report: China’s TikTok Profits from…",Breitbart News,2025-03-05T18:27:21Z,https://www.breitbart.com/tech/2025/03/05/report-chinas-tiktok-profits-from-child-pornography/
Tech firms must start protecting UK users from illegal content,"LONDON : Tech companies must start putting in place measures to protect users from child sexual abuse images and other illegal content in Britain from Monday as enforcement of its online safety regime ramps up.Media regulator Ofcom said Meta's Facebook, ByteD…",CNA,2025-03-17T11:52:13Z,https://www.channelnewsasia.com/business/tech-firms-must-start-protecting-uk-users-illegal-content-5005591
Porn companies must take strong action to protect privacy and prevent future harms,Rigorous enforcement of content moderation policies and absolute insistence on direct and meaningful consent are critical in the era of porn as social media.,The Conversation Africa,2025-03-12T14:01:04Z,https://theconversation.com/porn-companies-must-take-strong-action-to-protect-privacy-and-prevent-future-harms-251699
"EU content law incompatible with US free speech tradition, says FCC's Carr","STOCKHOLM : The European Union's content moderation law is incompatible with America's free speech tradition and there is a risk that it will excessively restrict freedom of expression, the Federal Communications Commission (FCC) chairman said on Monday.""Ther…",CNA,2025-03-03T15:16:44Z,https://www.channelnewsasia.com/business/eu-content-law-incompatible-us-free-speech-tradition-says-fccs-carr-4973536
The problem with Adolescence,The four-part Netflix series correctly identifies social media as a catalyst for misogyny among young men – but fails to recognise that tech companies could be doing so much more,Dazed,2025-03-25T17:56:00Z,https://www.dazeddigital.com/film-tv/article/66459/1/the-problem-with-adolescence-netflix-tv-show-stephen-graham-jack-thorne?utm_source=Link&utm_medium=Link&utm_campaign=RSSFeed&utm_term=the-problem-with-adolescence
Don't be duped by this AI-generated video of a big-eyed jellyfish,The jellyfish's big yellow eyes and mouth abruptly disappeared near the end of the video.,Snopes.com,2025-02-27T11:00:00Z,https://www.snopes.com//fact-check/ai-video-jellyfish/
A “Goofy” DJ’s Secret Life at the Center of an Online Terrorism Network,"by James Bandler, ProPublica, A.C. Thompson, ProPublica and FRONTLINE, and Max Maldonado, FRONTLINE 
 

 
 
 ProPublica is a nonprofit newsroom that investigates abuses of power. Sign up to receive our biggest stories as soon as they’re published.

 

 

 
 
…",ProPublica,2025-03-25T09:00:00Z,https://www.propublica.org/article/matthew-allison-dj-terrogram-collective-boise-dallas-humber
Trump’s FTC chair shifts focus from consumer protection to culture wars,"In Andrew Ferguson’s pitch to become chair of the Federal Trade Commission (FTC), he presented himself as an “America First” pick for President Donald Trump, vowing to fight the “trans agenda,” end wokeness, and punish “censorship” by social media platforms.
…",The Daily Dot,2025-03-18T12:06:22Z,https://www.dailydot.com/debug/trump-ftc-chair-culture-wars/
Will Trump’s firings at the FTC make life easier for Big Tech?,"President Donald Trump’s firing of two Democratic commissioners at the Federal Trade Commission (FTC) has liberal commentators, including the terminated employees themselves, warning that the agency could become lenient with Big Tech.


Reuters first reported…",The Daily Dot,2025-03-19T17:58:39Z,https://www.dailydot.com/debug/ftc-firings-big-tech/
"PSA: PS5, PS4 Users Can Check PSN Ban and Moderation History","PS5 and PS4 users can now check their PSN account moderation history online, including any ban and suspension activity. Players would be forgiven for not knowing that PlayStation has a new “My Account Support Portal” set up for the task because Sony didn’t ex…",PlayStation LifeStyle,2025-03-19T15:11:40Z,https://www.playstationlifestyle.net/2025/03/19/how-to-check-psn-account-ban-moderation-history/
US FCC chair says EU Digital Services Act is threat to free speech,STOCKHOLM :The chairman of the U.S. Federal Communications Commission (FCC) on Monday called out European Union's content moderation law as incompatible with America's free speech tradition and warned of a risk that it will excessively restrict freedom of exp…,CNA,2025-03-03T15:16:44Z,https://www.channelnewsasia.com/business/us-fcc-chair-says-eu-digital-services-act-threat-free-speech-4973536
Musk decries ‘crazy’ Obama-era disinformation operation,The federal government allegedly collaborated with “media censorship organizations” to manipulate public discourse from 2016 Read Full Article at RT.com,RT,2025-03-21T11:26:19Z,https://www.rt.com/news/614572-musk-online-censorship-gec/
How right-wing influencers are exploiting the Justin Baldoni-Blake Lively feud,"Candance Owens, Brett Cooper and Megyn Kelly have also tried to reel in new audiences with content on Blake Lively and Justin Baldoni.",MSNBC,2025-03-20T11:00:00Z,https://www.msnbc.com/opinion/msnbc-opinion/justin-baldoni-blake-lively-candace-owens-megyn-kelly-media-rcna196941
How Much of Your Traffic Is Google’s AI Stealing & What Can You Do About It?,"Google’s AI-generated reviews are transforming the way people discover and engage with information. This shift brings up a crucial question: Does this new feature pose a real threat to publishers who depend on search traffic? The truth is, some have already s…",Jeffbullas.com,2025-03-12T14:39:16Z,https://www.jeffbullas.com/google-ai-reviews-traffic/
How Much of Your Traffic Is Google’s AI Stealing & What Can You Do About It?,"Google’s AI-generated overviews are transforming the way people discover and engage with information. This shift brings up a crucial question: Does this new feature pose a real threat to publishers who depend on search traffic? The truth is, some have already…",Jeffbullas.com,2025-03-12T14:39:16Z,https://www.jeffbullas.com/google-ai-overviews-traffic/
Chinese Democracy,"Good Enough Ancestor - ""This is the story of Taiwan's democratic transformation as seen through Audrey Tang's eyes, amid a global crisis for democracy."" (Taiwan, Sunflower Movement, Audrey Tang previously)Plurality (pdf) - ""Digital technology has catalyzed po…",Metafilter.com,2025-03-14T09:34:14Z,https://www.metafilter.com/208020/Chinese-Democracy
'Extremists still find plenty of digital spaces',"Opinion, comment and editorials of the day",The Week Magazine,2025-03-07T17:12:45Z,https://theweek.com/politics/instant-opinion-extremism-doge-malaria-democrats
House panel subpoenas Google parent Alphabet over content moderation during Biden years,"The subpoena seeks communications about limits or bans on content about President Trump, Elon Musk, the virus that causes COVID-19 and a host of other conservative discussion topics.",New York Post,2025-03-06T19:37:51Z,https://nypost.com/2025/03/06/business/house-panel-subpoenas-google-parent-alphabet-over-content-moderation/
Helper bots in online communities diminish human interaction,"Bots that reply to online posts can help people connect with each other, but at the same time they also interfere with people communicating with each other.",The Conversation Africa,2025-03-21T12:53:46Z,https://theconversation.com/helper-bots-in-online-communities-diminish-human-interaction-251795
X vs Sahyog: Free-speech curbs must have constitutional validity,"This legal case will test the validity under under the Constitution of online-content takedowns. While the Centre’s Sahyog Portal is a good thing, the constitutional alignment of orders posted on it needs judicial scrutiny.",Livemint,2025-03-25T10:30:08Z,https://www.livemint.com/opinion/online-views/x-karnataka-high-court-sahyog-portal-it-act-section-69a-content-moderation-freedom-of-speech-online-content-section-79-c-11742808642810.html
Don't fall for rumor that federal judge was arrested after insulting US Attorney General Pam Bondi,"A judge named Howard Gates was exposed for corruption and subsequently arrested after insulting U.S. Attorney General Pam Bondi, Rep. Jasmine Crockett or White House Press Secretary Karoline Leavitt.",Snopes.com,2025-03-25T23:04:00Z,https://www.snopes.com//fact-check/judge-arrest-pam-bondi-insult/
"#TeslaTakeDown Hasn't Taken Down Telsa, But It Is Gaining Momentum","The anti-Tesla sentiment has gained traction, yet it could be silenced on X if Elon Musk – by going against his free speech absolutist views – decided he's had enough",Forbes,2025-03-17T20:18:31Z,https://www.forbes.com/sites/petersuciu/2025/03/17/teslatakedown-hasnt-taken-down-telsa-but-it-is-gaining-momentum/
