title,description,source,published_date,url
The future of internet liability is uncertain as congress targets Section 230,"Nearly 30 years after it was created, and after 15 years of political wrangling about it, it's beginning to look a law that protects internet companies from legal action over third-party content is on its way out.Image credit: WikiMediaCreated in 1996, Sectio…",AppleInsider,2025-03-21T15:01:39Z,https://appleinsider.com/articles/25/03/21/the-future-of-internet-liability-is-uncertain-as-congress-targets-section-230
Politics Dominates Social Media – That Continues To Divide America,"It has long been said that religion and politics shouldn't be discussed in polite company, but that isn't a problem on social media, where discussions are rarely polite.",Forbes,2025-03-09T16:52:15Z,https://www.forbes.com/sites/petersuciu/2025/03/09/politics-dominates-social-media--that-continues-to-divide-america/
The Detention of Mahmoud Khalil Is a Flagrant Assault on Free Speech,"Jay Caspian Kang writes about the arrest of Mahmoud Khalil, a recent Columbia graduate involved with pro-Palestine protests, and on Trump’s and Rubio’s threats to the First Amendment.",The New Yorker,2025-03-14T10:00:00Z,https://www.newyorker.com/news/fault-lines/the-detention-of-mahmoud-khalil-is-a-flagrant-assault-on-free-speech
"Tweetbot creators tease Phoenix, a new Bluesky client","Fans of Tweetbot for Twitter and Ivory for Mastodon have reason to get excited all over again as the developers at Tapbots tease a Bluesky client called Phoenix.Phoenix is a new Tapbots app for BlueskyWhen Elon Musk took over Twitter, no one could have predic…",AppleInsider,2025-03-05T23:57:43Z,https://appleinsider.com/articles/25/03/05/tweetbot-creators-tease-phoenix-a-new-bluesky-client
This Week In Techdirt History: March 16th – 22nd,"Five Years Ago This week in 2020… oh, right. The COVID-19 pandemic dominated our coverage, as it sparked a huge variety of news: patent lawsuits to block testing that morphed into claims of royalty-free licenses that turned out to be bogus, ISPs dropping usag…",Techdirt,2025-03-22T19:00:00Z,https://www.techdirt.com/2025/03/22/this-week-in-techdirt-history-march-16th-22nd/
"Controlling Your Brand Position Online With SEO via @sejournal, @TaylorDanRW","Discover effective brand positioning strategies for search visibility and learn why brand management is critical for SEO.
The post Controlling Your Brand Position Online With SEO appeared first on Search Engine Journal.",Search Engine Journal,2025-02-27T13:30:30Z,https://www.searchenginejournal.com/controlling-your-brand-position-online-with-seo/540258/
Meta To Launch X-Like Community Notes In Major Moderation Shift,"Can community-driven fact-checking replace professionals? Meta is betting on a system pioneered by X to tackle misinformation, but time will tell how effective system will be.",Forbes,2025-03-13T15:32:39Z,https://www.forbes.com/sites/esatdedezade/2025/03/13/meta-to-launch-x-like-community-notes-in-major-moderation-shift/
"Following pardon, Hunter Biden is mired in debt and without a permanent home","Hunter Biden may have his freedom, but the son of former President Joe Biden now finds himself mired in debt and without a permanent home, according to a court filing.",ABC News,2025-03-06T21:17:00Z,https://abcnews.go.com/US/pardon-hunter-biden-mired-debt-permanent-home-court/story?id=119520818
Misinformation in the age of AI: It’s in the details (like extra fingers),"As you scroll through social media, the posts blend together: a heroic cat, a shocking statistic, a breaking news clip. But in a world where AI blurs the line between fact and fiction, how do you tell what’s real from what’s misinformation?  The short answer:…",Mozilla.org,2025-03-11T18:28:00Z,https://blog.mozilla.org/en/mozilla/ai/ai-misinformation/
Most social media medical advice is misinformation,"Most health-related social media posts from top influencers are misleading, lack medical evidence, and are biased by financial backing, a new study shows. What can you do to protect yourself against misinformation?",DW (English),2025-02-27T14:51:00Z,https://www.dw.com/en/most-social-media-medical-advice-is-misinformation/a-71773131
Why It’s Hard to Change Your Mind,"In a new book, the novelist Julian Barnes doubts that we can ever really overcome our fixed beliefs. He should keep an open mind.",The Atlantic,2025-03-17T12:30:00Z,https://www.theatlantic.com/books/archive/2025/03/why-its-hard-to-change-your-mind-julian-barnes/682063/
"Today from the researchers at No Sh*t Serlock Institute: Social media sites like TikTok, Instagram can be a 'sewer for medical misinformation' [Obvious]","Today from the researchers at No Sh*t Serlock Institute: Social media sites like TikTok, Instagram can be a 'sewer for medical misinformation'",Fark.com,2025-02-27T14:35:04Z,https://www.fark.com/comments/13578092/Today-from-researchers-at-No-Sht-Serlock-Institute-Social-media-sites-like-TikTok-Instagram-can-be-a-sewer-for-medical-misinformation
Audio of a BBC reporter making a snide comment about the Trump-Zelenskyy meeting is fake,"BBC News Ukraine correspondent James Waterhouse appeared to have a hot mic moment — if social media posts are to be believed — in a video discussing the heated Feb. […]
The post Audio of a BBC reporter making a snide comment about the Trump-Zelenskyy meeting …",Poynter,2025-03-13T10:30:56Z,https://www.poynter.org/fact-checking/2025/bbc-hot-mic-trump-zelensky-president-oval-office/
Elections Canada is working with social media platforms to address ‘serious’ deepfake concerns,"The head of Elections Canada has outlined steps that the agency is taking to address concerns about the online spread of misinformation in the upcoming federal election. During a press conference on Monday, Chief Electoral Officer Stéphane Perrault was asked …",MobileSyrup,2025-03-25T15:34:35Z,https://mobilesyrup.com/2025/03/25/elections-canada-social-media-platforms-misinformation-secure-election/
Whoopi Goldberg didn’t get ‘The View’ a $6 million federal grant. That claim originated as satire.,"Republicans have touted numerous examples of what they consider frivolous, wasteful spending as the Department of Government Efficiency works to carry out President Donald Trump’s budget cuts. Some social media […]
The post Whoopi Goldberg didn’t get ‘The Vie…",Poynter,2025-03-18T10:30:50Z,https://www.poynter.org/fact-checking/2025/whoopi-goldberg-view-federal-grant-diversity-doge-elon-musk/
Dr. Oz Is Now the Grown-Up in the Room,It takes a lot to make “green coffee beans” guy seem mainstream.,The Atlantic,2025-03-20T15:48:42Z,https://www.theatlantic.com/health/archive/2025/03/dr-oz-senate-hearing/682102/
Amy Klobuchar's Health Misinformation Act Has Aged Poorly,"By the summer of 2021, the COVID-19 pandemic had entered a new phase. Vaccines were widely available for those who wanted them, and coronavirus cases had",Reason,2025-03-06T15:17:45Z,https://reason.com/2025/03/06/amy-klobuchars-health-misinformation-act-has-aged-poorly/
Trump Is Still Trying to Undermine Elections,"Now that Trump has installed election deniers throughout his Administration, he has been busy dismantling the guardrails protecting voting and voters.",The New Yorker,2025-03-12T16:57:14Z,https://www.newyorker.com/news/the-lede/trump-is-still-trying-to-undermine-elections
Deepfake Peter Dutton speaking Mandarin spotlights misinformation threat,"A series of attacks on Australian political parties on emerging Chinese social media platform RedNote raise concerns about misinformation, disinformation and the risk of foreign interference ahead of the federal election.",ABC News (AU),2025-03-19T18:56:45Z,https://www.abc.net.au/news/2025-03-20/chinese-social-media-app-rednote-fuels-misinformation-concerns/105037266
10 Australian social media trends for 2025,"With consumers spending so much time on social media, it has become a key part of our culture, both online and IRL. This also Read more...
The post 10 Australian social media trends for 2025 appeared first on Sprout Social.",Sproutsocial.com,2025-03-17T14:00:37Z,https://sproutsocial.com/insights/social-media-trends-australia/
Trump didn’t say he became president because of the 2024 election was ‘rigged’,"If fact-checkers were referees, we might show a yellow card over social media posts that claim to show President Donald Trump confessing to rigging the 2024 election as he talked […]
The post Trump didn’t say he became president because of the 2024 election w…",Poynter,2025-03-12T10:30:30Z,https://www.poynter.org/fact-checking/2025/trump-admitted-election-rigged/
Why is X suing the Indian government as Musk woos Modi?,X has filed a lawsuit alleging that New Delhi is unlawfully censoring content online.,Al Jazeera English,2025-03-22T14:26:39Z,https://www.aljazeera.com/news/2025/3/22/why-is-x-suing-the-indian-government-as-musk-woos-modi
The Digital Garden,"Our brains are wired for negativity, but in the digital age, it’s time to rewire. Here’s how.",Psychology Today,2025-03-02T22:09:09Z,https://www.psychologytoday.com/intl/blog/beyond-school-walls/202503/the-digital-garden
Brianna film was bid to get answers - Esther Ghey,"Brianna Ghey's mum says she wants to ""get answers"" from social media companies about safety.",BBC News,2025-03-23T20:01:31Z,https://www.bbc.com/news/articles/ce98erdm8y3o
TikTok Therapy: How Gen Z’s Trend Is Reshaping Mental Health,"TikTok has become Gen Z’s go-to therapist. But when viral trends replace professional diagnosis, the consequences can be dangerous. Here’s what the science says.",Psychology Today,2025-03-12T20:25:03Z,https://www.psychologytoday.com/us/blog/the-human-algorithm/202503/tiktok-therapy-how-gen-zs-trend-is-reshaping-mental-health
New alliance could be 'transformational' for women's sport,"A new and unprecedented alliance of world-leading sports scientists could be ""transformational"" for women's sport, according to one of Britain's most successful Paralympians Emma Wiggs.",BBC News,2025-03-07T07:00:23Z,https://www.bbc.com/sport/olympics/articles/cq6y805dmggo
"Anthropic CEO envisions AI hitting an ""I quit"" button for unpleasant requests — Copilot says all requests have their charm","Amodei claims AI might eventually get an ""I quit this job"" button for unpleasant tasks, though he admits the idea may make his ""sound crazy.""",Windows Central,2025-03-24T11:00:10Z,https://www.windowscentral.com/software-apps/anthropic-ceo-ai-quit-button-for-unpleasant-requests
Are Conspiracy Theories Fueled By Spite?,"Feelings of disadvantage can lead to spitefulness, said researchers, making people more receptive to believing conspiracy theories.",Forbes,2025-03-04T12:38:08Z,https://www.forbes.com/sites/emmawoollacott/2025/03/04/are-conspiracy-theories-fueled-by-spite/
How Well Can People Spot Fake News?,"A systematic review published last month asks the question, how well do people judge the accuracy of the news?",Psychology Today,2025-03-12T14:58:32Z,https://www.psychologytoday.com/us/blog/evidence-based-living/202503/how-well-can-people-spot-fake-news
Half-truths and Lies: An Online Day in Australia,"Australians are swamped by misinformation every day, but they're smart enough to know they need help to better navigate an untrustworthy online world.",The Diplomat,2025-03-13T14:48:26Z,https://thediplomat.com/2025/03/half-truths-and-lies-an-online-day-in-australia/
HONOR To Release AI Deepfake Detection Globally In April 2025,"Ahead of MWC 2025, HONOR has announced that its AI Deepfake Detection technology, first introduced at IFA 2024, will be available worldwide starting in April 2025. This technology is designed to help users identify manipulated media by providing real-time AI …",Ubergizmo,2025-02-27T11:39:19Z,https://www.ubergizmo.com/2025/02/honor-to-release-ai-deepfake-detection-globally-in-april-2025/
"Snapchat, LEGO, Disney and Courageous Studios are among the 2025 Digiday Media Buying and Planning Awards finalists","The Digiday Media Buying and Planning Awards recognize companies, campaigns and technology that have been most successful in the modern media landscape. This year’s nominees prioritized technology-driven storytelling, strategic brand partnerships and immersiv…",Digiday,2025-03-25T17:56:52Z,http://digiday.com/media/snapchat-lego-disney-and-courageous-studios-are-among-the-2025-digiday-media-buying-and-planning-awards-finalists/
"Snapchat, LEGO, Disney and Courageous Studios are among the 2025 Digiday Media Buying and Planning Awards finalists","The Digiday Media Buying and Planning Awards recognize companies, campaigns and technology that have been most successful in the modern media landscape. This year’s nominees prioritized technology-driven storytelling, strategic brand partnerships and immersiv…",Digiday,2025-03-25T17:56:52Z,http://digiday.com/announcement/awards/snapchat-lego-disney-and-courageous-studios-are-among-the-2025-digiday-media-buying-and-planning-awards-finalists/
Real Chilling Effects,A extraordinary pattern of government censorship and threats to speech,Substack.com,2025-03-10T10:23:31Z,https://donmoynihan.substack.com/p/real-chilling-effects
The Perils of Vaccine Hesitancy,Why the fear of measles vaccination may spread as fast as the infection itself.,Psychology Today,2025-03-18T14:16:15Z,https://www.psychologytoday.com/us/blog/health-examined/202503/the-perils-of-vaccine-hesitancy
Deepfake Threats To Corporations,The use of deepfake technology is one of the most powerful tools fueling disinformation.,Forbes,2025-03-24T14:00:00Z,https://www.forbes.com/councils/forbestechcouncil/2025/03/24/deepfake-threats-to-corporations/
How a father's far-right views led him down conspiracy theory rabbit holes,"The spread of misinformation, especially on social media, is giving rise to fringe conspiracy theorists that have no basis in reality. In a new piece for NPR, Zach Mack shares his family's journey as his father's far-right views led him down a path of falseho…",CBS News,2025-03-06T23:23:00Z,https://www.cbsnews.com/video/how-fathers-far-right-views-led-him-down-conspiracy-theory-rabbit-holes/
The Measles Outbreak in Texas Is Why Vaccines Matter,"Opting against vaccines may uphold ideas of personal freedom, but it has doomed the county at the center of the Texas measles outbreak",Scientific American,2025-02-28T13:00:00Z,https://www.scientificamerican.com/article/the-measles-outbreak-in-texas-is-why-vaccines-matter/
"TikTok is awash with misinformation about ADHD, study finds","According to new research, over half of the most popular videos about ADHD on the platform are misleading. But blaming TikTok creators alone misses the bigger picture",Dazed,2025-03-20T16:00:00Z,https://www.dazeddigital.com/life-culture/article/66417/1/tiktok-is-awash-with-misinformation-about-adhd-study-finds?utm_source=Link&utm_medium=Link&utm_campaign=RSSFeed&utm_term=tiktok-is-awash-with-misinformation-about-adhd-study-finds
Just the facts? Meta’s new experiment says otherwise,"Earlier this year, Meta announced it would end its third-party fact-checking program for posts on its social media sites: Facebook, Instagram and Threads. Instead of relying on established fact-checking programs […]
The post Just the facts? Meta’s new experim…",Poynter,2025-03-14T11:30:03Z,https://www.poynter.org/commentary/2025/meta-community-notes-response-fact-checkers/
Californiaâs social media censorship law struck down: A victory for free speech or a threat to online safety?,"California’s Assembly Bill 587 (AB 587), a controversial social media transparency law, has been significantly weakened by the courts. The ruling, following a legal challenge by Elon Musk’s X (formerly Twitter), preserves only minimal reporting requirements. …",Naturalnews.com,2025-03-06T06:00:00Z,https://www.naturalnews.com/2025-03-06-californias-social-media-censorship-law-struck-down.html
"""The bargain we are being asked to ratify"" – AI as technological bribery",“The bargain we are being asked to ratify takes the form of a magnificent bribe.”- Lewis Mumford (1964)   Something has changed. At least in the way that AI is publicly discussed. Where for a …,Wordpress.com,2025-03-24T02:32:27Z,https://librarianshipwreck.wordpress.com/2025/03/02/the-bargain-we-are-being-asked-to-ratify-ai-as-technological-bribery/
Little Girls Are Harming Their Skin With Anti-Aging Products,"Driven by the viral #SephoraKids social media trend, little girls are harming their skin and their body image with anti-aging products.",Forbes,2025-02-27T12:45:00Z,https://www.forbes.com/sites/alisonescalante/2025/02/27/little-girls-are-harming-their-skin-with-anti-aging-products/
TikTok health traps: How influencers give you bad advice,"Most health-related social media posts from top influencers are misleading, lack medical evidence, and are biased by financial backing, a new study shows. What can you do to protect yourself against misinformation?",DW (English),2025-02-28T13:03:00Z,https://www.dw.com/en/tiktok-health-traps-how-influencers-give-you-bad-advice/a-71773131
Meta uses Elon Musk's X algorithm for its new community notes,Mark Zuckerberg and Elon Musk have something new in common: the algorithm for their platform's respective community notes.,Business Insider,2025-03-13T14:08:42Z,https://www.businessinsider.com/meta-community-notes-elon-musk-x-algorithm-facebook-instagram-2025-3
"Alysha Burney death: YouTuber dies on holiday, aged 24",Tributes have poured in for the social media star who was ‘creative’ and ‘passionate about giving back’,The-independent.com,2025-03-11T09:10:31Z,https://www.the-independent.com/life-style/alysha-burney-dead-youtube-accident-cause-b2712743.html
Whistleblower reveals Facebook censorship system created to enter China,"Last April, Sarah Wynn-Williams, a former Facebook global policy director who was fired in 2017, revealed in a complaint filed with the SEC that Facebook sought a foothold in the Chinese social media market. It hoped to achieve this by creating a version of i…",TechSpot,2025-03-10T17:04:00Z,https://www.techspot.com/news/107084-whistleblower-reveals-details-censorship-system-facebook-built-chinese.html
Social media statistics shaping Australia’s digital landscape in 2025,"Whether you’re running a local business or a multinational corporation, social media marketing is a must for brands of all sizes. However, understanding the Read more...
The post Social media statistics shaping Australia’s digital landscape in 2025 appeared f…",Sproutsocial.com,2025-03-13T14:00:08Z,https://sproutsocial.com/insights/social-media-statistics-australia/
Rise of the sigma male: TikTok's new gender divide,"TikTok is playing a pivotal role in spreading toxic discourses associated with sigma masculinity, which advocates disinterest in and denigration of women as well as hatred and humiliation of other gender identities.",Phys.Org,2025-02-28T13:35:04Z,https://phys.org/news/2025-02-sigma-male-tiktok-gender.html
Are you actually as unhealthy as you think?,"From protein and magnesium deficiencies to needing to lower cortisol levels and balance our hormones, social media has us believing that our health is in dire conditions",Dazed,2025-03-25T15:20:00Z,https://www.dazeddigital.com/beauty/article/66443/1/are-you-as-unhealthy-as-you-think-tiktok-wellness-hormones-cortisol?utm_source=Link&utm_medium=Link&utm_campaign=RSSFeed&utm_term=are-you-actually-as-unhealthy-as-you-think
Politicians cop criticism for misinformation about Bathurst 1000 closure,"The federal Nationals candidate for Calare, Sam Farraway, has been criticised for falsely claiming the future of the Bathurst 1000 race at Mount Panorama-Wahluu is threatened by a First Nations land claim.",ABC News (AU),2025-03-05T19:11:58Z,https://www.abc.net.au/news/2025-03-06/bathurst-1000-land-claim-misinformation/105011814
Trump Makes Massive Cut to Columbia University Amid War on Education,"The Trump administration is canceling $400 million in grants to Columbia University over what it says is “the school’s continued inaction in the face of persistent harassment of Jewish students.”
In reality, the president is clamping down on pro-Palestine pr…",The New Republic,2025-03-07T20:54:43Z,https://newrepublic.com/post/192498/trump-cut-columbia-university
Why Canada’s CBC Is More Important Than Ever,"According to survey results, Canadians already see “local news” outlets as a first resort in wildfires or a public health crisis. 79 per cent also regard large, trusted media outlets like the CBC/Radio-Canada as equally or more important in the age of social …",Toronto Star,2025-03-12T17:44:00Z,https://www.thestar.com/opinion/contributors/the-cbc-cant-singlehandedly-unite-canada-heres-what-it-can-do/article_6a44f9f2-fdc0-11ef-8d74-33e16fa9f6e0.html
West Virginia Advances Bill Requiring Disclaimers on AI-Altered Election Images,West Virginia lawmakers have advanced a bill that would require clear disclaimers on images altered by artificial intelligence when used in connection with elections. The new measure comes amid growing concern about how manipulated images can influence public…,Fstoppers,2025-03-02T13:03:01Z,https://fstoppers.com/artificial-intelligence/west-virginia-advances-bill-requiring-disclaimers-ai-altered-election-images-694339
'Absolute cesspit': Mother of murdered teen Brianna Ghey backs under-16 social media ban,The mother of British transgender teen Brianna Ghey speaks out in support of a social media ban for children aged under 16.,ABC News (AU),2025-03-24T02:23:54Z,https://www.abc.net.au/news/2025-03-24/brianna-ghey-mother-calls-social-media-absolute-cesspit/105088636
Nature and Nurture in Political Psychology,"Many people resist, often strenuously, accumulating scientific evidence that our ideological preferences are constrained by the lives we have led thus far.",Psychology Today,2025-03-05T18:49:59Z,https://www.psychologytoday.com/us/blog/social-justice-pacifists/202503/nature-and-nurture-in-political-psychology
Could Seven Minutes Of Meditation Support Sustainable Action?,Meditation can shape how people think and engage with the world. Making it part of daily routine for just seven minutes could help influence sustainability decisions.,Forbes,2025-03-19T08:40:30Z,https://www.forbes.com/sites/feliciajackson/2025/03/19/could-seven-minutes-of-meditation-support-sustainable-action/
Union Blasts Musk Over Retweet Blaming Holocaust on Public Workers,"Elon Musk is under fire for sharing a post that claims public workers, not Adolf Hitler, killed millions of people in the Nazis' Holocaust.",Rolling Stone,2025-03-14T18:48:01Z,http://www.rollingstone.com/culture/culture-news/musk-holocaust-public-workers-union-1235296401/
Musk decries ‘crazy’ Obama-era disinformation operation,The federal government allegedly collaborated with “media censorship organizations” to manipulate public discourse from 2016 Read Full Article at RT.com,RT,2025-03-21T11:26:19Z,https://www.rt.com/news/614572-musk-online-censorship-gec/
"NIH Cuts Funding For Vaccine Hesitancy Research, Amid Measles Outbreak","NIH cuts over 40 grants for vaccine hesitancy research, which could threaten public health and allow misinformation to soar.",Forbes,2025-03-18T14:51:52Z,https://www.forbes.com/sites/omerawan/2025/03/18/nih-cuts-funding-for-vaccine-hesitancy-research-amid-measles-outbreak/
Lessons From Davos: A Case For The 'Mittelstand',"These are people just outside the top set but still deeply involved in the industries, trends and politics that shape its fortunes and regularly attend the meetings.",Forbes,2025-03-20T11:15:00Z,https://www.forbes.com/councils/forbesbusinesscouncil/2025/03/20/lessons-from-davos-a-case-for-the-mittelstand/
Democratic Senators Team Up With MAGA To Hand Trump A Censorship Machine,"At the exact moment when Donald Trump and his MAGA allies are actively dismantling democratic institutions and working to silence critics, a group of Democratic Senators have decided to collaborate with Trump’s supporters to make it easier to censor speech on…",Techdirt,2025-03-21T22:32:57Z,https://www.techdirt.com/2025/03/21/democratic-senators-team-up-with-maga-to-hand-trump-a-censorship-machine/
The New Rules of Crisis Response,"This post was created in partnership with Brandwatch A brand's response to a crisis can define public perception for years. In an era where misinformation spreads in seconds and consumers demand swift, transparent action, companies must navigate high-pressure…",Adweek,2025-03-14T17:10:21Z,https://www.adweek.com/brand-marketing/the-new-rules-of-crisis-response/
Can Digg's return fix what ails social media today? Reddit's cofounder is betting on it,Remember Digg? Here's why a former rival is helping bring it back.,ZDNet,2025-03-06T13:50:00Z,https://www.zdnet.com/article/can-diggs-return-fix-what-ails-social-media-today-reddits-cofounder-is-betting-on-it/
Governments worldwide are struggling to contain a NEW VIRUS impacting BILLIONS OF LIVES worldwide known as TRUTH,"The “Truth Virus” is reshaping global media consumption, as independent news sources gain traction and challenge mainstream narratives, empowering billions to question misinformation and propaganda spread by traditional outlets. Governments and mainstream med…",Naturalnews.com,2025-03-13T06:00:00Z,https://www.naturalnews.com/2025-03-13-governments-worldwide-struggling-to-contain-new-virus-truth.html
"No, Hope Walz Did Not Get $82,000 In Student Loan Forgiveness","No, Hope Walz did not get $82,000 in student loan forgiveness. Nor is the Walz family fabulously wealthy and benefiting from unfair loan bailouts.",Forbes,2025-03-11T18:21:00Z,https://www.forbes.com/sites/shaharziv/2025/03/11/no-hope-walz-did-not-get-82000-in-student-loan-forgiveness/
