title,description,source,published_date,url
Media Insider: Ryan Bridge to host new morning video news show; Sky TV chair opens up on rugby rights and DAZN threat; Hosking-Luxon interview - six ways to avoid a train wreck,Hosking-Luxon interview - six ways to avoid a trainwreck; TVNZ CEO on leadership.,New Zealand Herald,2025-02-27T16:17:40Z,https://www.nzherald.co.nz/business/media-insider/media-insider-ryan-bridge-to-host-new-morning-video-news-show-sky-tv-chair-opens-up-on-rugby-rights-and-dazn-threat-hosking-luxon-interview-six-ways-to-avoid-a-train-wreck/N6VAVCDSVNAVJO37RMKURSX56E/
Republican Rep. Joe Wilson announces plan to propose $250 bill featuring Trump,"Rep. Joe Wilson, R- S.C., announced that he plans to put forward a proposal for the development of a $250 bill that features President Donald Trump. ""Grateful to announce that I am drafting legislation to direct the Bureau of Engraving and Printing to design …",Freerepublic.com,2025-02-27T11:33:35Z,https://freerepublic.com/focus/f-news/4300824/posts
AquaSculpt Reviews (2025): Investigative Report Uncovers the Truth About This “Ice Water Hack” for Effortless Weight Loss,"Can One Simple Hack Really Unlock Rapid Fat Loss? The Science Behind AquaSculpt’s Growing Popularity JUPITER, Fla., March 20, 2025 (GLOBE NEWSWIRE) — The weight loss industry is flooded with fads, gimmicks, and overhyped miracle cures that promise dramatic tr…",Financial Post,2025-03-20T04:07:43Z,https://financialpost.com/globe-newswire/aquasculpt-reviews-2025-investigative-report-uncovers-the-truth-about-this-ice-water-hack-for-effortless-weight-loss
Security at regional airports under microscope after major security breach,Police say a teenager allegedly entered Avalon Airport through a hole in the security fence before he boarded a Jetstar flight armed with a loaded shotgun.,ABC News (AU),2025-03-07T23:03:12Z,https://www.abc.net.au/news/2025-03-08/avalon-security-breach-regional-airport-concerns/105023864
Promoting competition and protecting consumers in the digital age: a roadmap for growth,"A speech by Sarah Cardell, the Competition and Markets Authority (CMA) Chief Executive, delivered at the techUK Tech Policy Conference 2025.",Www.gov.uk,2025-03-10T12:00:18Z,https://www.gov.uk/government/speeches/promoting-competition-and-protecting-consumers-in-the-digital-age-a-roadmap-for-growth
The violent underworld behind your cheap cigarettes,"Cash-only stores, unmarked white vans, and a shipping container with falsified documents. Where does Australia's illegal cigarette trade begin?",ABC News (AU),2025-03-02T18:38:39Z,https://www.abc.net.au/news/2025-03-03/black-market-tobacco-manchester-cigarettes-four-corners/104978592
EPA administrator Lee Zeldin calls out CNN 'face plant' in misunderstanding press release,"Environmental Protection Agency (EPA) administrator Lee Zeldin says CNN misrepresented a press release from his agency as having ""typos"" that were not actually errors.",Fox News,2025-03-14T00:00:37Z,https://www.foxnews.com/media/epa-administrator-lee-zeldin-calls-out-cnn-face-plant-misunderstanding-press-release
The role of competition in promoting growth and innovation in the UK,"A speech by Jessica Lennard, CMA Chief Strategy & External Affairs Officer",Www.gov.uk,2025-03-25T10:36:03Z,https://www.gov.uk/government/speeches/the-role-of-competition-in-promoting-growth-and-innovation-in-the-uk
Preparing for the Intelligence Explosion | Forethought,"AI that can accelerate research could drive a century of technological progress over just a few years. During such a period, new technological or political developments will raise consequential and hard-to-reverse decisions, in rapid succession. We call these…",Forethought.org,2025-03-18T05:47:01Z,https://www.forethought.org/research/preparing-for-the-intelligence-explosion
India’s Growing Misinformation Crisis: A Threat to Democracy,Failure to curb dissemination of falsehood via social media can have long-term effects on democratic processes.,The Diplomat,2025-03-19T13:00:00Z,https://thediplomat.com/2025/03/indias-growing-misinformation-crisis-a-threat-to-democracy/
Trump’s Shockingly Lawless Second Term,"Donald Trump and Elon Musk are blindly purging the government to make it more MAGA and cruel, ignoring the law, and cashing in like America has never seen",Rolling Stone,2025-03-07T13:00:00Z,http://www.rollingstone.com/politics/politics-features/trump-musk-lawless-second-term-1235290095/
Pluralistic: With Great Power Came No Responsibility (26 Feb 2025) – Pluralistic: Daily links from Cory Doctorow,"Like I was saying:


 The web is open, apps are closed. The majority of web users have installed an ad blocker (which is also a privacy blocker). But no one installs an ad blocker for an app, because it’s a felony to distribute that tool, because you have to …",Pluralistic.net,2025-03-02T11:07:22Z,https://pluralistic.net/2025/02/26/ursula-franklin/
"As AI nurses reshape hospital care, human nurses are pushing back","Hospitals say AI is helping their nurses, while unions argue the technology is overriding nurses' expertise and degrading quality of care.",Richmond.com,2025-03-23T13:30:00Z,https://richmond.com/news/nation-world/business/health-care/article_8493af32-4002-51fe-954e-046f8fc596a6.html
Granny ‘mola-mola’  goes viral,"This no gimmick, no filter 75-year-old 'kakcikyah' is showing the way in attention-grabbing content creation. Read full story",The Star Online,2025-03-15T23:00:00Z,https://www.thestar.com.my/opinion/columnists/beyond-boundaries/2025/03/16/granny-mola-mola-goes-viral
India needs to de-weaponize misinformation,"With a censorious government, even parody invites censorship in India. This is what happened to the Tamil magazine Ananda Vikatan which published a cartoon depicting Prime Minister Narendra Modi in shackles after the deportation of undocumented Indians from t…",Setopati.com,2025-03-17T07:33:33Z, https://en.setopati.com/International/164359 
India’s growing misinformation crisis a threat to democracy,"The World Economic Forum’s 2024 Global Risk Report, which warned that “misinformation and disinformation” will “further widen societal and political divides”, ranked India – with 50 percent internet penetration – at the pinnacle of this global trend.",Setopati.com,2025-03-23T07:22:02Z, https://en.setopati.com/International/164372 
India’s growing misinformation crisis a threat to democracy,"The World Economic Forum’s 2024 Global Risk Report, which warned that “misinformation and disinformation” will “further widen societal and political divides”, ranked India – with 50 percent internet penetration – at the pinnacle of this global trend.",Setopati.com,2025-03-19T07:07:44Z, https://en.setopati.com/International/164366 
California Dropped Part Of Social Media Law After Musk Challenge,X has previously convinced a federal appeals court that forcing social media companies to disclose their content moderation and other policies was unconstitutional.,Forbes,2025-03-03T18:55:02Z,https://www.forbes.com/sites/petersuciu/2025/03/03/california-dropped-part-of-social-media-law-after-musk-challenge/
Why Critical Thinking Is Your Best Weapon Against The Coming Deepfake Tsunami,"Deepfake technology is evolving faster than detection tools can keep pace, creating unprecedented business risks, including fraud and disinformation.",Forbes,2025-03-21T06:30:00Z,https://www.forbes.com/sites/bernardmarr/2025/03/21/why-critical-thinking-is-your-best-weapon-against-the-coming-deepfake-tsunami/
Musk decries ‘crazy’ Obama-era disinformation operation,The federal government allegedly collaborated with “media censorship organizations” to manipulate public discourse from 2016 Read Full Article at RT.com,RT,2025-03-21T11:26:19Z,https://www.rt.com/news/614572-musk-online-censorship-gec/
89 Seconds To Midnight - What The Doomsday Clock Tells Us About Global Collapse,"The Doomsday Clock has been set to 89 seconds to midnight, signaling unprecedented global risks. Dr. Frederic Bertley explains what this means...",Forbes,2025-03-06T19:09:03Z,https://www.forbes.com/sites/monicasanders/2025/03/06/89-seconds-to-midnightwhat-the-doomsday-clock-tells-us-about-global-collapse/
Courts Are Rejecting Politicized Attacks on Care for Trans Kids,Gender-affirming care attacked by right-wing groups is being reaffirmed by medical reviews and in the courtroom,Scientific American,2025-03-26T15:30:00Z,https://www.scientificamerican.com/article/courts-are-rejecting-politicized-attacks-on-care-for-trans-kids/
Pakistan’s Counterterrorism Capacity Tested as Militants Hijack Train,The hijack shows the capacity of groups like the BLA to not only carry out complex attacks but also engage in disinformation against the state.,The Diplomat,2025-03-13T11:58:50Z,https://thediplomat.com/2025/03/pakistans-counterterrorism-capacity-tested-as-militants-hijack-train/
The Great Balochistan Propaganda War,Islamabad’s digital disinformation campaign seeks to silence one of Balochistan’s most prominent grassroots movements.,The Diplomat,2025-03-06T04:35:52Z,https://thediplomat.com/2025/03/the-great-balochistan-propaganda-war/
Digital imperialism: How US Social Media Firms Are Using American Law to Challenge Global Tech Regulation,An update on the hard-fought battle between foreign states trying to regulate social media platforms and the broligarchs.,Nakedcapitalism.com,2025-03-22T10:16:48Z,https://www.nakedcapitalism.com/2025/03/digital-imperialism-how-us-social-media-firms-are-using-american-law-to-challenge-global-tech-regulation.html
FCC chair says US will defend Big Tech against European watchdogs,FCC chair Brendan Carr says EU regulations against US tech companies are excessive while urging for a “level and fair playing field.” Read more...,Neowin,2025-03-04T16:24:01Z,https://www.neowin.net/news/fcc-chair-says-us-will-defend-big-tech-against-european-watchdogs/
Vance warns EU of ‘civilizational suicide’,US Vice President J.D. Vance has warned Europeans about the risk of “civilizational suicide” due to their lax border control policies Read Full Article at RT.com,RT,2025-03-15T03:05:23Z,https://www.rt.com/news/614253-vance-europe-civilizational-suicide/
Deepfake Peter Dutton speaking Mandarin spotlights misinformation threat,"A series of attacks on Australian political parties on emerging Chinese social media platform RedNote raise concerns about misinformation, disinformation and the risk of foreign interference ahead of the federal election.",ABC News (AU),2025-03-19T18:56:45Z,https://www.abc.net.au/news/2025-03-20/chinese-social-media-app-rednote-fuels-misinformation-concerns/105037266
‘Kill the Boer’: The anti-apartheid song Musk ties to ‘white genocide’,Musk and Rubio claim it's a call to kill white South African farmers. Is it?,Al Jazeera English,2025-03-26T07:55:35Z,https://www.aljazeera.com/news/2025/3/26/kill-the-boer-the-anti-apartheid-song-musk-ties-to-white-genocide
"Distrust, disinformation and human suffering: The legacy of Covid in rural America",Rural residents were less likely to wear masks to protect against Covid infection. But the inability or unwillingness to get vaccinated was a bigger factor.,MSNBC,2025-03-11T14:03:24Z,https://www.msnbc.com/opinion/msnbc-opinion/covid-rural-america-trump-rcna192161
Trump Brings Back Free Speech By [Checks Notes] Threatening To Imprison Protestors And Expose Journalist Sources,"It is almost difficult to believe this is a real thing that happened with the President of the United States, but here’s what actually happened on Tuesday. In the morning, Donald Trump threatened to imprison protesters and defund any university that allows ce…",Techdirt,2025-03-05T18:54:12Z,https://www.techdirt.com/2025/03/05/trump-brings-back-free-speech-by-checks-notes-threatening-to-imprison-protestors-and-expose-journalist-sources/
Germany launches center to combat ‘conspiracy theories’,The German government has established a consultation center for people “seeking advice” on how to deal with “conspiracist” relatives Read Full Article at RT.com,RT,2025-02-28T06:49:01Z,https://www.rt.com/news/613416-germany-advice-center-conspiracy-theories/
Climate Censorship? (CAAD pushing on a string),"Sorry, but the bullying and censorship days are over. It is cool to question the heat of climate change activism, intellectually and politically.",Wattsupwiththat.com,2025-02-28T10:00:00Z,https://wattsupwiththat.com/2025/02/28/climate-censorship-caad-pushing-on-a-string/
AI And Copyright: Expanding Copyright Hurts Everyone—Here’s What to Do Instead,"You shouldn’t need a permission slip to read a webpage—whether you do it with your own eyes, or use software to help. AI is a category of general-purpose tools with myriad beneficial uses. Requiring developers to license the materials needed to create this te…",Techdirt,2025-02-28T18:43:29Z,https://www.techdirt.com/2025/02/28/ai-and-copyright-expanding-copyright-hurts-everyone-heres-what-to-do-instead/
Silencing America: How USAID and global engagement center colluded with foreign governments and media to censor free speech,"America First Legal (AFL) uncovered a coordinated effort involving U.S. agencies (USAID, GEC), foreign governments (U.K.) and private media firms (NewsGuard, Poynter) to suppress free speech under the guise of combating “misinformation,” “disinformation,” and…",Naturalnews.com,2025-03-23T06:00:00Z,https://www.naturalnews.com/2025-03-23-usaid-gec-colluded-foreign-governments-censor-freespeech.html
"A Review of “In Covid’s Wake”: According to Laptop Class Professors, the Heroes of the Pandemic Were Laptop Class Professors","The authors of the Great Barrington Declaration prevented fair and honest discussion by constantly spreading fake information. The authors of a new book don't care at all.
The post A Review of “In Covid’s Wake”: According to Laptop Class Professors, the Heroe…",Sciencebasedmedicine.org,2025-03-25T07:09:00Z,https://sciencebasedmedicine.org/laptopclassbook/
Californiaâs social media censorship law struck down: A victory for free speech or a threat to online safety?,"California’s Assembly Bill 587 (AB 587), a controversial social media transparency law, has been significantly weakened by the courts. The ruling, following a legal challenge by Elon Musk’s X (formerly Twitter), preserves only minimal reporting requirements. …",Naturalnews.com,2025-03-06T06:00:00Z,https://www.naturalnews.com/2025-03-06-californias-social-media-censorship-law-struck-down.html
Gabbard says security clearances canceled for top aides to former Pres. Biden,"The revocations are the latest in a campaign to punish and cut off access to people who the president alleges ""weaponized"" the nation's court systems against him.",CBS News,2025-03-10T22:13:54Z,https://www.cbsnews.com/news/tulsi-gabbard-revokes-security-clearances/
Could Seven Minutes Of Meditation Support Sustainable Action?,Meditation can shape how people think and engage with the world. Making it part of daily routine for just seven minutes could help influence sustainability decisions.,Forbes,2025-03-19T08:40:30Z,https://www.forbes.com/sites/feliciajackson/2025/03/19/could-seven-minutes-of-meditation-support-sustainable-action/
Meta To Launch X-Like Community Notes In Major Moderation Shift,"Can community-driven fact-checking replace professionals? Meta is betting on a system pioneered by X to tackle misinformation, but time will tell how effective system will be.",Forbes,2025-03-13T15:32:39Z,https://www.forbes.com/sites/esatdedezade/2025/03/13/meta-to-launch-x-like-community-notes-in-major-moderation-shift/
Why Canada’s CBC Is More Important Than Ever,"According to survey results, Canadians already see “local news” outlets as a first resort in wildfires or a public health crisis. 79 per cent also regard large, trusted media outlets like the CBC/Radio-Canada as equally or more important in the age of social …",Toronto Star,2025-03-12T17:44:00Z,https://www.thestar.com/opinion/contributors/the-cbc-cant-singlehandedly-unite-canada-heres-what-it-can-do/article_6a44f9f2-fdc0-11ef-8d74-33e16fa9f6e0.html
Amy Klobuchar's Health Misinformation Act Has Aged Poorly,"By the summer of 2021, the COVID-19 pandemic had entered a new phase. Vaccines were widely available for those who wanted them, and coronavirus cases had",Reason,2025-03-06T15:17:45Z,https://reason.com/2025/03/06/amy-klobuchars-health-misinformation-act-has-aged-poorly/
Human rights investigators race to document Syria killings on social media,"Hundreds of people have been killed amid armed clashes in Syria, with many of those deaths filmed and published on the internet. CBC’s visual investigations team has verified three of those deaths. The practice of publicizing killings is both shocking and an …",CBC News,2025-03-13T22:16:35Z,https://www.cbc.ca/news/canada/syria-killings-videos-verified-1.7481921
UN rights chief voices concern at new US political direction,"The UN's Volker Turk has noted a worrying ""fundamental shift"" in the rights situation in Donald Trump's America. Among other things, he decried the huge powers of ""unelected tech oligarchs.""",DW (English),2025-03-03T12:30:00Z,https://www.dw.com/en/un-rights-chief-voices-concern-at-new-us-political-direction/a-71811637
"As DEI programs are scaled back in the US, could it happen here in Australia?","Workplaces in the US are witnessing a mass reversal of diversity, equity and inclusion programs following President Donald Trump's return to power. Could the same thing happen here in Australia?",ABC News (AU),2025-03-05T20:00:00Z,https://www.abc.net.au/news/2025-03-06/us-scale-backs-dei-under-trump-australian-workforce/104996490
Defense Department begins cutting workers this week,"Nearly 100 probationary employees were fired from the Defense Logistics Agency, and more defense cuts are expected.",CBS News,2025-03-05T21:35:22Z,https://www.cbsnews.com/news/defense-department-cutting-workers/
Frontiers of Knowledge Award Goes to Five Social Psychologists,"Source: Social Psychology Network News
The 17th BBVA Foundation Frontiers of Knowledge Award in Social Sciences has gone to five pioneering social psychologists—Icek Ajzen, Dolores Albarracín, Mahzarin Banaji, Anthony Greenwald, and Richard Petty—for ""revolu…",Frontiersofknowledgeawards-fbbva.es,2025-03-11T15:03:50Z,https://www.frontiersofknowledgeawards-fbbva.es/noticias/frontiers-knowledge-award-17-edition-social-sciences-to-social-psychologists-ajzen-albarracin-banaji-greenwald-petty/
"Meta fired 20 employees for leaking information, more firings expected","Meta fired about 20 employees because they had leaked “confidential information outside the company,” with more firings expected. Meta fired about 20 employees for leaking confidential information outside the company, with more firings expected. “We tell empl…",Securityaffairs.com,2025-03-02T09:07:23Z,https://securityaffairs.com/174798/social-networks/meta-fired-20-employees-for-leaking-information.html
"‘Really is the best AI’: Left-wingers warm up to Grok as it shares brutal anti-Trump, Musk replies","Left-wing critics of Elon Musk are warming up to the billionaire's artificial intelligence (AI) program, Grok, after getting it to dish out anti-Musk and anti-Trump comments.


""Thank you for being honest @grok,"" posted one person, along with Grok stating tha…",The Daily Dot,2025-03-18T20:24:04Z,https://www.dailydot.com/debug/grok-elon-musk-donald-trump/
"China, Russia eager to fill void as Trump axes US-funded media","Washington (AFP) Mar 18, 2025


 As President Donald Trump moves to axe Voice of America and other US-funded media, China and Russia are eager to fill the void. 

The targeting of VOA, Radio Free Europe and Radio Free Asia not only freezes some of the most do…",Spacewar.com,2025-03-19T13:19:16Z,https://www.spacewar.com/reports/China_Russia_eager_to_fill_void_as_Trump_axes_US-funded_media_999.html
Prosecuted Romanian presidential candidate asks Trump for help,"The US president should stop an assault on democracy launched by the Romanian “deep state,” Calin Georgescu has said Read Full Article at RT.com",RT,2025-02-27T20:01:45Z,https://www.rt.com/news/613414-prosecuted-romanian-politician-trump-help/
Indonesians seek escape as anger rises over quality of life,"Indonesian private tutor Patricia has been learning German for two years, armed with a dream of leaving for Europe and driven by a lack of opportunities...",Yahoo Entertainment,2025-03-10T05:29:04Z,https://www.yahoo.com/news/indonesians-seek-escape-anger-rises-052904109.html
Trump’s Pick to Head NIH Did Not Follow the COVID-19 Herd,"WASHINGTON–When Stanford epidemiologist Jay Bhattacharya challenged COVID-19 lockdown orthodoxy in 2020, critics glued posters of his face across the campus–which he saw as an incitement... Read More
The post Trump’s Pick to Head NIH Did Not Follow the COVID-…",Daily Signal,2025-03-11T12:00:00Z,https://www.dailysignal.com/2025/03/11/trumps-pick-head-nih-did-not-follow-covid-herd/
Righteous Attacks Bringing the Left to Heel,"Democrat leaders like Senator Chuck Schumer message thinly veiled threats of violence to their (increasingly small) number of followers. They are responding in counterproductive ways like torching and defacing Tesla cars and trucks, vehicles mos...",Americanthinker.com,2025-03-23T04:00:00Z,https://www.americanthinker.com/articles/2025/03/righteous_attacks_bringing_the_left_to_heel.html
Oversimplified efforts to counter health misinformation are missing the mark,"Public health solutions to health misinformation need to recognise the complex, structural nature of the online information environment, write Tina D Purnat and Jocalyn Clark 

Health misinformation and harmful online narratives are a major threat to public h…",The BMJ,2025-02-27T10:46:10Z,https://www.bmj.com/content/388/bmj.r393
Canadian PM Candidate Freeland Says UK Nuclear Weapons Could Protect Canada Against Trump,"Chrystia Freeland, a leading candidate to replace Canadian Prime Minister Justin Trudeau at the helm of the governing Labour Party, has suggested that Britain and France could be called on to provide a nuclear deterrent against the United States.
The post Can…",Breitbart News,2025-03-05T12:35:56Z,https://www.breitbart.com/europe/2025/03/05/canadian-pm-candidate-says-uk-nuclear-weapons-could-protect-canada-against-trump/
"China, Russia eager to fill void as Trump axes US-funded media","As President Donald Trump moves to axe Voice of America and other US-funded media, China and Russia are eager to fill the void.The targeting of VOA, Radio Free Europe and Radio Free Asia not only freezes some of the most dogged reporting on countries with hea…",Raw Story,2025-03-18T14:42:03Z,https://www.rawstory.com/china-russia-eager-to-fill-void-as-trump-axes-us-funded-media/
Politico-Scientific Responses to the Current Pandemic: An Update Based on a Retrospective by Anthony Fauci and Gregory Folkers,Anthony Fauci and Gregory Folkers take a stab at delineating what HIV/AIDS and COVID-19 have taught us about pandemic responses,Nakedcapitalism.com,2025-03-12T10:54:04Z,https://www.nakedcapitalism.com/2025/03/politico-scientific-responses-to-the-current-pandemic-an-update-based-on-a-retrospective-by-anthony-fauci-and-gregory-folkers.html
Dutton confident he can find 'common ground' with Trump,The opposition leader has also escalated his criticism of China and taken aim at the prime minister's willingness to send peacekeeping troops to Ukraine in a major foreign policy speech at the Lowy Institute.,ABC News (AU),2025-03-20T04:38:26Z,https://www.abc.net.au/news/2025-03-20/dutton-confident-of-common-ground-with-trump/105076752
WWE Exec Linda McMahon Is Poised to Oversee the End of the Department of Education,"In President Donald Trump’s meritocracy, you apparently don’t need much educational experience to run the Department of Education.  The Republican-controlled Senate on Monday confirmed former wrestling exec and billionaire Linda McMahon as the next Secretary …",Mother Jones,2025-03-04T00:25:20Z,https://www.motherjones.com/politics/2025/03/linda-mcmahon-confirmed-poised-oversee-end-trumps-education-department/
Report: Venezuela Made over $8 Billion on Drug Trafficking in 2024,"Drug trafficking generated more than $8.2 billion in Venezuela in 2024, according to a report published by the non-government organization Transparencia Venezuela on Wednesday.
The post Report: Venezuela Made over $8 Billion on Drug Trafficking in 2024 appear…",Breitbart News,2025-03-20T16:30:16Z,https://www.breitbart.com/latin-america/2025/03/20/report-venezuela-made-over-8-billion-on-drug-trafficking-in-2024/
RFK Jr. dismantles ideological HHS grants targeting “vaccine hesitancy” — signaling a new era of scientific integrity,"In a bold move, Robert F. Kennedy Jr. terminates NIH-funded studies aimed at manipulating public opinion on vaccines, prioritizing safety and transparency over ideological agendas. • RFK Jr. cancels 33 NIH grants focused on combating vaccine hesitancy, with n…",Naturalnews.com,2025-03-14T06:00:00Z,https://www.naturalnews.com/2025-03-14-rfk-jr-dismantles-ideological-hhs-grants-targeting-vaccine-hesitancy.html
The role of masks and respirators in preventing respiratory infections in healthcare and community settings,"AbstractThe covid-19 pandemic saw frequent changes and conflicts in mask policies and politicization of masks. On reviewing the evidence, including studies published after the pandemic, the data suggest respirators are more effective than masks in healthcare,…",The BMJ,2025-02-27T12:16:13Z,https://www.bmj.com/content/388/bmj-2023-078573
