title,description,source,published_date,url,bert_label
"What to Know About Marty Makary, Trump’s Pick to Lead the FDA","If confirmed, Makary would run one of the country’s leading health agencies, overseeing the regulation of drugs, medical devices, and food.",Time,2025-03-06T13:26:04Z,https://time.com/7265012/marty-makary-trump-nominee-fda/,strongly pro-regulation
How to Spot ADHD Misinformation on TikTok,"With limited access to mental health care, people looking for answers about ADHD are turning to TikTok, where information is frequently misleading or inaccurate",Scientific American,2025-03-19T18:20:00Z,https://www.scientificamerican.com/article/how-to-spot-adhd-misinformation-on-tiktok/,anti-regulation
OpenAI Faces Privacy Complaint in Norway Over ChatGPT's Defamatory 'Hallucinations',"OpenAI, the organization behind the AI chatbot ChatGPT, is confronting a privacy complaint in Norway due to the chatbot generating false and defamatory information about an individual. This incident highlights ongoing concerns […]
Thank you for being a Ghacks…",Ghacks Technology News,2025-03-20T11:34:36Z,https://www.ghacks.net/2025/03/20/openai-faces-privacy-complaint-in-norway-over-chatgpts-defamatory-hallucinations/,anti-regulation
The Challenge Of Managing AI Risks: Innovation Vs. Oversight,"Can global regulatory alignment ever be achieved, or will businesses face a fragmented patchwork of compliance requirements?",Forbes,2025-03-18T13:15:00Z,https://www.forbes.com/councils/forbestechcouncil/2025/03/18/the-challenge-of-managing-ai-risks-innovation-vs-oversight/,strongly pro-regulation
Amy Klobuchar's Health Misinformation Act Has Aged Poorly,"By the summer of 2021, the COVID-19 pandemic had entered a new phase. Vaccines were widely available for those who wanted them, and coronavirus cases had",Reason,2025-03-06T15:17:45Z,https://reason.com/2025/03/06/amy-klobuchars-health-misinformation-act-has-aged-poorly/,anti-regulation
Guardrails For AI Governance In Today’s Shifting Regulatory Landscape,Many enterprise leaders feel poorly equipped to handle the risks that AI poses to their business on their own – concerns that inevitably stream down to consumers.,Forbes,2025-03-25T14:00:00Z,https://www.forbes.com/sites/garydrenik/2025/03/25/guardrails-for-ai-governance-in-todays-shifting-regulatory-landscape/,strongly pro-regulation
Ex-NSA boss: Good news. Election security focus helped dissuade increase in Russian meddling with US,"Plus AI in the infosec world, why CISA should know its place, and more
Interview Russia appears to be having second thoughts on how aggressively, or at least how visibly, it attempts to influence American elections, according to a former head of the NSA.…<!--…",Theregister.com,2025-03-23T13:04:07Z,https://www.theregister.com/2025/03/23/nsa_rogers_russia/,weakly pro-regulation
Most social media medical advice is misinformation,"Most health-related social media posts from top influencers are misleading, lack medical evidence, and are biased by financial backing, a new study shows. What can you do to protect yourself against misinformation?",DW (English),2025-02-27T14:51:00Z,https://www.dw.com/en/most-social-media-medical-advice-is-misinformation/a-71773131,anti-regulation
California Dropped Part Of Social Media Law After Musk Challenge,X has previously convinced a federal appeals court that forcing social media companies to disclose their content moderation and other policies was unconstitutional.,Forbes,2025-03-03T18:55:02Z,https://www.forbes.com/sites/petersuciu/2025/03/03/california-dropped-part-of-social-media-law-after-musk-challenge/,anti-regulation
China will enforce clear flagging of all AI generated content starting from September,The Cyberspace Administration of China just released regulations that requires the explicit marking of AI-generated content — both visually and in its metadata.,Tom's Hardware UK,2025-03-16T16:08:51Z,https://www.tomshardware.com/tech-industry/artificial-intelligence/china-will-enforce-clear-flagging-of-all-ai-generated-content-starting-from-september,strongly pro-regulation
How AI Is Changing The Way We Communicate: The Future Of Interaction,"From personalized chatbots to speech recognition systems, AI is fundamentally altering how we interact with both machines and other people.",Forbes,2025-03-05T12:00:00Z,https://www.forbes.com/councils/forbescommunicationscouncil/2025/03/05/how-ai-is-changing-the-way-we-communicate-the-future-of-interaction/,strongly pro-regulation
"AI Agent Manus Sparks Debate On Ethics, Security And Oversight",While many in the AI sector cheer this next-level of AI independence — at least one group of researchers think autonomous AI agents like Manus should not be created.,Forbes,2025-03-14T13:08:28Z,https://www.forbes.com/sites/torconstantino/2025/03/14/ai-agent-manus-sparks-debate-on-ethics-security-and-oversight/,weakly pro-regulation
WGA Zeroes In On AI Protections In CBS News Contract Negotiations To “Safeguard Journalism As A Profession”,"Artificial intelligence is taking center stage in yet another set of union negotiations as the Writers Guild of America began talks this week with CBS News on a new collective bargaining agreement. The WGA represents 270 news writers, producers, promotions wr…",Deadline,2025-03-13T21:40:43Z,http://deadline.com/2025/03/wga-cbs-news-contract-negotiations-ai-protections-1236325705/,anti-regulation
Why is X suing the Indian government as Musk woos Modi?,X has filed a lawsuit alleging that New Delhi is unlawfully censoring content online.,Al Jazeera English,2025-03-22T14:26:39Z,https://www.aljazeera.com/news/2025/3/22/why-is-x-suing-the-indian-government-as-musk-woos-modi,anti-regulation
TikTok health traps: How influencers give you bad advice,"Most health-related social media posts from top influencers are misleading, lack medical evidence, and are biased by financial backing, a new study shows. What can you do to protect yourself against misinformation?",DW (English),2025-02-28T13:03:00Z,https://www.dw.com/en/tiktok-health-traps-how-influencers-give-you-bad-advice/a-71773131,anti-regulation
AI And Copyright: Expanding Copyright Hurts Everyone—Here’s What to Do Instead,"You shouldn’t need a permission slip to read a webpage—whether you do it with your own eyes, or use software to help. AI is a category of general-purpose tools with myriad beneficial uses. Requiring developers to license the materials needed to create this te…",Techdirt,2025-02-28T18:43:29Z,https://www.techdirt.com/2025/02/28/ai-and-copyright-expanding-copyright-hurts-everyone-heres-what-to-do-instead/,anti-regulation
How poor sleep could fuel belief in conspiracy theories,By prioritising good sleep we may be able to boost our ability to think critically and resist misinformation.,The Conversation Africa,2025-03-12T14:42:07Z,https://theconversation.com/how-poor-sleep-could-fuel-belief-in-conspiracy-theories-251669,anti-regulation
Zach Vorhies: Google whistleblower predicts the decline of Google’s influence,"Zach Vorhies, in an interview, predicts Google’s declining influence amid growing scrutiny over political censorship and misinformation, suggesting decentralized and AI technologies could render its business model obsolete. The Trump administration is intensi…",Naturalnews.com,2025-03-06T06:00:00Z,https://www.naturalnews.com/2025-03-06-google-whistleblower-predicts-decline-of-googles-influence.html,anti-regulation
ChatGPT alleged that an innocent man killed his kids: report,"I’m a big fan of AI chatbots like Google Gemini and ChatGPT. Unfortunately, they don’t always get things right. An Austrian advocacy group, Noyb, has filed a complaint against OpenAI for wrongly stating that a Norwegian man was a murderer. When a Norwegian ma…",MobileSyrup,2025-03-20T15:07:10Z,https://mobilesyrup.com/2025/03/20/chatgpt-innocent-man-killed-his-kids/,anti-regulation
Californiaâs social media censorship law struck down: A victory for free speech or a threat to online safety?,"California’s Assembly Bill 587 (AB 587), a controversial social media transparency law, has been significantly weakened by the courts. The ruling, following a legal challenge by Elon Musk’s X (formerly Twitter), preserves only minimal reporting requirements. …",Naturalnews.com,2025-03-06T06:00:00Z,https://www.naturalnews.com/2025-03-06-californias-social-media-censorship-law-struck-down.html,anti-regulation
Stablecoins Are a Vital Innovation That Risk Being Crushed by Misguided Fear,"Rather than embracing innovation, Senator Elizabeth Warren pursues legislation that would smother stablecoins in their infancy.",CoinDesk,2025-03-13T13:46:52Z,https://www.coindesk.com/opinion/2025/03/13/stablecoins-are-a-vital-innovation-that-risk-being-crushed-by-misguided-fear,strongly pro-regulation
Why Critical Thinking Is Your Best Weapon Against The Coming Deepfake Tsunami,"Deepfake technology is evolving faster than detection tools can keep pace, creating unprecedented business risks, including fraud and disinformation.",Forbes,2025-03-21T06:30:00Z,https://www.forbes.com/sites/bernardmarr/2025/03/21/why-critical-thinking-is-your-best-weapon-against-the-coming-deepfake-tsunami/,strongly pro-regulation
"How Project 2025, which Trump disavowed, is shaping his health policies",During his campaigning Trump denied he had read the right-wing wish list. Has he shifted his strategy?,Al Jazeera English,2025-02-27T12:59:27Z,https://www.aljazeera.com/news/2025/2/27/how-project-2025-which-trump-disavowed-is-shaping-his-health-policies,strongly pro-regulation
Is Grok 3 Most Powerful AI – Hype vs. Reality in 2025,"Elon Musk’s xAI claims Grok 3 most powerful AI, to dethrone GPT-5 and Claude 4 but benchmarks, transparency gaps, and practical use cases tell a murkier",Smashingapps.com,2025-02-27T20:50:18Z,https://www.smashingapps.com/is-grok-3-most-powerful-ai/,strongly pro-regulation
Japan gov't OKs bill that allows state to advise firms over AI risks,"The government on Friday approved a bill allowing the state to assess cases of misuse of artificial intelligence and advise firms on the issue, in what would be Japan's first legislation dedicated to the rapidly spreading technology. The government hopes to r…",Japan Today,2025-02-28T21:11:21Z,https://japantoday.com/category/politics/japan-gov%27t-oks-bill-that-allows-state-to-advise-firms-over-ai-risks,neutral
The country that has banned Facebook overnight to stop ‘hate speech and porn’,Ban reportedly enforced without informing country’s own IT regulator,The-independent.com,2025-03-26T10:10:05Z,https://www.the-independent.com/tech/papua-new-guinea-png-facebook-ban-b2721752.html,anti-regulation
Spain Leads EU in AI Regulation: Unlabeled Deepfakes Could Cost Millions,"Spain is the first EU country to enforce AI Act regulations, introducing fines for unlabeled deepfake content and biometric data misuse.
The post Spain Leads EU in AI Regulation: Unlabeled Deepfakes Could Cost Millions appeared first on MEDIANAMA.",MediaNama.com,2025-03-12T12:02:38Z,https://www.medianama.com/2025/03/223-spain-leads-eu-in-ai-regulation-unlabeled-deepfakes-could-cost-millions/,anti-regulation
EU watchdogs scrutinizing OKX over $100M in Bybit laundered funds: Report,"European Union regulators are reportedly looking into a service offered by crypto exchange OKX that may have played a role in the laundering of $100 million in funds from the Bybit hack, according to Bloomberg.A March 11 Bloomberg report citing people familia…",Cointelegraph,2025-03-11T19:58:04Z,https://cointelegraph.com/news/eu-watchdogs-scrutinizing-okx-100m-bybit-laundered-funds,anti-regulation
Jacky Law’s “Big Pharma” examines the pharmaceutical industry’s practices and their impact on global health,"The pharmaceutical industry has revolutionized healthcare with life-saving treatments but is often criticized for prioritizing profits over public health, as explored in Jacky Law’s book “Big Pharma: Exposing the Global Healthcare Agenda.” The book highlights…",Naturalnews.com,2025-03-15T06:00:00Z,https://www.naturalnews.com/2025-03-15-book-examines-pharma-industry-practices-impact-global-health.html,strongly pro-regulation
"As DEI programs are scaled back in the US, could it happen here in Australia?","Workplaces in the US are witnessing a mass reversal of diversity, equity and inclusion programs following President Donald Trump's return to power. Could the same thing happen here in Australia?",ABC News (AU),2025-03-05T20:00:00Z,https://www.abc.net.au/news/2025-03-06/us-scale-backs-dei-under-trump-australian-workforce/104996490,anti-regulation
"AI In Fintech: Regulations, Opportunities, Ethical Imperatives","Discover how AI is reshaping fintech through cutting-edge solutions, regulatory changes and ethical insights. Learn to balance innovation, compliance, and consumer trust.",Forbes,2025-03-06T04:57:44Z,https://www.forbes.com/sites/zennonkapron/2025/03/05/ai-in-fintech-regulations-opportunities-ethical-imperatives/,strongly pro-regulation
'We should be pretty worried': Even AI struggles to tell fake from real content,"Detectors that are used to uncover deepfake images have ‘major vulnerabilities’ when used on videos they weren’t trained on, and can't keep up with the volume of AI images being generated, a new study suggests.",ABC News (AU),2025-03-16T19:00:00Z,https://www.abc.net.au/news/science/2025-03-17/deepfake-detectors-ai-generators-fight/105046368,anti-regulation
Rise of the ‘fit-fluencer’: ‘They’re not your doctor or your trainer. They’re someone looking for your attention’,Experts say a growing amount of health misinformation is being shared online in the form of exercise and diet advice that’s not backed by science,The Irish Times,2025-03-15T06:00:00Z,https://www.irishtimes.com/ireland/2025/03/15/rise-of-the-fit-fluencer-on-social-media-theyre-not-your-doctor-or-your-trainer-theyre-someone-looking-for-your-attention/,anti-regulation
CFOs Must Be The Voice Of Reason Amid Tariff Turmoil,"Whether tariffs are wielded as a negotiation tool or punitive measure, they raise difficult questions for companies. CFOs are ideally positioned to provide answers with a fact-based perspective.",Forbes,2025-03-26T10:00:00Z,https://www.forbes.com/sites/jimdeloach/2025/03/26/cfos-must-be-the-voice-of-reason-amid-tariff-turmoil/,neutral
Proposed 'weather control' bans surge across US states,"Washington (AFP) Feb 27, 2025


 Fake stories that atmospheric experiments are triggering natural disasters have led to US states pushing blanket bans on weather modification, which experts say may jeopardize current local scientific programs and hinder futur…",Space Daily,2025-02-28T13:29:03Z,https://www.spacedaily.com/reports/Proposed_weather_control_bans_surge_across_US_states_999.html,anti-regulation
AI Transparency and Ethics: Building Customer Trust in AI Systems,"Trust in AI starts with transparency.
Continue reading...",CMSWire,2025-02-28T13:13:25Z,https://www.cmswire.com/ai-technology/ai-transparency-and-ethics-building-customer-trust-in-ai-systems/,strongly pro-regulation
Protection of personal data part of right to privacy: Gavai,"Justice B R Gavai emphasized the integral role of personal data protection in the digital age as part of the right to privacy and life. Addressing challenges like misinformation, online harassment, and emerging technologies, he highlighted the need for judici…",The Times of India,2025-03-10T22:52:43Z,https://timesofindia.indiatimes.com/india/protection-of-personal-data-part-of-right-to-privacy-gavai/articleshow/118862704.cms,strongly pro-regulation
Are Microplastics Bad For Your Health? More Rigorous Science is Needed,"An anonymous reader shares a Nature story: In March last year, researchers found that among a group of nearly 300 participants, people who had higher concentrations of plastics in deposits of fat in their arteries (arterial plaques) were more likely to experi…",Slashdot.org,2025-03-10T18:51:00Z,https://science.slashdot.org/story/25/03/10/1851249/are-microplastics-bad-for-your-health-more-rigorous-science-is-needed,neutral
Digest: Outsmart Calls for Governmental Intervention in OOH; UK to Ease Digital Tax on US Tech Groups?,"In today's Digest, we look at Outsmart's plea to the UK Government to intervene in the OOH sector, the UK Government considering changes to its taxes on big Tech firms and the British public's support for AI laws.
Outsmart Calls on [...]
The post Digest: Outs…",ExchangeWire,2025-03-26T08:09:22Z,https://www.exchangewire.com/blog/2025/03/26/digest-outsmart-calls-for-governmental-intervention-uk-to-ease-digital-tax-on-us-tech-groups/,anti-regulation
The Bias Of Being Wrong,"In domains where I have strong opinions, I spend a lot of time confidently arguing for those opinions and criticising views I think are mistaken. I spend much less time contemplating the possibility I’m deeply mistaken. Even when people tell me I’m wrong—a co…",Conspicuouscognition.com,2025-03-20T17:31:00Z,https://www.conspicuouscognition.com/p/the-everyone-is-biased-bias,anti-regulation
War and Peace in Munich,"On the first morning of the Munich Security Conference, February 14, I arrived at the press office to request an escort to enter the Bayerischer Hof, the opulent hotel that hosts this annual convening of politicians, generals, weapons manufacturers, and techn…",The New York Review of Books,2025-03-06T16:00:00Z,https://www.nybooks.com/online/2025/03/06/war-and-peace-in-munich/,strongly pro-regulation
Independent Agencies Oversee Elections and Media. Trump’s Seizing Their Reins.,A little-noticed executive order may in the long run have the largest impact on US democracy.,Truthout,2025-03-08T15:49:23Z,https://truthout.org/articles/independent-agencies-oversee-elections-and-media-trumps-seizing-their-reins/,anti-regulation
X marks a spot for content-blockers: Why Elon Musk’s platform is taking GoI to court,"Karnataka High Court will hear a case involving X (formerly Twitter) alleging the Government of India is misusing Section 79 of the IT Act to block online content, instead of following the legally mandated Section 69A. The outcome could redefine India's onlin…",Economictimes.com,2025-03-25T19:32:26Z,https://m.economictimes.com/opinion/et-commentary/x-marks-a-spot-for-content-blockers-why-elon-musks-platform-is-taking-goi-to-court/articleshow/119496964.cms,anti-regulation
Chief Legal Officers: The Expanded Purview Of A Trusted Advisor,"This article examines the expanded scope and value of the CLO as enterprise trusted advisor during a time of constant change, increased risk, and geopolitcal tension.",Forbes,2025-03-24T11:01:39Z,https://www.forbes.com/sites/markcohen1/2025/03/24/chief-legal-officers-the-expanded-purview-of-a-trusted-advisor/,strongly pro-regulation
Kennedy spends first month as health secretary downplaying vaccines and targeting food additives,"A month into his role as health and human services secretary, Robert F. Kennedy Jr.'s moves on vaccines have worried health experts.",NBC News,2025-03-14T17:12:42Z,https://www.nbcnews.com/health/health-news/kennedy-first-month-health-secretary-vaccines-food-additives-rcna196042,anti-regulation
Sanders: Trump Cabinet Picks Are Nearly Irrelevant With Musk in Charge,"“If you want to discuss policies in the Department of Labor, let’s bring in the real secretary,” Sanders said.",Truthout,2025-02-27T22:21:37Z,https://truthout.org/articles/sanders-trump-cabinet-picks-are-nearly-irrelevant-with-musk-in-charge/,neutral
"AI Governance in India: Bold Promises, Unanswered Questions","MeitY underlined its commitment to ""AI for all"" and its aim to balance innovation and skill development with privacy and ethical concerns in a response to a Lok Sabha question on AI governance. 
The post AI Governance in India: Bold Promises, Unanswered Quest…",MediaNama.com,2025-03-13T09:16:19Z,https://www.medianama.com/2025/03/223-ai-governance-in-india-bold-promises-unanswered-questions/,weakly pro-regulation
India should take advantage of open-source AI model: Joel Kaplan of Meta,"Open-source models really democratise access to the technology and provide a much greater opportunities for developers, entrepreneurs, governments to build upon and modify the foundational model, says Joel Kaplan",BusinessLine,2025-03-18T15:16:34Z,https://www.thehindubusinessline.com/info-tech/india-should-take-advantage-of-open-source-ai-model-joel-kaplan-of-meta/article69345299.ece,neutral
Here’s How the Right Is Packaging Its Conspiracies in Environmentalism,"When public health problems aren’t met with structural solutions, conspiracies cloaked in green rhetoric can flourish.",Truthout,2025-03-22T15:20:41Z,https://truthout.org/articles/heres-how-the-right-is-packaging-its-conspiracies-in-environmentalism/,strongly pro-regulation
We Analyzed What TikTok Says About Medical Tests And Got a Nasty Shock,"When Kim Kardashian posted on Instagram about having had a full-body MRI, she enthused that the test can be ""life saving"", detecting diseases in the earliest stages before symptoms arise.",ScienceAlert,2025-02-28T23:30:32Z,https://www.sciencealert.com/we-analyzed-what-tiktok-says-about-medical-tests-and-got-a-nasty-shock,anti-regulation
Deepfakes: Delhi High Court grants panel 3 months for comprehensive report,"The Delhi High Court has given a committee more time to examine deepfake issues, asking them to consider petitioners' suggestions. Three petitions highlight the threat of deepfake technology's misuse and seek regulation and restrictions. The committee's repor…",The Times of India,2025-03-24T12:52:39Z,https://economictimes.indiatimes.com/news/india/deepfakes-delhi-high-court-grants-panel-3-months-for-comprehensive-report/articleshow/119427449.cms,neutral
"PyroWorld: The Next Evolution in Hybrid Crypto Exchange – Licensed, Secure, and Expanding with AI & OTC Solutions","PyroWorld is preparing for MiCA compliance, reinforcing its position as a trusted European hybrid exchange. PyroWorld is preparing for MiCA compliance, reinforcing its position as a trusted European hybrid exchange.",GlobeNewswire,2025-03-12T11:49:00Z,https://www.globenewswire.com/news-release/2025/03/12/3041282/0/en/PyroWorld-The-Next-Evolution-in-Hybrid-Crypto-Exchange-Licensed-Secure-and-Expanding-with-AI-OTC-Solutions.html,strongly pro-regulation
India Needs to De-weaponize Misinformation,Indian law needs to fix the meaning of fake news and misinformation and needs to be tied to the public interest rather than to the interest of the state.,The Diplomat,2025-03-17T14:14:00Z,https://thediplomat.com/2025/03/india-needs-to-de-weaponize-misinformation/,anti-regulation
"Covid: The New, “New Deal” Revisionism Is Already Starting","As a history teacher and an economist, it never ceases to amaze me at the success of certain historical myths (in this case, defined as verifiably untrue beliefs) have come to dominate popular understanding. Often it seems that no presentation of facts to the…",Shtfplan.com,2025-03-15T17:00:47Z,https://www.shtfplan.com/headline-news/covid-the-new-new-deal-revisionism-is-already-starting,strongly pro-regulation
"Can Lawyers Promote Themselves Online? The Bar Council of India Says No, Warns Against Legal Advertising","Despite the ambiguity regarding sharing and advertising, the BCI has warned lawyers of disciplinary action for violating Rule 36 of BCI Rules if they advertise on digital platforms
The post Can Lawyers Promote Themselves Online? The Bar Council of India Says …",MediaNama.com,2025-03-18T11:50:01Z,https://www.medianama.com/2025/03/223-the-bar-council-of-india-warns-against-legal-advertising-online/,anti-regulation
The Take It Down Act: A Censorship Weapon Disguised as Protection,"A shoot-first-ask-questions-later censorship mechanism with no recourse. If you’re tired of censorship and surveillance, join Reclaim The Net. President Trump has thrown his support behind the Take It Down Act, a bill designed to combat the spread of non-cons…",Activistpost.com,2025-03-13T20:00:00Z,https://www.activistpost.com/the-take-it-down-act-a-censorship-weapon-disguised-as-protection/,anti-regulation
AI’s existential risks: Separating hype from reality,"In “2001: A Space Odyssey,” the HAL 9000 was built to be infallible. Instead, it became dangerously misaligned with its human operators: It prioritized its survival over the humans’ safety. Though today’s artificial intelligence systems aren’t sentient, the c…",SiliconANGLE News,2025-03-08T18:48:22Z,https://siliconangle.com/2025/03/08/ais-existential-risks-separating-hype-reality/,strongly pro-regulation
Social media isn’t your financial advisor: 5 reasons to be cautious,The Indian stock market has been on a roll over the past few years. This has given rise to several social media platforms sharing stock tips and market insights. A famous class of ‘Finfluencers’ have emerged out of the fame the stock market has earned over th…,Livemint,2025-03-12T07:36:51Z,https://www.livemint.com/money/personal-finance/social-media-isn-t-your-financial-advisor-5-reasons-to-be-cautious-11741757676770.html,anti-regulation
Proposed ‘weather control’ bans surge across US states,"Fake stories that atmospheric experiments are triggering natural disasters have led to US states pushing blanket bans on weather modification, which experts say may jeopardize current local scientific programs and hinder future research. From recent deadly fl…",Digital Journal,2025-02-27T01:22:49Z,https://www.digitaljournal.com/world/proposed-weather-control-bans-surge-across-us-states/article,anti-regulation
