title,description,source,published_date,url,bert_label
DOGE Is Putting Major Government Efficiency Projects at Risk,"In its apparent quest to cut government spending and improve efficiency, DOGE has fired entire tech teams devoted to those very things.",Wired,2025-03-07T19:14:08Z,https://www.wired.com/story/doge-major-government-tech-projects-efficiency/,anti-regulation
EU Commission finds that Google Search and Play Store fail to comply with the Digital Markets Act,"Google has been under the EU Commission's fire since March 2024, and now two of its products have been found to breach the DMA.",Android Central,2025-03-19T19:19:27Z,https://www.androidcentral.com/apps-software/eu-commission-finds-that-google-search-and-play-store-fail-to-comply-with-dma,anti-regulation
"DOGE says it needs to know the government's most sensitive data, but can't say why","DOGE staffers have skirted privacy laws, training and security protocols to gain virtually unfettered access to financial and personal information stored in siloed government databases.",NPR,2025-03-26T13:00:00Z,https://www.npr.org/2025/03/26/nx-s1-5339842/doge-data-access-privacy-act-social-security-treasury-opm-lawsuit,neutral
Billions.Network launches universally accessible verification platform for humans and AI,"Billions.Network, intended to be a universal human and AI network, is launching to transform digital identity verification.",VentureBeat,2025-02-28T14:00:00Z,https://venturebeat.com/business/billions-network-launches-universally-accessible-verification-platform-for-humans-and-ai/,strongly pro-regulation
"For Just $33 on Amazon, You Can Turbocharge Your Home’s Wi-Fi (45% Off)",Save up to 45% on various bundles of Amazon eero mesh routers.,Gizmodo.com,2025-03-25T11:35:45Z,https://gizmodo.com/for-just-33-on-amazon-you-can-turbocharge-your-homes-wi-fi-45-off-2000580026,anti-regulation
"Humming along in an old church, the Internet Archive is more relevant than ever","The Trump administration's erasure of federal data has put the Internet Archive in the spotlight. The organization, with its small but mighty team, is working to help save the world's digital history.",NPR,2025-03-23T10:00:00Z,https://www.npr.org/2025/03/23/nx-s1-5326573/internet-archive-wayback-machine-trump,strongly pro-regulation
Control Ultimate Edition (PC Digital Download) $6,"*Fanatical [fanatical.com]* has *Control Ultimate Edition* (PC Digital Download) for *$5.99*. 
 
Note: Steam account/application required to redeem code/play game (free to join [steampowered.com]). 
...",Slickdeals.net,2025-03-05T23:26:04Z,https://slickdeals.net/f/18158632-control-ultimate-edition-pc-digital-download-6?utm_source=rss&utm_content=fp&utm_medium=RSS2,strongly pro-regulation
India's Battle to Control the Democracy Narrative,How the Modi government moved from improving its global democracy rankings to redefining democracy itself—turning narrative control into a governance strategy.,Theplankmag.com,2025-03-11T20:50:39Z,https://www.theplankmag.com/india-democracy-narrative,strongly pro-regulation
23andMe has filed for bankruptcy. Here is how to delete your data.,"23andMe's once-rising star has dimmed, leading some users to wonder what will happen to their genetic data — especially after it filed for bankruptcy.",Business Insider,2025-03-24T18:07:48Z,https://www.businessinsider.com/how-to-delete-your-23andme-data,anti-regulation
Protect Your Company from Escalating Foreign Cyber Threats - SPONSOR CONTENT FROM THREATLOCKER,Sponsor content from ThreatLocker.,Harvard Business Review,2025-03-18T16:30:18Z,https://hbr.org/sponsored/2025/03/protect-your-company-from-escalating-foreign-cyber-threats,strongly pro-regulation
"AI Search Engines Invent Sources for ~60% of Queries, Study Finds","Even when chatbots are provided direct quotes from real stories and asked for more information, they will often lie.",Gizmodo.com,2025-03-14T16:20:30Z,https://gizmodo.com/ai-search-engines-invent-sources-for-60-of-queries-study-finds-2000576155,weakly pro-regulation
Digital Art Fair Cancels 2025 Edition,"The 2025 edition of Hong Kong’s Digital Art Fair is officially cancelled, as per an announcement posted on Instagram last Sunday, with organizers attributing it to “reasons beyond its control,” though government officials later revealed that the fair failed t…",HYPEBEAST,2025-02-26T21:54:43Z,https://hypebeast.com/2025/2/digital-art-fair-cancels-2025-edition-hong-kong,anti-regulation
Oura brings the Ring 4 to Costco in the latest expansion to more health-focused users,"Next time you're looking at deals, look Oura's way while you're at it.",Android Central,2025-03-19T13:00:10Z,https://www.androidcentral.com/wearables/oura-ring-4-retail-expansion-to-costco-announced,strongly pro-regulation
Strings Attached: Talking about Russia's agenda for laws in cyberspace,"Russia's longstanding proposals for ""information security"" agreements may sound cooperative, but they conceal a Trojan horse - a push to legitimize censorship, silence dissent, and bind others to rules it won’t follow.",Bytesandborscht.com,2025-03-15T22:39:13Z,https://bytesandborscht.com/strings-attached-talking-about-russias-agenda-for-laws-in-cyberspace/,weakly pro-regulation
"What’s on your desk, Jennifer Pattison Tuohy?","Jennifer Pattison Tuohy is The Verge’s smart home reviewer, and she’s mind-bogglingly impressive in the number of devices she covers. As she says, “On any given day, I can be evaluating anything from robot vacuums, smart locks, and lights, to smart chicken co…",The Verge,2025-03-25T19:55:14Z,https://www.theverge.com/tech/634084/desk-home-office-jennifer-pattison-tuohy,anti-regulation
Signal president warns the hyped agentic AI bots threaten user privacy,"At SXSW, Signal President Meredith Whittaker warned about the 'profound' security risks to user privacy posed by agentic AI.",Business Insider,2025-03-08T21:34:32Z,https://www.businessinsider.com/signal-president-warns-privacy-threat-agentic-ai-meredith-whittaker-2025-3,anti-regulation
Microsoft Warns of StilachiRAT: A Stealthy RAT Targeting Credentials and Crypto Wallets,"Microsoft is calling attention to a novel remote access trojan (RAT) named StilachiRAT that it said employs advanced techniques to sidestep detection and persist within target environments with an ultimate aim to steal sensitive data.
The malware contains cap…",Internet,2025-03-18T07:00:00Z,https://thehackernews.com/2025/03/microsoft-warns-of-stilachirat-stealthy.html,anti-regulation
Aventon’s ACU: smart tech that makes your ride better,"Aventon / Aventon Too often, “smart” technology adds layers of complication. We’ve all dealt with gadgets that claim to be intuitive but actually make simple tasks painful. That’s exactly the opposite of what Aventon achieves with its Aventon Control Unit (AC…",Digital Trends,2025-03-12T13:00:47Z,https://www.digitaltrends.com/brc/aventons-acu-smart-tech-that-makes-your-ride-better/,strongly pro-regulation
Adobe previews AI generated PowerPoints from raw customer data with ‘Project Slide Wow’,"The fate of Project Slide Wow depends on user interest and engagement, as Adobe monitors social media conversations.",VentureBeat,2025-03-19T16:45:50Z,https://venturebeat.com/ai/adobe-previews-ai-generated-powerpoints-from-raw-customer-data-with-project-slide-wow/,strongly pro-regulation
"First Porn, Now Skin Cream? ‘Age Verification’ Bills Are Out Of Control","I’m old enough to remember when age verification bills were pitched as a way to ‘save the kids from porn’ and shield them from other vague dangers lurking in the digital world (like…“the transgender”). We have long cautioned about the dangers of these laws, a…",Techdirt,2025-03-14T17:41:29Z,https://www.techdirt.com/2025/03/14/first-porn-now-skin-cream-age-verification-bills-are-out-of-control/,anti-regulation
Is it safe to add my passport to Google Wallet?,Can you trust Google Wallet with your passport?,Android Police,2025-03-07T10:56:18Z,https://www.androidpolice.com/is-google-wallet-passport-safe/,neutral
Google finally fixes Gmail bugbear which has been around for years,"Consider this: has existed for 21 years. Over the years, there has been a notable difference between the mobile and web versions of the email service. However, that disparity may no longer be an issue. Signatures have long been a feature available on Gmail’s …",Digital Trends,2025-03-06T15:19:25Z,https://www.digitaltrends.com/mobile/google-finally-fixes-gmail-bugbear-which-has-been-around-for-years/,strongly pro-regulation
HealthNest: A Modern Medical App Design,"HealthNest: A Modern Medical App Design

 


 abduzeedo
 03/06 — 2025


 Explore the design of HealthNest, a modern medical app designed to simplify access to healthcare. Learn about its features, app design and UI/UX design.  
HealthNest is a user-friendly m…",Abduzeedo.com,2025-03-07T05:20:28Z,https://abduzeedo.com/node/88766,strongly pro-regulation
Ask Jerry: What happens if Google ignores the EU's DMA rules?,"Have a question about the tech in your life? If so, maybe we can get them answered!",Android Central,2025-03-24T20:06:44Z,https://www.androidcentral.com/apps-software/ask-jerry-what-happens-if-google-ignores-the-eus-dma-rules,anti-regulation
"Scamming the Scammers: Meet the Deepfake Granny, Digital Bots and YouTubers Fighting AI Fraud",The heroes have their own AI-powered army. I met the people (and machines) beating the cybercriminals at their own game.,CNET,2025-03-12T15:12:41Z,https://www.cnet.com/personal-finance/features/scamming-the-scammers-meet-the-digital-granny-bots-and-youtubers-fighting-ai-fraud/,anti-regulation
Toward a Passwordless Future,Privacy Guides is the most popular & trustworthy non-profit privacy resource to find privacy tools and learn about protecting your digital life.,Privacyguides.org,2025-03-08T23:29:14Z,https://www.privacyguides.org/articles/2025/03/08/toward-a-passwordless-future/,strongly pro-regulation
Visa’s AI edge: How RAG-as-a-service and deep learning are strengthening security and speeding up data retrieval,Visa has reduced data retrieval from hours to mere minutes and blocked $40 billion in fraud thanks to gen AI tools.,VentureBeat,2025-03-17T15:30:00Z,https://venturebeat.com/ai/visas-ai-edge-how-rag-as-a-service-and-deep-learning-are-strengthening-security-and-speeding-up-data-retrieval/,strongly pro-regulation
Social Media and Mental Health: How to Stay in Control,Tips for navigating the digital world without letting it control you.,Psychology Today,2025-03-21T19:49:14Z,https://www.psychologytoday.com/us/blog/the-clarity/202503/social-media-and-mental-health-how-to-stay-in-control,strongly pro-regulation
How to take back control after your data was breached,"So, your data was leaked by hackers. Well, you’re not the only one. We live in an era in which data breaches are a daily occurrence. And that’s both bad and good news. It’s bad for obvious reasons—no one wants to have their personal information exposed.




…",PCWorld,2025-03-17T09:00:00Z,https://www.pcworld.com/article/2626284/how-to-take-back-control-after-your-data-was-breached.html,strongly pro-regulation
10 Toyota and Lexus Models That Compete With the World's Most Luxurious Automakers,"These are the Toyota and Lexus models that take on the world’s most luxurious automakers, delivering unmatched style, performance, and comfort.",How-To Geek,2025-03-19T18:15:15Z,https://www.howtogeek.com/toyota-lexus-models-competing-with-luxurious-automakers/,strongly pro-regulation
"OpenAI unveils Responses API, open source Agents SDK, letting developers build their own Deep Research and Operator","OpenAI is also making its web search, file search, and computer use tools available directly through the Responses API.",VentureBeat,2025-03-11T17:23:56Z,https://venturebeat.com/programming-development/openai-unveils-responses-api-open-source-agents-sdk-letting-developers-build-their-own-deep-research-and-operator/,strongly pro-regulation
16 hijacked browser extensions expose 3.2 million users,Kurt the CyberGuy recommends deleting 16 browser extensions immediately in response to a report saying over 3.2 million web users were affected by a security breach.,Fox News,2025-03-08T14:00:08Z,https://www.foxnews.com/tech/16-hijacked-browser-extensions-expose-3-2-million-users,anti-regulation
Musk’s Madisonian Insight,The Department of Government Efficiency’s seizure of government databases is not just an act of bureaucratic reorganization. It is an act of constitutional restructuring.,The Atlantic,2025-03-13T11:00:00Z,https://www.theatlantic.com/ideas/archive/2025/03/doge-change-constitution/682019/,weakly pro-regulation
The search system in Gmail is about to get a lot less frustrating,"Gmail will let you quickly find emails by preferring results based on how frequently you chat with a person, the click frequency, and how recently it arrived.",Digital Trends,2025-03-21T06:30:26Z,https://www.digitaltrends.com/computing/emails-search-gmail-artificial-intelligence-update/,neutral
Concerns over AI threaten to extend current video game acting strike,More concerns over AI threaten to extend the SAG-AFTRA voice actor strike if an agreement can't be reached between the union and video game studios.,Digital Trends,2025-03-12T19:34:23Z,https://www.digitaltrends.com/gaming/concerns-over-ai-threaten-extend-current-video-game-acting-strike/,anti-regulation
Top 10 Compact & Effective Work Gear For An Efficient Work Routine & Organized Desk,"Top 10 Compact & Effective Work Gear For An Efficient Work Routine & Organized DeskIn today’s fast-paced digital world, a seamless work routine requires a well-organized and efficient workspace. Whether you’re a freelancer, remote worker, or in an office...",Yanko Design,2025-02-27T12:40:36Z,https://www.yankodesign.com/2025/02/27/top-10-compact-effective-work-gear-for-an-efficient-work-routine-organized-desk/,strongly pro-regulation
Free Report on Design Trends in Consumer Electronics,"For over 20 years, trend analysis firm PSFK has produced reports used by companies like Apple, BMW, Google and Target. They've recently released ""100 Ideas in Consumer Electronics,"" a comprehensive analysis of emerging trends in consumer electronics. Industri…",Core77.com,2025-03-11T13:00:00Z,https://www.core77.com/posts/135833/Free-Report-on-Design-Trends-in-Consumer-Electronics,weakly pro-regulation
Keep your number private with Surfshark’s Alternative Number,"Surfshark / Surfshark We get it. Your phone number is practically sacred these days. But every time you sign up for an online service, make a purchase on a marketplace, or download yet another social media app, you’re handing over that personal number to who …",Digital Trends,2025-02-27T14:00:00Z,https://www.digitaltrends.com/brc/keep-your-number-private-with-surfsharks-alternative-number/,anti-regulation
Living in the US? You can now measure your online data exposure for free,ExpressVPN has just launched a data scan service to help you take control of your personal information without spending a penny. Here's all you need to know.,TechRadar,2025-03-18T11:00:00Z,https://www.techradar.com/vpn/vpn-services/living-in-the-us-you-can-now-measure-your-online-data-exposure-for-free,neutral
"News Weekly: MWC wrap up, Nothing Phone 3a series launch, One UI 7 delays, and more","This week we look at some of the coolest innovations we came across at MWC, Nothing Phone 3a and 3a Pro launch, One UI 7 delays, Pixel's March feature drop, and OnePlus clarifying its update policy. Let's get into it.",Android Central,2025-03-08T11:00:00Z,https://www.androidcentral.com/phones/news-weekly-march-8-2025,anti-regulation
"News Weekly: Massive Pixel 10 leak, March update chaos, OnePlus ditching its Alert Slider, and more","This week we dive into a massive Pixel 10 leak that showed off all three models, Pixel users are scrambling after the latest March update, OnePlus has decided to ditch the alert slider, Android 16 Beta 3 arrives, and, the Gemini app gets new features.",Android Central,2025-03-15T12:00:00Z,https://www.androidcentral.com/apps-software/news-weekly-march-15-2025,anti-regulation
Embracing The Future: The Imperative Of A Unified Content Model In The Digital Age,"In order for enterprises to continue to survive and thrive in the current landscape, they need a centralized control plane—a unified front-end interface.",Forbes,2025-03-07T13:45:00Z,https://www.forbes.com/councils/forbestechcouncil/2025/03/07/embracing-the-future-the-imperative-of-a-unified-content-model-in-the-digital-age/,strongly pro-regulation
MWC 2025: The coolest (and weirdest) things we saw,We lost some of the most interesting products showcased at MWC 2025.,Android Central,2025-03-07T05:54:25Z,https://www.androidcentral.com/phones/mwc-2025-coolest-things-we-saw,strongly pro-regulation
UK watchdog investigates TikTok and Reddit over child data privacy concerns,"ICO looking at what data is used to serve up recommendations
The UK's data protection watchdog has launched three investigations into certain social media platforms following concerns about the protection of privacy among teenage users.…",Theregister.com,2025-03-03T12:23:24Z,https://www.theregister.com/2025/03/03/uk_regulator_investigates_tiktok_and/,anti-regulation
The Android Central team picks the best fitness apps and watches they can't do without,We spend most of our time reviewing new products; these are the fitness gadgets and apps we fall back on once our reviews are finished.,Android Central,2025-03-02T16:00:00Z,https://www.androidcentral.com/wearables/android-central-picks-best-fitness-apps-and-watches-they-cant-do-without,strongly pro-regulation
Magic: The Gathering creator Richard Garfield on designing Vanguard Exiles so you could play with dice if your computer died,"What can we learn about games by comparing the thrill of a nailgun kill in Quake to the elation of triple word score in online Scrabble? For Richard Garfield, creator of Magic: The Gathering and KeyForge, it's actually quite a bit.
Taking place over progressi…",Rock Paper Shotgun,2025-03-14T14:00:47Z,https://www.rockpapershotgun.com/magic-the-gathering-creator-richard-garfield-on-designing-vanguard-exiles-so-you-could-play-with-dice-if-your-computer-died,weakly pro-regulation
$16 billion health department managed its finances with a single Excel spreadsheet. It hasn’t gone well,"It's just one of 6,000 apps that New Zealand thinks might be best tamed with ERP
The body that runs New Zealand’s public health system uses a single Excel spreadsheet as the primary source of data to manage its finances, which aren’t in great shape perhaps du…",Theregister.com,2025-03-10T04:31:09Z,https://www.theregister.com/2025/03/10/nz_health_excel_spreadsheet/,anti-regulation
Android 16: everything you need to know,"Here's everything about Android 16, from its release date, to the list of eligible devices and features that make the cut for the final release.",Digital Trends,2025-03-21T18:00:43Z,https://www.digitaltrends.com/mobile/android-16-everything-you-need-to-know/,strongly pro-regulation
How your brain changes when you outsource it to AI,"My job, like many of yours, demands more from my brain than it is biologically capable of. For all its complexity, the human brain is frustratingly slow, running at about 10 bits per second — less bandwidth than a 1960s dial-up modem. That’s not enough to kee…",Vox,2025-03-07T20:15:47Z,https://www.vox.com/future-perfect/403100/ai-brain-effects-technology-phones,strongly pro-regulation
Elon enters the circus,"The shadow president paced around the stage after his speech, sunglasses on, mouth frozen in a grin, raising a chainsaw overhead to the delight of an adoring crowd as a large rectangular canvas made its way from the back of the audience toward him. He grabbed…",The Verge,2025-02-28T14:41:51Z,https://www.theverge.com/policy/620892/cpac-elon-musk-chainsaw-trump-steve-bannon,weakly pro-regulation
7 best Docker containers for home lab,Essential Docker containers for home lab enthusiasts,XDA Developers,2025-03-17T19:00:10Z,https://www.xda-developers.com/best-docker-containers-for-home-lab/,strongly pro-regulation
"I'll Never Use a So-Called ""Everything App""—and Neither Should You",Giving your personal data to one platform for the sake of convenience is never a good idea.,MakeUseOf,2025-03-01T12:00:16Z,https://www.makeuseof.com/everything-apps-privacy-risks/,anti-regulation
I wore the OnePlus Watch 3 and Galaxy Watch 7. Here’s the one to buy,"I've spent weeks with both the OnePlus Watch 3 and the Samsung Galaxy Watch 7. Both are excellent smartwatches, but one is the better buy.",Digital Trends,2025-03-18T19:00:53Z,https://www.digitaltrends.com/mobile/i-wore-the-oneplus-watch-3-and-galaxy-watch-7-heres-the-one-to-buy/,strongly pro-regulation
Oura Ring 5: Everything we want to see,"The Oura Ring 4 may be the best smart ring of 2025, but the Oura Ring 5 could take a bold new direction based on Oura's patents.",Android Central,2025-03-17T22:20:35Z,https://www.androidcentral.com/wearables/oura-ring-5,strongly pro-regulation
Toffler in China,The work of the eclectic American futurist exerted a profound and unanticipated influence on China's digital transformation since the 1980s.,The New York Review of Books,2025-03-20T12:00:00Z,https://www.nybooks.com/articles/2025/04/10/toffler-in-china-howard-french/,neutral
Thousands of misconfigured building access systems have been leaked online,"Crooks could access buildings that should be off limits, or even exploit them to steal sensitive information.",TechRadar,2025-02-28T15:32:00Z,https://www.techradar.com/pro/security/thousands-of-misconfigured-building-access-systems-have-been-leaked-online,anti-regulation
"China's Silk Typhoon, tied to US Treasury break-in, now hammers IT and govt targets","They're good at zero-day exploits, too
Silk Typhoon, the Chinese government crew believed to be behind the December US Treasury intrusions, has been abusing stolen API keys and cloud credentials in ongoing attacks targeting IT companies and state and local go…",Theregister.com,2025-03-05T17:22:03Z,https://www.theregister.com/2025/03/05/china_silk_typhoon_update/,anti-regulation
These headphones read your mind with the promise of helping you achieve better focus,"Tech has ruined your attention span, but will tech like the MW75 Neuro also restore it? Neurable thinks so!",Android Central,2025-03-18T12:00:30Z,https://www.androidcentral.com/accessories/headphones/neurable-mw75-neuro-brain-computer,strongly pro-regulation
"To Combat Debanking, Americans Must Have Control Of Their Financial Data","Whether it’s splitting the bill at dinner, investing in stocks, or using a budgeting app or crypto wallet, these services are powered by ‘open banking’ - or your abili...",Forbes,2025-03-17T18:54:12Z,https://www.forbes.com/sites/pennylee/2025/03/17/to-combat-debanking-americans-must-have-control-of-their-financial-data/,weakly pro-regulation
Google Home: 10 underrated but essential features every smart home user should know,"Google Home packs a punch, and here are some tips to get the most out of your app.",Android Police,2025-03-06T14:26:09Z,https://www.androidpolice.com/underrated-google-home-features-smart-home-automation/,strongly pro-regulation
Driving Asset Performance Management With Digital Technologies,"In today's interconnected world, industrial manufacturers face a constant battle—maximizing asset performance while minimizing downtime.",Forbes,2025-03-07T12:00:00Z,https://www.forbes.com/councils/forbestechcouncil/2025/03/07/driving-asset-performance-management-with-digital-technologies/,strongly pro-regulation
The secret to scrolling less,"I got my latest Screen Time report from Apple halfway through my daughter’s first day at Disney World. Waiting in line for rides, I’d been checking my phone reflexively, tapping app icons. Like many distracted parents, this triggered a pang of guilt that I wa…",Vox,2025-03-05T22:19:47Z,https://www.vox.com/technology/402701/screen-time-reports-instagram-tiktok-iphone,strongly pro-regulation
Who is the DOGE and X Technician Branden Spikes?,"At 49, Branden Spikes isn't just one of the oldest technologists who has been involved in Elon Musk's Department of Government Efficiency (DOGE). As the current director of information technology at X/Twitter and an early hire at PayPal, Zip2, Tesla and Space…",Krebs on Security,2025-03-07T00:54:40Z,https://krebsonsecurity.com/2025/03/who-is-the-doge-and-x-technician-branden-spikes/,anti-regulation
Feds name and charge alleged Silk Typhoon spies behind years of China-on-US attacks,"Xi's freelance infosec warriors apparently paid up to $75K to crack a single American inbox
US government agencies announced Wednesday criminal charges against alleged members of China's Silk Typhoon gang, plus internet domain seizures linked to a long-term C…",Theregister.com,2025-03-06T00:47:17Z,https://www.theregister.com/2025/03/06/fbi_china_pays_75k_per/,anti-regulation
The biggest multiplayer Xbox and PC gaming hit of the summer might come from the most unlikely place,"FBC Firebreak is a new multiplayer title from Remedy Entertainment, known historically for high-quality single player games. Can they find success in a crowded space? After seeing the game for myself, I believe the answer is yes.",Windows Central,2025-03-20T21:47:40Z,https://www.windowscentral.com/gaming/fbc-firebreak-preview,strongly pro-regulation
