lemmatized_text,bert_label
targeted country should demand accountability from the pentagon and platform for covid disinformation - tech policy press,anti-regulation
fact-checking misinformation about the los angeles wildfire and california water policy - pb newshour,anti-regulation
how russia invaded wikipedia - foreign policy,anti-regulation
algorithm reliability framework : policy for misinformation and fake news - brunel university news,pro-regulation
tracking the weaponization of america 's political system in favor of disinformation—and it export abroad - tech policy press,pro-regulation
there ’ s no dodge button for disinformation - foreign policy,anti-regulation
( pdf ) the disinformation playbook : how industry manipulates the science-policy process—and how to restore scientific integrity - researchgate,pro-regulation
‘ massive disinformation campaign ’ is slowing global transition to green energy - the guardian,anti-regulation
defending canada : the battle against ai-driven disinformation - policy option,pro-regulation
researcher say medium need generative ai policy to help navigate misinformation and disinformation - phys.org,anti-regulation
disinformation in poland – policy brief - visegrad insight,pro-regulation
russia ’ s global information operation have grown up - foreign policy,pro-regulation
meta face e.u . investigation over election disinformation - the new york time,anti-regulation
countering disinformation - welcome to the united nation,pro-regulation
b.c . election test new policy to protect election from digital threat - policy option,pro-regulation
"meta drop fact-checking , loosens it content moderation rule - techcrunch",anti-regulation
"dark force , fake news : how partisan attack undermine yoon ’ s unification policy - nk news",anti-regulation
government ’ s secret counter-disinformation policy revealed - big brother watch,pro-regulation
ama adopts new policy aimed at addressing public health disinformation - american medical association,neutral
evaluating anti-misinformation policy on social medium - cepr,pro-regulation
the rise of disinformation is a challenge and an opportunity for uk foreign policy - politicshome,pro-regulation
"arkansas public policy panel : 60th anniversary , battling disinformation - people 's action",pro-regulation
"whatsapp channel , used by million , ha no clear election rule - politico",anti-regulation
alberta ’ s conservative party invite climate disinformation into policy debate - corporate knight magazine,pro-regulation
stop the world : securing democracy : countering disinformation in 2024 - australian strategic policy institute,pro-regulation
how to counter disinformation based on science - tech policy press,pro-regulation
what the fate of the stanford internet observatory mean for disinformation research - tech policy press,pro-regulation
mathematical modeling of disinformation and effectiveness of mitigation policy - nature.com,pro-regulation
generative ai and disinformation - bipartisan policy center,pro-regulation
canadian election are threatened by disinformation - policy option,anti-regulation
india and taiwan 's divergent path to combat online disinformation - tech policy press,anti-regulation
australian medium need generative ai policy to help navigate misinformation and disinformation - rmit university,anti-regulation
"meta 's thread need a policy for election disinformation , voting group say - npr",anti-regulation
a short history of eu anti-disinformation policy - pubaffairs bruxelles,pro-regulation
trump call attempt to link him to project 2025 ‘ pure disinformation ’ - the hill,anti-regulation
european democracy and counter-disinformation : toward a new paradigm ? - carnegie endowment for international peace,pro-regulation
governor newsom sign nation-leading social medium transparency measure - office of governor gavin newsom,pro-regulation
disinformation on tiktok : research and content moderation policy - eu disinfolab,anti-regulation
disinformation on facebook : research and content moderation policy - eu disinfolab,anti-regulation
disinformation : anti-who convoy head to geneva for world health assembly - health policy watch,anti-regulation
fighting coronavirus misinformation and disinformation - center for american progress,pro-regulation
"from # yes2meat to beef checkoff , report show how to fight meat misinformation - green queen medium",anti-regulation
disinformation : reliable information is essential for democratic stability - george w. bush presidential center,pro-regulation
isd contributes to shaping the european commission 's dg-clima policy regarding climate mis- and disinformation - institute for strategic dialogue,pro-regulation
psychological inoculation strategy to fight climate disinformation across 12 country - nature.com,pro-regulation
disinformation on youtube : research and content moderation policy - eu disinfolab,anti-regulation
how to combat fake news and disinformation - brookings institution,pro-regulation
"terrorism , extremism , disinformation and artificial intelligence : a primer for policy practitioner - institute for strategic dialogue",pro-regulation
an update on our approach to u election misinformation - youtube official blog,anti-regulation
big tech roll back misinformation measure ahead of 2024 - axios,anti-regulation
how decade of disinformation about fossil fuel halted u.s. climate policy - npr,anti-regulation
deconstructing the israel-hamas disinformation war - atlantic council,anti-regulation
farmer ' protest exploited to spread fake news about eu climate policy : study nail european far right - eunews,anti-regulation
twitter will no longer enforce it covid misinformation policy - npr,anti-regulation
how social medium platform ’ community standard address influence operation - carnegie endowment for international peace,pro-regulation
combating disinformation wane at social medium giant ( published 2023 ) - the new york time,anti-regulation
a free pas for fake news ? the danger of meta ’ s new content policy - moneyweb,anti-regulation
disinformation on telegram : research and content moderation policy - eu disinfolab,anti-regulation
"april ’ s wild ride : twitter , pinterest move on disinformation , then elon musk happens - the equation",anti-regulation
an update on our work to keep people informed and limit misinformation about covid-19 - meta store,pro-regulation
disinformation isn ’ t just a problem for election - foreign policy,anti-regulation
assessing the problem of disinformation - tech policy press,pro-regulation
the west is still oblivious to russia ’ s information war - foreign policy,pro-regulation
safeguarding democracy against disinformation - german marshall fund,pro-regulation
information disorder - bipartisan policy center,anti-regulation
how longstanding iranian disinformation tactic target protest - the washington institute,anti-regulation
"twitter aim to crack down on misinformation , including misleading post about ukraine - npr",anti-regulation
how misinformation is distorting covid policy and behavior - brookings institution,anti-regulation
online platform content moderation service market survey - openpr,pro-regulation
the far right ’ s war on content moderation come to europe - tech policy press,anti-regulation
how trump ’ s executive order on online free speech could upend content moderation - marketplace,anti-regulation
content moderation in a new era for ai and automation - oversight board,pro-regulation
supreme court defers on state online content moderation law - roll call,anti-regulation
"facebook , tiktok harden eu commitment to tackle disinformation -- but not x - etbrandequity",anti-regulation
eff statement on meta 's announcement of revision to it content moderation process - eff,neutral
"a policy primer for free expression and content moderation , part i : centering public interest value - public knowledge",pro-regulation
dutch ministry to check best practice for online content moderation - euronews,pro-regulation
supreme court put content moderation on solid legal ground - cyberscoop,anti-regulation
gcore launch advanced ai solution for real-time online content moderation and compliance - pr newswire,pro-regulation
"content moderation service market size report , 2030 - grand view research",pro-regulation
an advocate ’ s guide to automated content moderation - tech policy press,pro-regulation
content moderation in trump 's america is a political minefield - mashable,neutral
"a decision on content moderation system , after all - tech policy press",pro-regulation
meta 's content moderation change are going to have a real world impact . it 's not going to be good . - tech policy press,anti-regulation
global digital policy roundup : january 2025 - tech policy press,pro-regulation
the need to make content moderation transparent - tech policy press,pro-regulation
transcript : mark zuckerberg announces major change to meta 's content moderation policy and operation - tech policy press,anti-regulation
content moderation and platform observability in the digital service act - tech policy press,pro-regulation
the evolving landscape of content moderation : a recap on the influence of online safety legislation - disruptive competition project,pro-regulation
regulation or repression ? government influence on political content moderation in india and thailand - carnegie endowment for international peace,anti-regulation
digital apartheid in gaza : unjust content moderation at the request of israel ’ s cyber unit - eff,anti-regulation
will meta ’ s change to content moderation work ? - index on censorship,anti-regulation
x ’ s latest content finding reveal troubling trend in ai moderation - forbes,pro-regulation
"a policy primer for free expression and content moderation , part ii : empowering user choice - public knowledge",pro-regulation
meta is getting rid of fact checker . zuckerberg acknowledged more harmful content will appear on the platform now - cnn,anti-regulation
"meta ’ s new content policy will harm vulnerable user . if it really valued free speech , it would make these change - eff",neutral
meta end fact-checking : a new era of content moderation - ceo today,pro-regulation
"a policy primer for free expression and content moderation , part iii : safeguarding user - public knowledge",pro-regulation
the fine line between content moderation and censorship in the digital age - u.s. global investor,pro-regulation
more speech and fewer mistake - meta store,pro-regulation
"meta , facebook to drop fact-checkers : what doe this mean for social medium ? - al jazeera english",anti-regulation
supreme court protects the future of content moderation - the verge,pro-regulation
supreme court kick case about tech company ’ first amendment right back to lower court − but appears poised to block state from hampering online content moderation - the conversation,anti-regulation
the broadway play about content moderation - the verge,neutral
"speaker : content moderation is free speech , not censorship - cornell chronicle",anti-regulation
article | trump sign order ‘ ending federal censorship ’ of online content - politico pro,anti-regulation
why big tech can ’ t solve the content moderation problem - forbes,anti-regulation
how politics broke content moderation - columbia journalism review,anti-regulation
more than 140 kenya facebook moderator diagnosed with severe ptsd - the guardian,anti-regulation
beyond moderation : challenging big tech ’ s power in a troubled time for democracy - tech policy press,pro-regulation
so to speak podcast transcript : section 230 and online content moderation - foundation for individual right and expression,pro-regulation
content moderation service market size | cagr of 12 % - market.us,pro-regulation
why moderator can ’ t protect online community on their own - hbr.org daily,anti-regulation
meta 's content moderation decision get hill scrutiny - axios,pro-regulation
transcript : dave willner on moderating with ai at the institute for rebooting social medium - tech policy press,anti-regulation
meta shift from fact-checking to crowdsourcing spotlight competing approach in fight against misinformation and hate speech - the conversation,pro-regulation
following musk 's lead : how meta 's eased content moderation is redrawing the digital landscape - dig watch update,pro-regulation
the fallout of meta ’ s content moderation overhaul - the verge,anti-regulation
the word censorship ha an actual meaning : a defense of content moderation - tech policy press,anti-regulation
what meta ’ s move to community moderation could mean for misinformation - the conversation,anti-regulation
"( pdf ) the ethic of ai in content moderation : balancing privacy , free speech , and algorithmic control - researchgate",pro-regulation
is this the end of 'content moderation ? ' - substack.com,anti-regulation
wjc responds to meta announcement on content moderation - world jewish congress,anti-regulation
meta ’ s new community-driven approach to content moderation - florida politics,pro-regulation
this $ 2 billion content moderation company is trying to stop ai image of child sexual abuse - forbes,anti-regulation
social medium company face global tug-of-war over free speech - the new york time,anti-regulation
hillary clinton warns 'we lose total control ' without social medium content moderation - wlos,anti-regulation
data show x ha significantly fewer moderation staff than other platform - social medium today,anti-regulation
"court allows scope act ’ s parental consent for texas minor online , strike down content moderation mandate - kprc click2houston",anti-regulation
facebook moderation move is a mistake . why zuckerberg shouldn ’ t copy musk with meta and 5 other thing to know today . - barron 's,anti-regulation
why outsourcing is the key to building a world-class moderation team - keywords studio,pro-regulation
9th circuit : provision of california ’ s content-moderation law violate first amendment - reporter committee for freedom of the press,anti-regulation
between hype and hesitancy : how ai can make u safer online - tech policy press,pro-regulation
analysis | supreme court say content moderation is speech - the washington post,anti-regulation
doe eu content moderation law impact free speech in america ? - straight arrow news,anti-regulation
navigating online safety : new legislative measure for child protection and content moderation - cm lawnow,pro-regulation
the human cost of our ai-driven future - noema magazine,pro-regulation
is generative ai the answer for the failure of content moderation ? - just security,anti-regulation
prevention and management of lawful but awful content moderation in xr platform - tech policy press,anti-regulation
"judge allows parental consent for texas kid ’ social medium account , but block content moderation requirement - ksat san antonio",neutral
meta ’ s shareholder : we need transparency on content moderation - access,neutral
meta to replace 'biased ' fact-checkers with moderation by user - bbc.com,pro-regulation
meta ‘ will have to assess the risk ’ of fact-checking and content moderation say ofcom - uktn ( uk technology news,neutral
why the video game industry need a responsible moderation revolution - keywords studio,pro-regulation
regulating online hate speech to avoid harm is not censorship - the express tribune,anti-regulation
"ruling boost social medium free speech protection , some say - roll call",pro-regulation
"on social medium platform , who ’ s in charge ? - stand together",pro-regulation
user submission - a comprehensive approach to content moderation in social medium platform - indiaai,pro-regulation
meta content moderation change : what you need to know about the shift to community note - economy middle east,neutral
the politics of platform regulation : how government shape online content moderation - university college london,pro-regulation
x ’ s moderation mishap and the bipartisan misrepresentation of free speech online - tech policy press,anti-regulation
new era and new risk : meta ’ s content moderation reform and freedom of expression online - michael geist -,pro-regulation
meta ’ s ‘ free speech ’ overhaul spark advertiser ’ concern - financial time,anti-regulation
usa : supreme court issue important ruling for free speech online - article 19,anti-regulation
csam moderation solution - wipro,pro-regulation
content moderation and the uk 's online safety act ( osa ) - mondaq news alert,neutral
supreme court to hear argument on online content moderation - roll call,anti-regulation
the underworld of online content moderation - the new yorker,anti-regulation
eu seek information from x on content moderation amid first major probe under new tech rule - cnbc,anti-regulation
ico release guidance on content moderation and data protection - inside global tech,pro-regulation
x urged to answer content moderation question - euronews,anti-regulation
policy & internet | pso journal - wiley online library,pro-regulation
"syllabus : large language model , content moderation , and political communication - tech policy press",pro-regulation
keywords studio and community sift elevate their partnership to new height - keywords studio,pro-regulation
meta created a ‘ supreme court ’ for content . then it threatened it fund . - the washington post,anti-regulation
is content moderation compatible with india ’ s safe harbor law ? - medianama.com,anti-regulation
what is digital sovereignty and how are country approaching it ? - world economic forum,anti-regulation
ken freeman receives air traffic control association ( atca ) award for atm-x digital information platform ( dip ) - nasa,pro-regulation
how to give american back control of their digital identity - the national interest online,pro-regulation
the afterlife of data : who control our digital legacy ? - informationweek,pro-regulation
"india ’ s digital sovereignty : balancing control , security , and individual right – oped - eurasia review",pro-regulation
new iron mountain digital data/document management service leverage mongodb atlas - crn,pro-regulation
master data management : the key to getting more from your data - mckinsey,pro-regulation
russia step up digital authoritarianism and repression in information space - isw - rbc-ukraine,anti-regulation
the rise of digital authoritarianism - freedom house,pro-regulation
document management : are you taking it seriously enough ? - bimplus,neutral
data privacy week : how to take control of your digital life - infosecurity magazine,pro-regulation
"american and privacy : concerned , confused and feeling lack of control over their personal information - pew research center",anti-regulation
the era of borderless data is ending ( published 2022 ) - the new york time,anti-regulation
the politics of digital literacy and information control : an important survey - bryan alexander,pro-regulation
afmc release white paper on digital materiel management - afmc.af.mil,pro-regulation
myanmar is the leading edge of digital authoritarianism in southeast asia - the diplomat,pro-regulation
why it ’ s so hard for user to control their data - hbr.org daily,anti-regulation
"1. view of data privacy risk , personal data and digital privacy law - pew research center",pro-regulation
government data management for the digital age - mckinsey,pro-regulation
"how american view data privacy : tech company , ai , regulation , password and policy - pew research center",pro-regulation
the quiet evolution of vietnam ’ s digital authoritarianism - the diplomat,pro-regulation
digital autocracy : maduro ’ s control of the venezuelan information environment - atlantic council,anti-regulation
take control of your personal information : how to delete your data from the internet - cnet,pro-regulation
designed for censorship - mercator institute for china study ( merics ),neutral
russia is using ‘ digital repression ’ to suppress dissent - scientific american,anti-regulation
"editorial : digital technology for tobacco control : novel data collection , study design , and intervention - frontier",pro-regulation
"[ article ] digital sovereignty in india : policy agenda , discourse , power and capability - science po",pro-regulation
confronting digital authoritarian­ism through digital democracy : lesson from taiwan - the diplomat,pro-regulation
information technology ( it ) - techtarget,pro-regulation
the new rule of data privacy - hbr.org daily,pro-regulation
the consumer-data opportunity and the privacy imperative - mckinsey,pro-regulation
digital - turner & townsend,pro-regulation
digital sovereignty : the fight to control data in the ai era - spiceworks news and insight,pro-regulation
what is the digital thread and how doe it help data management in aerospace manufacturing ? - engineering.com,pro-regulation
top 10 product information management ( pim ) system - cmswire,pro-regulation
how india take control of personal data - deccan herald,pro-regulation
"russia : growing internet isolation , control , censorship - human right watch",anti-regulation
digital surveillance can help bring the coronavirus pandemic under control – but also threatens privacy - the conversation,pro-regulation
digital asset management ( dam ) - techtarget,pro-regulation
exploring the factor that inﬂuence personal - researchgate,pro-regulation
fire at digital realty 's singapore data center `` under control '' - datacenterdynamics,anti-regulation
"building information modeling , digital twin create green , smart cement factory - control global",pro-regulation
( pdf ) digital quality control of construction work - researchgate,pro-regulation
web content management system ( wcms ) - techtarget,pro-regulation
content management ( cm ) - techtarget,pro-regulation
20 year of information management at heathrow airport - autodesk,pro-regulation
our data is our digital identity - and we need to reclaim control | cullen hoback - the guardian,pro-regulation
digital self-control - new economics foundation,pro-regulation
six benefit of aligning information management directly with digital transformation - it brief australia,pro-regulation
big data : the management revolution - hbr.org daily,pro-regulation
‘ digital colonialism ’ : why some country want to take control of their people ’ s data from big tech - the conversation,pro-regulation
europe ’ s digital competition law can give user more effective control of their data - bruegel,pro-regulation
u ensnared in china ’ s digital crackdown - the hill,anti-regulation
evolution of information management in the digital era - wipro,pro-regulation
covid kaya : a digital platform for covid-19 information management in the philippine - world health organization,pro-regulation
idg capital invests in digital information management platform developer flowus - pandaily,pro-regulation
data protection reform - parliament approves new rule fit for the digital era - european parliament,pro-regulation
are you in control of your digital footprint ? - the strait time,anti-regulation
why is digital information management so important for nfps ? - pro bono australia,anti-regulation
b 8644-1 digital management of fire safety information : an information management perspective - bimplus,pro-regulation
google update it family link parental-control system to give parent more monitoring power - digital information world,pro-regulation
meta look to give more user control over metric on instagram and thread with optional reel view count and hidden reply - digital information world,pro-regulation
how to control your content in google ’ s ai overview - digital information world,pro-regulation
five trend on digital information management - panamericanworld,pro-regulation
american agree : online oversharing is out of control - digital information world,anti-regulation
"google expands it ad control to youtube , search result , and discover - digital information world",pro-regulation
new poll reveals a majority of american want more government control of social medium company - digital information world,anti-regulation
youtube might be giving you more control over suggestion - digital information world,neutral
