lemmatized_text,bert_label
"safety take a backseat at paris ai summit , a u.s. push for less regulation",anti-regulation
elon musk say 'make europe great again ' a he continues his push into european politics,pro-regulation
judge make final decision on lawsuit alleging major company are deceiving the public : 'spent million to mislead consumer ',anti-regulation
a nutrition scientist wa hooked on snack like chocolate and chip . she made 3 simple change and now enjoys them without overeating .,pro-regulation
trump revoke ai risk regulation in day one executive order,anti-regulation
what is open data ? how common crawl and laion shape open source ai training,neutral
social medium in healthcare : a regulation-friendly guide for 2025,pro-regulation
anti-poverty group say billionaire ' wealth soared in 2024 a the elite prepare for another davos,anti-regulation
"how to delete your facebook , instagram , and thread right now",pro-regulation
when the truth no longer matter : how social medium ’ s engagement obsession is killing democracy,pro-regulation
vatican warns of ‘ shadow of evil ’ in ai,anti-regulation
can europe stop elon musk ?,anti-regulation
"why misinformation spread during climate disaster , and how to stop it",anti-regulation
the vatican urge ethical ai use in warfare and healthcare,pro-regulation
new report show social medium giant obstruct independent research for political online safety,anti-regulation
"what happens next to the u.s. vs. google antitrust case ? via @ sejournal , @ alliberry3",anti-regulation
vance declares war on ai censorship : u.s. must lead the charge for freedom in artificial intelligence,anti-regulation
beyond the illusion - the real threat of ai : wef global risk report 2025,anti-regulation
"empowering user , not overlord : overcoming digital helplessness",pro-regulation
ai safety at a crossroad : why u leadership hinge on stronger industry guideline,pro-regulation
uk water industry found to be using deception tactic to deflect blame for sewage pollution,anti-regulation
ai regulation in the u.s. : navigating post-eo 14110,pro-regulation
ai ’ s legal storm : the three battle that will shape it future,pro-regulation
the faa ’ s obsolete tech—not diversity—is america ’ s biggest air safety threat,anti-regulation
beaver family help control flooding in west london,pro-regulation
solana launch dubai crypto economic zone : what you need to know,pro-regulation
vance tell european that heavy regulation could kill ai,anti-regulation
the dark side of ai innovation is supercharging disinformation and damaging democracy,pro-regulation
vance tell european that heavy regulation could kill ai,anti-regulation
spanish prime minister warned social medium could 'overthrow democracy ',anti-regulation
texas measles outbreak hit a congress weighs rfk jr. ’ s hhs secretary bid,anti-regulation
the 8 talking point fossil fuel company use to obstruct climate action,pro-regulation
joe rogan repeat false claim that ukraine 'accidentally ' got $ 6 billion,anti-regulation
latin america is moving fast to protect democracy from excess of big tech,pro-regulation
"tiktok out of time , meta out of fact , chatgpt ’ s new task",anti-regulation
three threat prediction for 2025 and how company can mitigate them,neutral
"u , uk decline to sign paris ai summit declaration",anti-regulation
"vance outline an open , forward-looking ai agenda",pro-regulation
why kenya is cracking down on viral ai-generated content,anti-regulation
"kenya 's digital struggle : ai , activism and crackdown",pro-regulation
"2025 'doomsday clock ' : this is how close we are to self-annihilation , scientist say",anti-regulation
elon musk belief he got trump elected . now he ’ s coming for europe,anti-regulation
will the global elite ’ war on free speech succeed ?,anti-regulation
government postpones big stick for big tech amid trump tariff fear,anti-regulation
google add watermark to ai photo,pro-regulation
misinformation a a business model—how meta and musk endanger democracy | opinion,anti-regulation
stop online misguidance : hold social medium influencers accountable,anti-regulation
q & a : lucas graf on meta ’ s decision to shut down it global fact checking program,anti-regulation
"ai update , january 24 , 2025 : ai news and view from the past week",anti-regulation
zuckerberg ’ s meta shift will leave the user base of his platform split,anti-regulation
bbc take on appeal to nature fallacy,anti-regulation
ai accountability : how doing the right thing build a better business,pro-regulation
project 2025 wa the plan all along . trump is proving it now .,pro-regulation
vance warns eu against ai overregulation at summit in paris,anti-regulation
on semiconductor corporation ( on ) miss q4 estimate and issue weak q1 forecast amid slowing automotive chip demand,anti-regulation
"jd vance warns ‘ massive ’ european regulation may kill ai , rip ‘ authoritarian censorship ’",anti-regulation
elon musk 's platform label his argument 'objectively false ',anti-regulation
navigating the future of leadership in the age of ai and augmentation,pro-regulation
misinformation a a business model—how meta and musk endanger democracy | opinion,anti-regulation
"zuckerberg slam biden for censoring vaccine opposition , take aim at apple in rogan interview",anti-regulation
junk food turn public villain a power shift in washington,anti-regulation
fixing the student loan crisis start with defending the department of education,neutral
"billionaire ' wealth skyrocketing , anti-poverty group say ahead of davos",anti-regulation
"abortion opponent praise rfk jr. , after he vow to follow trump",anti-regulation
linkedin founder reid hoffman warns against big tech ’ s fact-checking rollback,anti-regulation
exclusive : radar reveals real reason elon musk ha become trump 's lapdog — after tesla bos 'secretly branded president con artist and world champion of bull -- -- -- '',anti-regulation
a plea for institutional modesty,pro-regulation
"the battle for tiktok is a fight for control of public opinion , not national security",pro-regulation
pakistan : repeal amendment to draconian cyber law,anti-regulation
sir martin sorrell and richard edelman on what trump ’ s inauguration can teach cmos,pro-regulation
jd vance unveils america ’ s ai doctrine,pro-regulation
president trump ’ s first week hammered public health,anti-regulation
why is spray sunscreen bad ?,anti-regulation
"look out for this message about fictional recall on chicken , egg",anti-regulation
eu demand x algorithm transparency amid claim of bias ahead of german election,anti-regulation
why are people mad at msnbc ?,anti-regulation
donald trump announces stargate : $ 500 billion private-sector investment in ai infrastructure,pro-regulation
why ha ‘ online_safety_au_regulatory_action ’ suddenly turned up on your iphone ?,anti-regulation
note on the relationship between artificial intelligence and human intelligence,pro-regulation
nobody want to talk about ai safety . instead they cling to 5 comforting myth,anti-regulation
european commission criticised over lack of action taken against elon musk 's x,anti-regulation
eu 's legal weapon facing the heat from u big tech,pro-regulation
junk food turn public villain a power shift in washington,anti-regulation
trouble in ( maha ) paradise ?,anti-regulation
"countering fake news need open-source investigation , new medium literacy strategy [ advocacy lab content ]",pro-regulation
hubert horan : can uber ever deliver ? part thirty-four – tony west ’ s calamitous legacy at uber and with the kamala harris campaign,pro-regulation
union warn member not to trust musk ’ s masked severance promise,anti-regulation
science ’ s turn towards darkness,pro-regulation
spain ’ s leader want the eu to ‘ make social medium great again. ’ here ’ s how,pro-regulation
the plastic crisis : a health and environmental emergency,pro-regulation
"at davos , spanish president pedro sánchez just said the quiet part out loud on online anonymity and digital identity",anti-regulation
junk food turn public villain a power shift in washington,anti-regulation
maha : echo of the secret,pro-regulation
bbc claim it panorama episode about e-bikes wa “ fair and impartial and clearly not an attack on the e-bike industry ”,pro-regulation
spain 's leader want the eu to ‘ make social medium great again. ’ here 's how,pro-regulation
majority support moderation on social medium platform,neutral
'misinformation ' a factor in teacher rejecting pay offer,anti-regulation
scientist debunk claim that iran ’ s 2024 earthquake wa a nuclear weapon test,anti-regulation
meta is ditching fact checker for x-style community note . will they work ?,anti-regulation
reid hoffman doe n't want big tech 's pivot from fact-checking to mean more misinformation,anti-regulation
trump order government to stop ‘ trampling ’ conservative on social medium,anti-regulation
trump take aim at social medium 'censorship ' with executive order,anti-regulation
a lot of american are googling ‘ what is oligarchy ? ’ after biden ’ s farewell speech,anti-regulation
"i do n't let my teen have social medium . my 16-year-old daughter wa n't happy at first , but the other day she thanked me .",anti-regulation
james gunn address that controversial superman flying shot,pro-regulation
a white house order claim to end 'censorship . ' what doe that mean ?,anti-regulation
"harrowing crime ha left officer struggling , lead detective say",anti-regulation
what 's trump 's beef with south africa ?,anti-regulation
how we must continue to fight antisemitism 80 year after the liberation of auschwitz,pro-regulation
democratic sen. padilla will 'of course ' attend trump 's inauguration,neutral
75 % of facebook news get reposted without user reading it,anti-regulation
tackling social medium fraud with graph database,anti-regulation
nypd apologizes for mistakenly accusing 15-year-old of mass shooting at brooklyn parade,anti-regulation
"la time owner boost rfk jr. online , a writer say paper cut his critique",anti-regulation
"biden warns of a 'tech industrial complex ' and say america must lead the way on ai , not china , in farewell address",anti-regulation
"'thank you so much ' – joe rogan praise elon musk for buying 'overpriced ' twitter , saying it saved u from censorship and narrative control",pro-regulation
what if your favourite social medium app wa gone tomorrow ?,anti-regulation
the dark side of reddit : how community are turning toxic,anti-regulation
the importance of medium literacy for young people,pro-regulation
how to avoid outrage fatigue and tune in without burning out,pro-regulation
u cyber agency put election security staffer who worked with the state on leave,anti-regulation
the importance of medium literacy in 2025,pro-regulation
when fact fall short,neutral
social medium extends it reach to financial advice,pro-regulation
the emilia pérez controversy just keep piling up,pro-regulation
"no , the latest io update won ’ t give starlink access to your iphone",anti-regulation
the attention alchemist : crafting gold from social engineering,pro-regulation
america is divided . it make for tremendous content .,pro-regulation
tiktok service restored in the u after promise that ban wo n't be enforced,anti-regulation
"climate action now threatened by ‘ powerful force , ’ biden warns",pro-regulation
beyond the buzzer : how sport collectible are winning the social medium game,pro-regulation
six story on elite school,pro-regulation
social medium remains a political echo chamber for the likeminded,neutral
bytedance ’ s omnihuman-1 ai model can generate scarily realistic video,pro-regulation
baltic state to make historic switch away from russian power grid,pro-regulation
bambu lab - setting the record straight about our security update,pro-regulation
social medium literacy still lacking – could that change ?,anti-regulation
"nyc health and hospital , taking on false social post , say it wo n't report undocumented patient",anti-regulation
buzzfeeds 's new strategy : an ai-powered social medium platform to help 'spread joy ' ...,pro-regulation
wa biden right to warn about the tech-industrial complex ?,anti-regulation
backlash in kenya over livestock vaccine and belching cow,anti-regulation
you do n't have to be a net zero hero—how focus on personal climate action can distract from systemic problem,pro-regulation
la wildfire disinformation reveals limit of fact-checking,anti-regulation
megan thee stallion win legal round against pro-tory lanez blogger,anti-regulation
"british teen pleads guilty to stabbing attack that killed 3 , sparked riot , misinformation",anti-regulation
"in farewell speech , biden rail against the tech industrial complex and disinfo dismantling democracy",pro-regulation
"are jennifer aniston and barack obama dating ? an odd story , explained",neutral
the making of community note ( 2024 ),pro-regulation
joe biden warns of “ tech industrial complex ” in farewell address : american are being buried under an avalanche of misinformation and disinformation ”,anti-regulation
trump 's tiktok flipflop : a look at u.s. president-elect 's social medium evolution,pro-regulation
"“ open source and ethical ” tiktok , whatsapp and instagram alternative could transform social medium",pro-regulation
meta shift from fact-checking to crowdsourcing spotlight competing approach in fight against misinformation and hate speech,pro-regulation
"ice raid liberty restaurant and detains at least 12 worker , clay county sheriff confirms",anti-regulation
x and meta scramble to settle with trump,anti-regulation
rfk jr. denied he is anti-vaccine during his confirmation hearing . here ’ s his record,anti-regulation
comcast tempts dtc brand away from paid social due to rising cost and brand safety issue,anti-regulation
a ceasefire agreement at last – but will it hold ?,neutral
"yes , ai is capable of improving trust—here ’ s how",pro-regulation
trump accused of leading a ‘ multipronged ’ attack on u medium,anti-regulation
are instagram and tiktok enabling right-wing political censorship ?,anti-regulation
10 uk social medium trend for 2025,pro-regulation
zoe saldaña responds to karla sofía gascón ’ s social medium controversy,pro-regulation
a tumultuous week for federal cybersecurity effort,anti-regulation
"a trump return to the white house , medium buyer clamp down on brand safety",anti-regulation
apple halt ai news alert after error,anti-regulation
the long goodbye,pro-regulation
from viral to voting : meeting our community online during the 2024 election,pro-regulation
confused elon musk attacked wrong journalist,anti-regulation
"brand : legacy medium isn ’ t dead , it ’ s ready for repositioning",pro-regulation
pakistan senate vote to ban fake news on social medium,anti-regulation
“ wild and digusting ” : french president ’ s wife accused of being a man after photo go viral,anti-regulation
"how artificial intelligence shape how we think , act , and connect",pro-regulation
meta ’ s user fact-checking is just ‘ window dressing ’ without a commitment to truth,anti-regulation
the future of influencer marketing : from public to private,pro-regulation
a collective open letter to mark zuckerberg from the ifcn arabic coalition,pro-regulation
what you need to know about the imminent u.s. tiktok ban,pro-regulation
who belief misinformation,anti-regulation
new meta content rule let user call lgbtq+ people ‘ mentally ill. ’ here ’ s what medical expert say .,anti-regulation
why more young men in germany are turning to the far-right,anti-regulation
why sad post on social medium get such big audience,anti-regulation
global fact check fund award $ 2 million to 20 fact-checking group across 15 country,pro-regulation
buzzfeed ceo plan to challenge algorithm-driven social medium,pro-regulation
playing at democracy,pro-regulation
this deepfake brad pitt scam is a cautionary tale on the danger of ai catfishing,pro-regulation
tech deal in 2025 : navigating ‘ ghost ’ discount and fake review,anti-regulation
how can bank truly understand the changing regulatory landscape ?,pro-regulation
trump lash out at jerome powell after fed doesn ’ t cut interest rate,anti-regulation
fed hold interest rate : what it mean for small business in 1q25,pro-regulation
pakistan : journalist slam new law regulating social medium,anti-regulation
"jpjeplate for ev – plate design being replicated and used on ice vehicle , which is not legally allowed",pro-regulation
how democrat alienated big tech — and why it might not matter,anti-regulation
trump daughter ivanka slam fake crypto coin exploiting her name,anti-regulation
pakistan crack down on free speech online,anti-regulation
linda mcmahon confirmation hearing and cocoa price affect valentine 's day sweet : morning rundown,pro-regulation
why social medium is helpful ?,neutral
"scheming dealer , auction house collusion , pub gossip , oh my !",anti-regulation
edmonton entrepreneur join effort to ramp up anti-fraud protection for immigrant,pro-regulation
why american ( but not bank ) love the consumer financial protection bureau,pro-regulation
social medium is impacting political and social discourse,pro-regulation
red 3 ban : other ingredient that could now face fda scrutiny,anti-regulation
pakistan 's na endorses controversial change to cyber law amid opposition boycott,pro-regulation
"no , trump didn ’ t make $ 50 billion from his memecoin",anti-regulation
vatican see danger in ai,anti-regulation
international report warns against loss of control over ai,anti-regulation
how did racist mass text bypass some anti-spam guardrail after the election ?,anti-regulation
unraveling the curious mystery of two different ai model suddenly forming a new language of their very own,pro-regulation
"trump accuses fed , powell of creating inflation on heel of rate decision",anti-regulation
trump cabinet confirmation hearing : schedule & how to watch,pro-regulation
"ai dating is about data , not love : how to resist the tech takeover of romance",anti-regulation
letter from london : haiku hell and the abandoneers,pro-regulation
watch : crowd go wild a trump announces “ no tax on tip ” and tease elimination of income tax in la vega,anti-regulation
jamie raskin reveals dems hired 'emotion regulation ' specialist to consult on 'authoritarian style of speech in the trump age,pro-regulation
divide and conquer : russia 's disinformation campaign in africa,pro-regulation
the trump revolution : where it came from and where it ’ s going,pro-regulation
deference to passport put dissident at risk,anti-regulation
"deadline alert : block , inc. ( sq , xyz ) investor who lost money urged to contact glancy prongay & murray llp about security fraud lawsuit",anti-regulation
"deadline alert : block , inc. ( sq , xyz ) investor who lost money urged to contact glancy prongay & murray llp about security fraud lawsuit",anti-regulation
"deadline alert : block , inc. ( sq , xyz ) investor who lost money urged to contact glancy prongay & murray llp about security fraud lawsuit",anti-regulation
akismet : how to collect email from website visitor ( for email marketing ),pro-regulation
"fed guided by economic goal and the law , not politics , say powell",neutral
brazil took on elon musk and won . now lula is sharing note with europe,anti-regulation
jpmorgan post record annual profit a major u bank thrive in the final quarter of 2024,pro-regulation
"ifpi ceo victoria oakley talk ai , fraud and lobbying : ‘ we have a compelling story to tell ’",pro-regulation
ai # 102 : made in america,pro-regulation
powell ’ s fed on defensive a diversity effort come under fire,pro-regulation
high-tech capitalism and neo-feudalism,pro-regulation
russian propaganda : how moscow us disinformation in africa,anti-regulation
russia increasingly using disinformation in africa,anti-regulation
news story : britain 's leading the way protecting child from online predator,pro-regulation
sec enforcement : 2024 year in review,pro-regulation
how trump ’ s war on cartel cash can stop fentanyl enablers — and save american life,pro-regulation
“ ai is left-wing and silence conservative position ” state uk research,anti-regulation
the slop society,neutral
medium insider : tvnz newsreader simon dallow considering his future ; inside the nzme/nz herald cut ; top 25 toughest pr gig ; reporter of the year quits stuff,anti-regulation
facebook,pro-regulation
it ’ s a big club and you ain ’ t in it,pro-regulation
gullible trump supporter lose million on fake $ barron meme coin,anti-regulation
jpmorgan post record annual profit a major u.s. bank thrive in final quarter of 2024,pro-regulation
we need a cognitive freedom movement,pro-regulation
the failure and fallacy of central planning,anti-regulation
financial institution ma key trend and outlook,pro-regulation
'overdose epidemic ' : bipartisan senator target fentanyl classification a lapse approach,anti-regulation
cleary gottlieb discusses effective board oversight a ai evolves,pro-regulation
ranveer allahbadia controversy live update,anti-regulation
"trump say powell and fed , ‘ failed to stop the problem they created with inflation ’",anti-regulation
will ai resilience protect developing nation ?,pro-regulation
scanning an id for club entry is n't uncommon — but is your data safe ?,neutral
sen. ron wyden is here to stop elon musk,anti-regulation
labour 's ai action plan - a gift to the far right,pro-regulation
trump handed 'opportunity to save medicare ’ after biden admin ’ s final blow to senior : expert,anti-regulation
a ride-hailing startup in washington try to “ out-uber uber ”,pro-regulation
report : majority of u.s. teen have lost trust in big tech | techcrunch,anti-regulation
public onassis school : bill passed – decision on the first 22 to 17 february,anti-regulation
"planning for the worst in trump ’ s next term : prepare , don ’ t panic , and don ’ t comply in advance",anti-regulation
eff transition memo to trump administration 2025,pro-regulation
do you need permission from the government to do independent research ?,anti-regulation
"enquire automatically reconstructs , expands , and drive enrichment analysis of gene and mesh co-occurrence network from context-specific biomedical literature",pro-regulation
trump 's anti-trans effort is an agenda cornerstone with echo in history,pro-regulation
big tech is powering trump ’ s immigration crackdown,pro-regulation
breaking down all of trump ’ s day 1 presidential action,anti-regulation
your exercise gear reserve the right to track and sell data on how you smell,pro-regulation
how the oil industry and growing political divide turned climate change into a partisan issue,pro-regulation
disinformation expert hate trump 's free speech executive order,anti-regulation
"no evidence trump fired 3,000 air traffic controller",anti-regulation
marketing briefing : why de & i becoming a flash point is part of ‘ politicization of everything ’,anti-regulation
"brendan carr , trump ’ s ‘ free speech ’ warrior , waste no time violating trump ’ s new free speech executive order",anti-regulation
wefâs global risk report 2025 : prioritizing âdisinformationâ over economic stability raise sovereignty concern,pro-regulation
flood the zone with truth,pro-regulation
infrastructure laundering : blending in with the cloud,pro-regulation
"virus disinformation drive anti-china sentiment , lockdown fear",anti-regulation
rubio vow to end state department program that âopen the door to censorshipâ,anti-regulation
where trump policy and project 2025 proposal match up,pro-regulation
trump 's insulted california leader dealing with wildfire . he need to walk with them .,anti-regulation
"trump declares war on big tech censorship , sign executive order to protect free speech",anti-regulation
"biden ’ s failed policy are over , trump tell globalist elite at davos",anti-regulation
fact-checkers in ethiopia take on disinformation amid rising tension,pro-regulation
"trumpâs america-first policy rattle globalist elite , threaten wefâs âgreat resetâ agenda",pro-regulation
russia is spinning up a new barrage of lie in europe,anti-regulation
russia is spinning up a new barrage of lie in europe,anti-regulation
biden warns of ‘ oligarchy and tech industrial complex ’,anti-regulation
transcript : cnn anchor wreck maga rep. in brutal shaming over jan. 6,anti-regulation
google snub eu law over fact-checking youtube video,anti-regulation
"finally , the truth : paypal admits freezing account over criticism of covid-19 policy , sparking free speech concern",anti-regulation
incoming crypto czar argued jan. 6 rhetoric not covered by first amendment ...,anti-regulation
russian medium reach soar a nato eye countermeasure – report,anti-regulation
moscow comment on french reporter ’ s visa ban,anti-regulation
we are disabling comment,anti-regulation
systemic risk reporting : a system in crisis ?,neutral
how el tímpano is changing it reporting practice to protect immigrant source,pro-regulation
"[ josh blackman ] murthy v. missouri , redux",anti-regulation
"deepseek ‘ incredibly vulnerable ’ to attack , research claim",anti-regulation
musk & right wing trumpsters are already at odds,pro-regulation
exploring the cybersecurity battlefield of 2025,pro-regulation
from hierarchy to wirearchy in an always connected workplace,pro-regulation
trump ’ s new white house press secretary target transgender people in first briefing,anti-regulation
eu regulator attacking x because of elon musk ’ s political position,anti-regulation
"infosec wa literally the last item in trump 's policy plan , yet major change are likely on his watch",neutral
