lemmatized_text,bert_label
usaid funneled nearly $ 800 million to ‘ gender transformative ’ global censorship group,anti-regulation
trump say he 'll visit california on friday to survey wildfire damage,anti-regulation
state department warns staff against imposing stealth dei after trump executive order,anti-regulation
meta is now a fake news free-for-all after company shuts down anti-misinformation technology,anti-regulation
we ’ re living through the biggest scandal of all time,anti-regulation
fake climate news thriving a politics and ai turbocharge disinformation crisis [ advocacy lab content ],anti-regulation
ukraine and west ‘ blackmailing ’ african state to counter russia – moscow,anti-regulation
heritage foundation expert analyze trump ’ s executive order,pro-regulation
trump dhs dissolve advisory board after biden ‘ disinformation ’ fiasco,anti-regulation
now is the time to bring censorship giant microsoft to heel,anti-regulation
transcript : trump ’ s fury at jack smith grows a maga threat darken,pro-regulation
"lavrov echo debunked kremlin narrative to justify war , undermine nato",anti-regulation
transcript : paul krugman on trump voter getting “ brutally scammed ”,anti-regulation
rubio will skip g20 in south africa because of it land and climate change policy,anti-regulation
cnn ’ s scott jennings halt panelist ’ s defense of biden ’ s ‘ misinformation ’ call out with one simple question,anti-regulation
everything trump ha promised to do on his first day,pro-regulation
trump ’ s flurry of executive order upend biden ’ s tech policy,anti-regulation
everything trump ha promised to do on his first day,pro-regulation
deepfakes can damage businesses—here ’ s how to fight back,pro-regulation
what mark zuckerberg get right about fact-checking and content moderation,pro-regulation
'smart public policy can make a difference ',pro-regulation
exclusive : rubio outline 'sweeping change ' to u diplomat,pro-regulation
john bolton 's secret service protection discontinued by trump administration,anti-regulation
trump is building his administration on a foundation laid by ron desantis : opinion,pro-regulation
medium outlet and personality whine about exhaustion just day into trumpâs presidency,anti-regulation
california dreamin ’,pro-regulation
why doe everyone hate peta ?,anti-regulation
​​beijing ’ s targeting of taiwan ’ s undersea cable preview cross-strait tension under a trump presidency,pro-regulation
human right campaign to lay off 20 % of staff a lgbtq+ organization restructures ( exclusive ),pro-regulation
why los angeles burned,anti-regulation
an ominous year : the climate change omen for 2025 look very dark indeed,anti-regulation
eu pushing through with enforcement of censorship tool digital service act,anti-regulation
overview of information influence activity,pro-regulation
rfk jr.âs confirmation hearing : a battle for health freedom and the soul of american politics,pro-regulation
"nuclear reduction , ending the ukraine conflict and massive tax cut : key takeaway from donald trump ’ s davos speech",pro-regulation
link 2/4/2025,anti-regulation
"the la wildfire , misinformation , and the urgent need for democrat to invest in new medium infrastructure | opinion",anti-regulation
joe romm ’ s the climate ate my homework ! ( re southern california fire ),pro-regulation
california governor spar with musk over wildfire 'lies ',anti-regulation
"like a ‘ zombie addict , ’ the left can ’ t stop hating maga",pro-regulation
journalism and audience : five must-read recent news report for your newsroom,pro-regulation
trump to tour disaster zone in north carolina and california,pro-regulation
"x , facebook , instagram , and youtube sign eu pledge to tackle hate speech",anti-regulation
donald trump is officially president again,pro-regulation
‘ most wanted ceo ’ playing card get user banned from most platform,anti-regulation
you can fire off hot take with confidence thanks to ‘ cancel culture insurance ’,pro-regulation
the cultural war have arrived at your google calendar,pro-regulation
trump ’ s first 100 day : all the news impacting the tech industry,pro-regulation
"meta suspended abortion pill provider ' account , removed post",anti-regulation
ctrl-alt-speech : digital oligarch gunning for europe ( doge ),anti-regulation
they used to love elon musk . now they ’ re his biggest enemy online .,pro-regulation
ctrl-alt-speech : bullshit in a china shop,anti-regulation
ctrl-alt-speech : the ticktock on tiktok,pro-regulation
ctrl-alt-speech : this episode ha masculine energy,anti-regulation
rednote : what to know about the chinese tiktok replacement,pro-regulation
the no-longer-need-to-hide-it administration,pro-regulation
platform systematically removed a user because he made “ most wanted ceo ” playing card,anti-regulation
ai bot boost online engagement but hamper discussion,neutral
advertiser aren ’ t thrilled with zuckerberg ’ s embrace of hate speech,anti-regulation
the twitter file playbook come for the u government,pro-regulation
"apple is once again advertising on x , more than a year after stopping all ad on the platform",anti-regulation
this $ 2 billion content moderation company is trying to stop ai image of child sexual abuse,anti-regulation
inside tiktok 's weekend of whiplash,pro-regulation
what happens when a troll becomes head of the fcc ? we ’ re about to find out .,neutral
"high iron level , optimal glucose level , lead testing | thrr203",pro-regulation
the sims at 25 : how a virtual dollhouse took over the world,pro-regulation
america is seesawing between sobriety and boozing it up,anti-regulation
this week in techdirt history : january 12th – 18th,pro-regulation
"in wake of meta moderation shift , advertiser have accepted new status quo : brand safety is a myth",anti-regulation
kanye ’ s latest antic prof there are line you still can ’ t cross . but not for long,neutral
"after stabbings , china ’ s social medium firm face scrutiny over hate speech",anti-regulation
silicon valley kiss the ring,pro-regulation
platform systematically removed a user because he made `` most wanted ceo '' playing card,anti-regulation
openai 's agent that can do work for you is here,pro-regulation
protecting “ free speech ” can ’ t just be about targeting political opponent,pro-regulation
how will meta ’ s new content policy affect artist ?,anti-regulation
a guide to deploying ai for real-time content moderation,pro-regulation
meta relaxes fact checking policy amid changing political landscape,pro-regulation
is the tiktok ban a chance to rethink the whole internet ?,anti-regulation
unitedhealth hired defamation law firm following social medium post,anti-regulation
trump and vance ’ s official portrait are a ugly a it get,anti-regulation
beyond doomscrolling,pro-regulation
biden temporarily vanished from google ’ s presidential search history,anti-regulation
"bold call : a musk ’ s political clout rise , twitter ’ s brand exodus could become a x ’ s brand influx",anti-regulation
is social medium more like cigarette or junk food ?,anti-regulation
"meta ’ s ‘ bonfire ’ of safety policy a danger to child , charity say",anti-regulation
the european commission want elon musk to reveal the secret of the x recommendation algorithm ( don ’ t we all ? ),pro-regulation
trump ’ s truth social user targeted by rampant scam online,anti-regulation
big tech sign up for hate speech code of conduct,anti-regulation
reddit group ban x link in protest at musk arm gesture,anti-regulation
meta shift from fact-checking to crowdsourcing spotlight competing approach in fight against misinformation and hate speech,pro-regulation
"facebook , tiktok harden eu commitment to tackle disinformation -- but not x",anti-regulation
x ban spread across reddit a community react to musk ’ s gesture,anti-regulation
"climate misinformation to escalate on social medium , expert warns",anti-regulation
family sue tiktok in france over teen suicide they say are linked to harmful content,anti-regulation
"google defies european union , refuse to include fact-checks in search result and youtube video",anti-regulation
"bluesky : exit , voice , and platform loyalty",pro-regulation
vpn is now the resistance tool of choice in authoritarian regime,pro-regulation
a call for broadening the altmetrics tent to democratize science outreach,pro-regulation
‘ woman with large chest have a harder time getting video approved ’ : alleged ex-tiktok insider reveals what really get your content removed,anti-regulation
how state tech policy in 2024 set the stage for 2025,pro-regulation
french family of suicide victim sue tiktok over alleged harmful content,anti-regulation
‘ are we dating the same girl ? ’ : inside telegram ’ s revenge porn problem,anti-regulation
meta just flipped the switch that prevents misinformation from spreading in the united state ( casey newton/platformer ),anti-regulation
telehealth abortion : the future of access,pro-regulation
"x , youtube , meta sign the eu 's updated code of conduct to improve handling hate speech",anti-regulation
lgbtq creator brace for meta ’ s pro-trump change,pro-regulation
we need to protect the protocol that run bluesky,pro-regulation
online platform risk becoming ideological echo chamber that undermine meaningful dialogue,anti-regulation
"rundown : ftc ’ s potential priority for ad tech , data and ai",pro-regulation
tiktok and rednote - consent without transparency isn ’ t freedom ; it ’ s control,anti-regulation
trump sign executive order to prevent censorship of online platform,anti-regulation
"digital subscription will soon pay for entire newsroom of le monde , say ceo",anti-regulation
are you being served youtube ?,anti-regulation
how to customize your bluesky handle with a custom domain from wordpress.com,pro-regulation
software engineer exploit unicode quirk to conceal information within emoji character,pro-regulation
"meta q4 2024 profit up 49 % at $ 20.8 billion , no impact of content moderation removal on ad spends : cfo",anti-regulation
"medium briefing : a history of medium company getting into the social platform business , in light of buzzfeed ’ s plan",pro-regulation
doge staff had question about the 'resign ' email . their new hr chief dodged them,anti-regulation
masterbuilt add another smart charcoal grill to it gravity series lineup,pro-regulation
"roli finally introduces a larger teaching piano keyboard , complete with ai",pro-regulation
"no excuse to not build 1.5m new home , rayner say",anti-regulation
laser eye safety in digital fabrication : protecting your vision,pro-regulation
"kohler us water , light , sound and steam for `` multi-sensory '' shower",pro-regulation
"digital reality , digital shock : growing up at the dawn of cyberspace",pro-regulation
the 10 best thing i saw at namm,pro-regulation
no ham license ? listen anyway in your browser,anti-regulation
shielding your digital life : essential privacy tool every android user need in 2025,pro-regulation
new app store api give developer more control over massive in-app purchase catalog,pro-regulation
top 20 apps tracking you every day,pro-regulation
screenshot-scanning malware discovered on apple app store in first-of-its-kind attack,anti-regulation
amazon ban number plate a illegal supply found,anti-regulation
international regulator probe how deepseek is using data . is the app safe to use ?,neutral
the samsung galaxy s25 ’ s most touted ai feature left me disappointed,anti-regulation
how magnetic font twisted up number and saved banking forever,pro-regulation
this ergonomic camera for solo video shooting make short-form content truly professional,pro-regulation
the eu is cracking down on ad in window 11 ’ s start menu,anti-regulation
ai will write complex law,pro-regulation
the sickening truth : healthcare data breach reach all-time high,anti-regulation
"can an ai chatbot help you quit smoking ? it can , with lot of caution",pro-regulation
best budgeting apps to get control of your money in 2025,pro-regulation
how to delete multiple text message on a mac and ipad,pro-regulation
"work at the mill or , the story of digital equipment corporation",pro-regulation
"taiwan ban deepseek ai over national security concern , citing data leakage risk",anti-regulation
everything you need to know about surfshark one vpn bundle for apple device,pro-regulation
"nikon release it ’ s latest superzoom update , the coolpix p1100",pro-regulation
"apple ’ s calendar app is quickly improving , and io 18.3 offer a new advantage",pro-regulation
moviepass want to know if it should get into crypto,neutral
tech exec send signal about where their company are headed,pro-regulation
why do health apps fail ? research burst the hype with clear evidence,anti-regulation
"i drove a $ 48,000 nissan frontier . it 's simple , powerful , and delivers pretty much everything you need in a truck .",pro-regulation
outsmart hacker who are out to steal your identity,anti-regulation
tesla model y juniper v rivian r1s : can tesla ’ s newest take out a much more expensive vehicle ?,anti-regulation
"from film funding to distribution , this partnership give you control : ‘ anyone can do this ’",pro-regulation
how elon musk ’ s doge could end the u.s. government a we know it,pro-regulation
what happens to your online account when you die ?,anti-regulation
developer should embrace creative coding again,pro-regulation
50 best apple watch apps : from health apps to game and everything inbetween,pro-regulation
breaking down the nsa 's guidance on zero trust implementation ( 2024 ),anti-regulation
"court order pirate site missav to pay $ 4.5m in damage , domain seized",anti-regulation
nikon release a new compact digital camera – the coolpix p1100,pro-regulation
"news weekly : deepseek rising , massive garmin outage , the s pen confusion , and more",anti-regulation
"news weekly : alphabet 's earnings soar , new zenfone ultra , and more",pro-regulation
tesla model y juniper v 2024 tesla model y : what ’ s actually new ?,pro-regulation
"i love this new mail feature in io 18.2 , but it still need work",pro-regulation
who is part of elon musk 's doge and what are they doing ?,pro-regulation
infosec 101 for activist,pro-regulation
apple glass : the future of ar or a distant dream ?,pro-regulation
the oppo find x8 ultra could come with a button instead of an alert slider,anti-regulation
digital trust architecture : building a sustainable online presence,pro-regulation
we 're performing for an audience of machine,pro-regulation
proton : we 're giving away over $ 1m to support a better internet,anti-regulation
google map embrace the gulf of america name after trump order,pro-regulation
pushing the boundary of flat optic,pro-regulation
google tv streamer tip and trick,pro-regulation
mac malware mayhem a 100 million apple user at risk of having personal data stolen,anti-regulation
doge a a national cyberattack,pro-regulation
25 year of apple 's innovation with the itunes music store,pro-regulation
iphone 17 pro max rumored to feature smaller dynamic island,neutral
even reality g1 : the fashionable futuristic smart glass that google & meta wished they made,pro-regulation
ddosed by policy : website takedown and keeping information alive,anti-regulation
the subtle art of designing physical control for car,pro-regulation
reverse-engineering and analysis of sandisk high endurance microsdxc card ( 2020 ),anti-regulation
the amazing story of how a cooler and app have transformed organ transplant,pro-regulation
the real pro and con of shooting film,pro-regulation
firm are risking “ digital chaos '' if they do n't get their ai deployment right,anti-regulation
leveraging a generative ai strategy to mitigate information leakage,pro-regulation
resisting digital feudalism,pro-regulation
news bos : business is back with 'yoke of woke having been lifted ' ...,anti-regulation
how to see through musk ’ s truth distortion : a mirror doesn ’ t lie,anti-regulation
how to weather the storm,pro-regulation
trend in digital identity verification : insight from tech expert,pro-regulation
google pixel : how to set up identity check,pro-regulation
trump white house just made a crucial move to ensure it 's finally in control of the executive branch,pro-regulation
microsoft block critical secure boot loophole after over 7 month — fortifying window 11 against sophisticated firmware attack camouflaged a verified uefi apps,anti-regulation
“ big brother in your pocket : ” privacy advocate slam uk id digital wallet proposal,pro-regulation
6 reason open-source software is the future of creative industry,pro-regulation
control your raspberry pi gpio with arduino cloud using node.js | part iii,pro-regulation
the origin and unexpected evolution of the word `` mainframe '',pro-regulation
sovereign cloud : redefining the future of secure digital innovation,pro-regulation
how vpns shape the future of decentralized networking on android,pro-regulation
a unified digital experience is a boon to any brand,pro-regulation
canon announces the new rf16-28mm f2.8 is stm lens perfect for creator,pro-regulation
the ai edge : transforming business growth in the digital era,pro-regulation
window 11 's latest security update wo n't play nicely with these audio device,anti-regulation
help your family browse safely with this vpn,pro-regulation
the final flicker of cable news a we know it ...,pro-regulation
solo indie game developer claire morwood on making hand-crafted playable indie-rock concept album asterism,pro-regulation
how the national basketball player association is prioritizing athlete health,pro-regulation
"help ! we 're drowning in email spam , it 's about to get worse and there 's nothing we can do to stop it",anti-regulation
"'adrenaline of the moment ' drove child to take part in summer riot , say commissioner",pro-regulation
biden warned of oligarch . some official worry he may have helped create one .,anti-regulation
gavin newsom issue strange plea to joe biden a he face furious backlash for wildfire response,anti-regulation
the plague of social medium misinformation,anti-regulation
online 'content moderator ' sue facebook over exposure to graphic content,anti-regulation
election security and misinformation regulation - the regulatory review,pro-regulation
jd vance knock eu ’ s regulation of u tech giant : ‘ america can not accept that ’ - forbes,anti-regulation
australia abandon legislation requiring social medium company to regulate misinformation - jurist,anti-regulation
( pdf ) third person effect of fake news : fake news regulation and medium literacy intervention - researchgate,anti-regulation
vatican urge regulation of ai to prevent misinformation - dig watch update,anti-regulation
perception of disinformation regulation in the andean community - frontier,pro-regulation
australia proposes new law to address misinformation on social medium platform - social medium today,pro-regulation
what the next president will do about artificial intelligence - scientific american,pro-regulation
"editor ’ s note : meta , misinformation and esg metric - sustainable view",pro-regulation
"banned in brazil : the world is moving toward greater regulation of social medium , two northeastern expert say - northeastern university",anti-regulation
"australia : ambitious anti-disinformation bill dropped , rsf call for regulation of online platform - reporter sans frontières",anti-regulation
supreme court case on content moderation and mifepristone access — the monitor - kff,anti-regulation
meta ’ s fact-checking overhaul widens global rift on disinformation - the washington post,anti-regulation
"musk stir uk division , spark call for faster rollout of online safety law - reuters",anti-regulation
ai is amplifying social medium disinformation — and making big tech civilly liable may be the key to stemming it - business insider,anti-regulation
a review of content moderation policy in latin america - tech policy press,pro-regulation
"big tech trial : free speech , misinformation , & regulation in 2024 - techinformed",pro-regulation
"new ai law aim to curb election misinformation , protect hollywood actor - newsweek",anti-regulation
top saturday seminar of 2024 - the regulatory review,pro-regulation
uk revisits social medium regulation after far-right riot - reuters uk,anti-regulation
"expert discus misinformation , ai regulation in ‘ ai and healthcare ’ event - the brown daily herald",anti-regulation
the ai election is here . regulator can ’ t decide whose problem it is . - the washington post,pro-regulation
the federal government ’ s proposed mis- and disinformation law need to have clearer definition – and include ai - the conversation indonesia,anti-regulation
"actually , tim walz , the first amendment doe protect misinformation and `` hate speech '' - cato institute",anti-regulation
"to combat misinformation , focus on the architecture of social medium platform - abc religion & ethic - abc news",pro-regulation
( pdf ) trend in the regulation of hate speech and fake news : a threat to free speech ? - researchgate,anti-regulation
gary marcus say regulation must be strengthened a generative ai threatens democracy - eweek,pro-regulation
brazil lead dialogue on information integrity and platform regulation — planalto - gov.br,pro-regulation
how to regulate misinformation - royal society,pro-regulation
protect yourself from election misinformation - eff,anti-regulation
australia ’ s anti-misinformation law target twitter - above the law,anti-regulation
call for urgent ai regulation a fake news flood social medium during brazil flood - people of color in tech,anti-regulation
combating falsehood - the news international,anti-regulation
disinformation and democracy : challenge in social medium regulation in southeast asia - 9dashline,pro-regulation
"ai deepfakes , bad law – and a big fat indian election - reuters institute",anti-regulation
16 april : how platform are responding to eu regulation to prevent climate disinformation - eu disinfolab,anti-regulation
the misinformation bill wa axed . how else can we combat the ‘ biggest global risk ’ ? - sb,anti-regulation
regulating the spread of mis/disinformation online is not an attack on freedom of speech - abc news,anti-regulation
law for ai are double-edged sword in the disinformation battle - bloomberg law,pro-regulation
how education and social medium regulation can combat science denial - eco-business,pro-regulation
opinion | the best way to regulate social medium ha been staring u right in the face - politico,pro-regulation
right first : principle for digital platform regulation - human right law centre,pro-regulation
the biggest perpetrator of misinformation and privacy breach will escape new law - crikey,anti-regulation
"the early day of the pandemic expose the flaw in the government 's misinformation law , say legal expert - abc news",anti-regulation
government to propose stricter regulation for social medium - 朝日新聞,anti-regulation
what is the misinformation bill and why ha it triggered worry about freedom of speech ? - sb news,anti-regulation
"hany farid : to limit disinformation , we must regulate internet platform - uc berkeley",pro-regulation
albanese government must stop big tech poisoning australia ’ s democracy with lie and misinformation - human right law centre,anti-regulation
the u is drafting new law to protect against ai-generated deepfakes - world economic forum,pro-regulation
online safety act : explainer - gov.uk,anti-regulation
89％ seek regulation of ai-generated misinformation in japan - asianews.network,anti-regulation
the challenge of regulating disinformation - promarket,pro-regulation
disinformation nation : what can we do to crack the code ? - uc berkeley,anti-regulation
opinion | regulate frontier ai to avoid misinformation - the wall street journal,pro-regulation
how to respond to disinformation while protecting free speech - reuters institute,pro-regulation
"goa ’ s fix to counter tourist ‘ misinformation ’ : regulate taxi fare , streamline beach wedding - the indian express",anti-regulation
should government regulate social medium misinformation ? - divided we fall,anti-regulation
pakistan plan to regulate social medium through legislation - the diplomat,pro-regulation
brazilian judge regulate election … and ai - verfassungsblog,pro-regulation
getting disinformation right - the regulatory review,anti-regulation
australian researcher launch global misinformation database - ac,anti-regulation
adobe ceo on new era of generative ai and tackling misinformation - the washington post,anti-regulation
algorithm are pushing ai-generated falsehood at an alarming rate . how do we stop this ? - the conversation indonesia,anti-regulation
new tool track disinformation law globally - international center for journalist,pro-regulation
the limit of deplatforming - the regulatory review,pro-regulation
medium watchdog will have more power to force tech company to crack down on disinformation under new bill - abc news,anti-regulation
regulating ai deepfakes and synthetic medium in the political arena - brennancenter.org,pro-regulation
'no pathway ' : government drop controversial misinformation bill amid senate opposition - sb news,anti-regulation
martha minow look at way government can stop disinformation - harvard gazette,anti-regulation
"regulating political misinformation isn ’ t easy , but it ’ s necessary to protect democracy - the conversation indonesia",neutral
"most american favor restriction on false information , violent content online - pew research center",anti-regulation
preventing misinformation and disinformation in online filter bubble - common library,anti-regulation
