lemmatized_text,bert_label
"regulation essential to curb ai for surveillance , disinformation : right expert - un news",pro-regulation
time to regulation fake news industry - jamaica observer,anti-regulation
albanese government must hold big tech accountable for misinformation poisoning australia ’ s democracy - human right law centre,anti-regulation
chatting about chatgpt regulation - the regulatory review,pro-regulation
what will 2022 bring in the way of misinformation on social medium ? 3 expert weigh in - the conversation,anti-regulation
fixing disinformation online - the american prospect,pro-regulation
full senate to take up pre-election regulation of ‘ deepfake ’ misinformation - south dakota searchlight,anti-regulation
opinion | facebook is bad . fixing it rashly could make it much worse . ( published 2021 ) - the new york time,anti-regulation
the podcast problem - the regulatory review,anti-regulation
"if big tech ha the will , here are way research show self-regulation can work - the conversation indonesia",pro-regulation
it is time to pas law to protect voter against disinformation - forbes,pro-regulation
"reining in ai mean figuring out which regulation option are feasible , both technically and economically - the conversation indonesia",pro-regulation
european regulation of online disinformation may be a “ game changer ” in 2022 - columbia journalism review,anti-regulation
rush to pas ‘ fake news ’ law during covid-19 intensifying global medium freedom challenge - international press institute,anti-regulation
social medium company should self-regulate . now . - hbr.org daily,pro-regulation
regulating social medium algorithm - the regulatory review,pro-regulation
restoring trust in the medium - the regulatory review,pro-regulation
moving the needle on health disinformation - think global health,pro-regulation
using science to guide social medium regulation - tech policy press,pro-regulation
"85 % of people worry about online disinformation , global survey find - the guardian",anti-regulation
eye on ai : ai-generated misinformation - white & case llp,anti-regulation
"state act , but can legislation slow ai-generated election disinformation ? - governing",neutral
house leader bat for social medium regulation to curb fake news - pna.gov.ph,anti-regulation
regulating election in the united state - the regulatory review,pro-regulation
fda head want 'better regulation ' of what government considers misinformation - reason,anti-regulation
australia : online content regulatory wrap-up - globalcompliancenews,anti-regulation
social medium company profiting from misinformation - gw today,anti-regulation
why social medium fact-checking promised too much - impakter,anti-regulation
"online misinformation most likely to be believed by ideological extremist , new study show - nyu news",anti-regulation
"maha kumbh mela : action taken against 53 social medium account for spreading misinformation , say up police - the hindu",anti-regulation
the rise of misinformation and ai : developing tool to detect what ’ s real and the impact on upcoming election ( podcast ) - syracuse university news,pro-regulation
the “ wild west ” of cancer misinformation online - harvard magazine,anti-regulation
when the truth no longer matter : how social medium ’ s engagement obsession is killing democracy - forbes,pro-regulation
"address science misinformation not by repeating the fact , but by building conversation and community - the conversation",anti-regulation
democrat are twice a likely a republican to say misinformation on social medium is a very serious problem - yougov u,anti-regulation
power-motivated social medium user disproportionately spread misinformation | ucl news - ucl - university college london,anti-regulation
what public discourse get wrong about social medium misinformation - knowledge @ wharton,anti-regulation
social medium is a growing vehicle for climate misinformation - insideclimate news,pro-regulation
distrust in food safety and social medium content moderation — the monitor - kff,anti-regulation
attorney general bonta urge top social medium and ai executive to address election misinformation - california department of justice,anti-regulation
"fake news , social medium , and `` the death of truth '' - cbs news",anti-regulation
watching chaos through a screen : how social medium is changing the way we follow extreme weather event - reuters institute,pro-regulation
australia drop plan to fine social medium giant accused of enabling misinformation - nbc news,anti-regulation
should social medium company be responsible for fact-checking their site ? - the new york time,anti-regulation
"‘ i can ’ t go toe to toe with social media. ’ top u.s. health official reflects , regret . - the washington post",anti-regulation
misinformation and disinformation - britannica,anti-regulation
lawmaker call for investigation into social media-fueled hurricane misinformation - nc newsline,anti-regulation
social medium owner top global survey of misinformation concern - the guardian,pro-regulation
feeling outraged ? think twice before hitting “ share. ” - kellogg insight,anti-regulation
"seeing rising election misinformation , american say social medium platform may bear responsibility for political violence - tech policy press",anti-regulation
how disinformation defined the 2024 election narrative - brookings institution,pro-regulation
spanish-language social medium increase latino ’ vulnerability to misinformation - university of california san diego,anti-regulation
social medium is the new public health frontline . let ’ s treat it that way . - harvard public health magazine,pro-regulation
"disinformation v misinformation : how to spot fake news on the internet , social medium - austin american-statesman",anti-regulation
"social medium , advertising and misinformation - nature.com",anti-regulation
social medium ’ s role in fueling extremism and misinformation - pb newshour,pro-regulation
addressing misinformation about mental health with patient - apa psychology news,anti-regulation
how republican pushed social medium company to stop fighting election misinformation - cnn,anti-regulation
social medium misinformation is scaring woman about birth control - stat,anti-regulation
far-right populist much more likely than the left to spread fake news – study - the guardian,anti-regulation
"anti-vaccine disinformation campaign , sunscreen myth , and counterfeit ozempic on social medium — the monitor - kff",anti-regulation
australia threatens fine for social medium giant enabling misinformation - reuters,anti-regulation
"titusville police address officer-involved shooting , dispel social medium misinformation - talk of titusville",anti-regulation
health wanted : misinformation - rollins school of public health,anti-regulation
social medium ’ s role in fueling extremism and misinformation in a divided political climate - pb newshour,pro-regulation
designing social medium to foster user engagement in challenging misinformation : a cross-cultural comparison between the uk and arab country - nature.com,pro-regulation
nyu law forum debate government effort to halt social medium misinformation - nyu law,anti-regulation
dissemination v misinformation : social medium ’ s role in the evolution of cancer care - onclive,pro-regulation
what public discourse get wrong about misinformation online - annenberg school for communication,anti-regulation
"reviewing new science on social medium , misinformation , and partisan assortment - tech policy press",pro-regulation
hierarchical machine learning model can identify stimulus of climate change misinformation on social medium - nature.com,pro-regulation
"new study shed light on misinformation , news consumption , and content moderation - tech policy press",anti-regulation
climate misinformation is rife on social medium – and poised to get worse - the conversation,anti-regulation
"social medium and news fact sheet , 2024 - pew research center",pro-regulation
fir against 53 social medium account - the time of india,anti-regulation
fir against 54 social medium account for spreading misinformation on kumbh - the statesman,anti-regulation
"researcher consider the relationship between misinformation , outrage , and the sharing of content on social medium - tech policy press",anti-regulation
research find simple correction can slow spread of misinformation online - davidson news,anti-regulation
what public discourse get wrong about social medium misinformation - fair observer,anti-regulation
"trump order government not to infringe on american ’ speech , call for censorship investigation - the associated press",anti-regulation
"our outrage over social medium post help misinformation spread , study show - phys.org",pro-regulation
helping student spot misinformation online - national education association,pro-regulation
social medium : disinformation expert offer 3 safety tip in a time of fake news and dodgy influencers - the conversation,anti-regulation
teacher ' strike : social medium 'misinformation ' blamed for deal being rejected - bbc.com,anti-regulation
tackling misinformation in mobile social network a bert-lstm approach for enhancing digital literacy - nature.com,pro-regulation
how social medium company are preparing for misinformation after election day - wbur news,anti-regulation
fir against 54 social medium a/cs for spreading rumour - the time of india,anti-regulation
social medium campaign tackle misinformation about treacherous darién jungle - unhcr,anti-regulation
difference in misinformation sharing can lead to politically asymmetric sanction - nature.com,anti-regulation
"senate bill aim to curtail social medium influencer , telehealth drug misinformation - healio",anti-regulation
fir against 54 social medium account for spreading misinformation on maha kumbh - opindia,anti-regulation
the 'sift ' strategy : a four-step method for spotting misinformation - bbc.com,pro-regulation
ai-generated misinformation is everywhere . id ’ ing it may be harder than you think - maryland today,anti-regulation
supreme court ruling on social medium affirms the first amendment and the government ’ s responsibility to protect the public from the harm of online misinformation - free press,anti-regulation
multifaceted strategy needed to combat cancer misinformation on social medium - healio,pro-regulation
epidemic modeling for misinformation spread in digital network through a social intelligence approach - nature.com,anti-regulation
misinformation is winning the war on misinformation - vox.com,anti-regulation
claim about usaid funding are spreading online . many are not based on fact - the associated press,anti-regulation
"social medium user ’ action , rather than biased policy , could drive difference in platform enforcement - mit sloan news",neutral
rfk jr. amplifies traditional american skepticism and misinformation - the mass medium,pro-regulation
how hurricane milton and helene conspiracy theory took over social medium - bbc.com,anti-regulation
our social medium ‘ bespoke reality ’ - the bulwark,pro-regulation
"what are the link between social medium algorithm , generative ai and the spread of harmful content online ? - committee",anti-regulation
"thinkbeforesharing medium campaign launched in kyrgyzstan to combat hate speech , misinformation and to promote responsible digital competency - unesco",anti-regulation
u supreme court allows government to request removal of misinformation on social medium - the guardian u,anti-regulation
health misinformation : expert advice on how to avoid it - medical news today,anti-regulation
wapo writer accuses trump of 'government censorship ' after backing social medium crackdown of 'misinformation ' - fox news,anti-regulation
"unrest in the uk — social medium , misinformation , and crime rate challenge national peace - vision of humanity",anti-regulation
why you ’ re more likely to solve your problem on a therapist ’ s sofa than on social medium - cnn,anti-regulation
"social medium firm , lawmaker grapple with misinformation ahead of 2024 vote - semafor",anti-regulation
tiktok and who are getting together to help combat widespread health misinformation on social medium - the conversation indonesia,pro-regulation
ask an expert : how ha ai changed misinformation — and what doe that mean for consumer ? - cal poly,anti-regulation
"reducing distrust in social medium is not straightforward , computer scientist warn - william & mary",anti-regulation
australian government drop bill on social medium misinformation - bloomberg,anti-regulation
what we do — and don ’ t — know about how misinformation spread online - nature.com,pro-regulation
how to avoid falling for misinformation and conspiracy theory - the washington post,anti-regulation
are fear about online misinformation in the u election overblown ? the evidence suggests they might be - reuters institute,anti-regulation
supreme court allows white house to request removal of misinformation on social medium - npr,anti-regulation
did social medium promote misinformation during the summer 2024 riot ? - committee,anti-regulation
australia move to fine social medium company that spread misinformation up to 5 % of global revenue - new york post,anti-regulation
"misinformation thrives on outrage , study find - psypost",anti-regulation
warning label from fact checker work — even if you don ’ t trust them - mit sloan news,pro-regulation
misinformation run deeper than social medium - computerweekly.com,anti-regulation
keir starmer warns social medium firm after southport misinformation fuel riot - reuters uk,anti-regulation
spain proposes tightening rule on medium to tackle fake news - reuters,anti-regulation
spain introduces bill to combat online fake news - the guardian,anti-regulation
federal trade commission announces final rule banning fake review and testimonial - federal trade commission news,anti-regulation
‘ draconian ’ law to control social medium - business recorder,pro-regulation
‘ fake news ’ legislation risk doing more harm than good amid a record number of election in 2024 - the conversation,anti-regulation
the battle against misinformation and disinformation campaign : is your police department prepared ? - police news,anti-regulation
behind bar for fake news : imminent threat to medium freedom in cyprus - international press institute,anti-regulation
spain 's proposal to reform medium law seen a threat to press freedom - voice of america english news,anti-regulation
spain to tighten law to combat spreading of fake news online and over social medium - surinenglish.com,anti-regulation
editorial | quality journalism to benefit from hong kong shelving law against fake news - south china morning post,pro-regulation
hong kong will shelve fake news law if medium is ‘ professional ’ - bloomberg,anti-regulation
"law on fake news may be used vs. activist , journalist , professor warn - gma news online",anti-regulation
"journalist will only report on weather if peca is enforced , ihc told - the express tribune",anti-regulation
a lawsuit against perplexity call out fake news ai hallucination - wired,anti-regulation
new european law aim to protect medium outlet against disinformation - the conversation,pro-regulation
who ’ s worried about the peca amendment bill ? - pakistan today,anti-regulation
channel 4 bos call for urgent action and regulation to protect gen z from fake news - prolific north,pro-regulation
fact check : how to spot fake news ahead of eu election - dw ( english ),anti-regulation
the row between elon musk and brazil ’ s supreme court over free speech and fake news - brazil,anti-regulation
deconstructing regulation - the news international,anti-regulation
c4 ceo call for regulation to protect gen z from false news - advanced television,pro-regulation
( pdf ) the impact of fake news on public trust in traditional medium outlet - researchgate,pro-regulation
hong kong leader john lee say no need for law targeting fake news - south china morning post,anti-regulation
"no need for ‘ fake news ’ law a long a medium industry practice self-discipline , hong kong leader john lee say - hong kong free press",anti-regulation
"self-regulation the only way to avoid govt interference in news , panel told - hindustan time",anti-regulation
ofcom told to change outdated reporting rule to counter election day fake news - the independent,anti-regulation
factbox : 'fake news ' law around the world - reuters,anti-regulation
vloggers question house ‘ fake news ’ probe at sc - inquirer.net,anti-regulation
"bombay hc red line on fake news v free speech : judicial review , not government stamp - the indian express",anti-regulation
"hire factcheckers to fight election fake news , eu tell tech firm - the guardian",anti-regulation
brazil push back on big tech firm ' campaign against 'fake news law ' - reuters canada,anti-regulation
singapore : ‘ fake news ’ law curtails speech - human right watch,anti-regulation
minister shaza fatima confirms cybercrime law change ‘ to curb fake news ’ - pakistan - dawn.com,anti-regulation
countering fake news - the express tribune,anti-regulation
opinion | the law were supposed to attack ‘ fake news. ’ now they are jailing journalist - poynter,anti-regulation
"brazil defines rule for ai in election , candidate could lose mandate if they use tool to spread fake news - brazil",anti-regulation
global news medium on defensive after putin sign 'fake news ' law - reuters uk,anti-regulation
world press freedom day : india ’ s “ fake news ” law must not censor journalist - access,anti-regulation
hong kong leader flag 'fake news ' law a worry over medium freedom grow - reuters,anti-regulation
the promise and peril of brazil ’ s fake news law - rest of world,pro-regulation
censorious government are abusing “ fake news ” law - the economist,anti-regulation
countering disinformation effectively : an evidence-based policy guide - carnegie endowment for international peace,pro-regulation
"brazil diary : brasilia try again to regulate tech , get platform to pay for news - tech policy press",anti-regulation
how latin american government are fighting fake news - america quarterly,anti-regulation
should ( can ) fake news be regulated ? - foundation for economic education,neutral
hmrc slam ‘ fake news ’ over new tax rule for people selling item online - the mirror,anti-regulation
turkey ’ s new disinformation law affect more than meet the eye - carnegie endowment for international peace,pro-regulation
russia expands law criminalizing ‘ fake news ’ - politico europe,anti-regulation
"it committee to take up discussion on impact of ai , social medium regulation , fake news , ott - moneycontrol",pro-regulation
brazil receives pushback from tech company on ‘ fake news ’ bill - the guardian,anti-regulation
fake news bill : understand in 6 point the legislation being discussed in congress - conectas direitos humanos,anti-regulation
"citing “ fake news , ” singapore could be next to quash free expression - freedom house",anti-regulation
government are making fake news a crime – but it could stifle free speech - the conversation,anti-regulation
survey : 85 % favor regulation for information on social medium - 朝日新聞,anti-regulation
regulating online platform beyond the marco civil in brazil : the controversial `` fake news bill '' - tech policy press,pro-regulation
"more stick , less carrot : australia ’ s new approach to tackling fake news - the strategist",anti-regulation
eu warns microsoft ’ s bing could face probe over deepfakes and false news - politico europe,anti-regulation
'fake news ' bill in south korea get shelved amid outcry - the new york time,anti-regulation
"govt urged to consider regulation , support for influencers - nation thailand",pro-regulation
"‘ regulation ha to be part of the answer ’ to combating online disinformation , barack obama said at stanford event - stanford university news",pro-regulation
'chilling ' : singapore 's 'fake news ’ law come into effect - the guardian,anti-regulation
whose responsibility is the truth ? why brazil ’ s ‘ fake news ’ law keep stalling . - the christian science monitor,anti-regulation
change to cybercrime law to tighten noose on social medium - dawn.com,anti-regulation
hasani : the medium law will stop fake news - telegrafi,anti-regulation
false claim obama 'repealed ' 1940s law blocking government propaganda | fact check - usa today,anti-regulation
court 2024 : amended it rule on fake news quashed ; dharavi project relief for adani group - the economic time,anti-regulation
"item - social medium , misinformation and the law - legal advice centre - qmul",anti-regulation
qatar : 5-year prison sentence set for ‘ fake news ’ - human right watch,anti-regulation
doe anti-fake news regulation improve the quality of capital market ? - eurekalert,neutral
"view stay divided on pofma five year on , but ha it helped in tackling fake news ? - cna",neutral
"comelec asked : repeal rule on ai , social medium - inquirer.net",anti-regulation
- digital journalism : combating fake news and unlicensed reporting - bernama,pro-regulation
vietnam to require 24-hour take-down for `` false '' social medium content - reuters,anti-regulation
india ’ s top editor ’ body slam proposed ‘ fake news ’ rule - al jazeera english,pro-regulation
bombay high court strike down it rule amendment targeting ‘ fake news ’ on social medium : “ ... vague and he - the time of india,anti-regulation
chinese government adviser call for law to ban ‘ fake news ’ | china - the guardian,anti-regulation
is my library liable for fake news ? - american library,anti-regulation
"weekly tech recap : trai debunks fake news on otp delay from dec 1 , instagram get a location sharing feature and more | mint - mint",anti-regulation
toc issued pofma order for saying fake news law used to suppress dissenting view - the strait time,anti-regulation
"china shuts 100,000 fake news social medium account , ramp up content cleanup - reuters",anti-regulation
deep fake news - the regulatory review,anti-regulation
five year of pofma : how ha the law been used to combat fake news ? - the strait time,pro-regulation
"ethiopia : disinformation , fake news - the need for medium regulation - allafrica - top africa news",anti-regulation
russia fight back in information war with jail warning - reuters,anti-regulation
china : disinformation and use of advanced technology - dialogo-americas.com,anti-regulation
a disinformation deluge on california policy - legal planet,anti-regulation
the fight against disinformation : a persistent challenge for democracy - foreign policy research institute,pro-regulation
strategic communication and countering information manipulation - european commission,pro-regulation
documenting the assault on disinformation and hate speech research - tech policy press,pro-regulation
trump ’ s victory ha opened the disinformation floodgate - foreign policy,pro-regulation
corporate policy to protect against disinformation for young audience : the case of tiktok - frontier,pro-regulation
meta say it will end fact-checking a silicon valley prepares for trump - npr,anti-regulation
defining disinformation across eu and vlop policy - edmo,pro-regulation
pro-immigrant group eye tech policy to combat disinformation - bloomberg government,pro-regulation
addressing the impact of mis-/disinformation and hate speech on civilian : evolving policy and practice from peacekeeping and humanitarian actor - stimson center,pro-regulation
how young european citizen propose to combat disinformation in democratic society - science po,pro-regulation
big tech is still failing to tackle climate disinformation - global witness,anti-regulation
"the right to contraception : state and federal action , misinformation , and the court - kff",pro-regulation
"right-wing disinformation target dei , 'liberal ' policy a la burn - france 24 english",anti-regulation
researcher validate the danger of disinformation - tech policy press,pro-regulation
youtube approves disinformation ad in india ahead of general election - global witness,anti-regulation
what afd ’ s dark campaign in germany tell u about disinformation - tech policy press,anti-regulation
will the oversight board finally get meta to enforce it own policy on anti-trans hate and disinformation ? - tech policy press,anti-regulation
public agreement with misinformation about wind farm - nature.com,anti-regulation
joint letter on google disinformation policy - friend of the earth,pro-regulation
tiktok approves misleading election disinformation ad for publication in ireland ahead of eu election - global witness,anti-regulation
russia ’ s information war in moldova - foreign policy research institute,anti-regulation
"immigration in the 2024 u presidential election campaign : policy stalemate , disinformation , and a call for mass deportation - cidob",anti-regulation
why countering climate misinformation must be a priority - global government forum,anti-regulation
"side event during poc week : addressing the impact of mis-/disinformation and hate speech on civilian evolving policy and practice from peacekeeping and humanitarian actor ( thursday , 23 may 2024 15:00 – 17:00 edt | 21:00 – 23:00 cest ) - ocha",anti-regulation
"meta end fact-checking , prompting fear of misinformation - time",anti-regulation
fake news and disinformation in southeast asia : how should asean respond ? - frontier,anti-regulation
from panic to policy : the limit of foreign propaganda and the foundation of an effective response - texas national security review,pro-regulation
india ’ s fact-checkers react to meta ’ s policy change - columbia journalism review,pro-regulation
