stemmed_text,bert_label
watch chao through a screen : how social media is chang the way we follow extrem weather event - reuter institut,pro-regulation
australia drop plan to fine social media giant accus of enabl misinform - nbc news,anti-regulation
should social media compani be respons for fact-check their site ? - the new york time,anti-regulation
"‘ i can ’ t go toe to toe with social media. ’ top u.s. health offici reflect , regret . - the washington post",anti-regulation
misinform and disinform - britannica,anti-regulation
lawmak call for investig into social media-fuel hurrican misinform - nc newslin,anti-regulation
social media owner top global survey of misinform concern - the guardian,pro-regulation
feel outrag ? think twice befor hit “ share. ” - kellogg insight,anti-regulation
"see rise elect misinform , american say social media platform may bear respons for polit violenc - tech polici press",anti-regulation
how disinform defin the 2024 elect narr - brook institut,pro-regulation
spanish-languag social media increas latino ’ vulner to misinform - univers of california san diego,anti-regulation
social media is the new public health frontlin . let ’ s treat it that way . - harvard public health magazin,pro-regulation
"disinform vs misinform : how to spot fake news on the internet , social media - austin american-statesman",anti-regulation
"social media , advertis and misinform - nature.com",anti-regulation
social media ’ s role in fuel extrem and misinform - pb newshour,pro-regulation
address misinform about mental health with patient - apa psycholog news,anti-regulation
how republican push social media compani to stop fight elect misinform - cnn,anti-regulation
social media misinform is scare women about birth control - stat,anti-regulation
far-right populist much more like than the left to spread fake news – studi - the guardian,anti-regulation
"anti-vaccin disinform campaign , sunscreen myth , and counterfeit ozemp on social media — the monitor - kff",anti-regulation
australia threaten fine for social media giant enabl misinform - reuter,anti-regulation
"titusvil polic address officer-involv shoot , dispel social media misinform - talk of titusvil",anti-regulation
health want : misinform - rollin school of public health,anti-regulation
social media ’ s role in fuel extrem and misinform in a divid polit climat - pb newshour,pro-regulation
design social media to foster user engag in challeng misinform : a cross-cultur comparison between the uk and arab countri - nature.com,pro-regulation
nyu law forum debat govern effort to halt social media misinform - nyu law,anti-regulation
dissemin vs misinform : social media ’ s role in the evolut of cancer care - oncliv,pro-regulation
what public discours get wrong about misinform onlin - annenberg school for commun,anti-regulation
"review new scienc on social media , misinform , and partisan assort - tech polici press",pro-regulation
hierarch machin learn model can identifi stimuli of climat chang misinform on social media - nature.com,pro-regulation
"new studi shed light on misinform , news consumpt , and content moder - tech polici press",anti-regulation
climat misinform is rife on social media – and pois to get wors - the convers,anti-regulation
"social media and news fact sheet , 2024 - pew research center",pro-regulation
fir against 53 social media account - the time of india,anti-regulation
fir against 54 social media account for spread misinform on kumbh - the statesman,anti-regulation
"research consid the relationship between misinform , outrag , and the share of content on social media - tech polici press",anti-regulation
research find simpl correct can slow spread of misinform onlin - davidson news,anti-regulation
what public discours get wrong about social media misinform - fair observ,anti-regulation
"trump order govern not to infring on american ’ speech , call for censorship investig - the associ press",anti-regulation
"our outrag over social media post help misinform spread , studi show - phys.org",pro-regulation
help student spot misinform onlin - nation educ associ,pro-regulation
social media : disinform expert offer 3 safeti tip in a time of fake news and dodgi influenc - the convers,anti-regulation
teacher ' strike : social media 'misinform ' blame for deal be reject - bbc.com,anti-regulation
tackl misinform in mobil social network a bert-lstm approach for enhanc digit literaci - nature.com,pro-regulation
how social media compani are prepar for misinform after elect day - wbur news,anti-regulation
fir against 54 social media a/c for spread rumour - the time of india,anti-regulation
social media campaign tackl misinform about treacher darién jungl - unhcr,anti-regulation
differ in misinform share can lead to polit asymmetr sanction - nature.com,anti-regulation
"senat bill aim to curtail social media influenc , telehealth drug misinform - healio",anti-regulation
fir against 54 social media account for spread misinform on maha kumbh - opindia,anti-regulation
the 'sift ' strategi : a four-step method for spot misinform - bbc.com,pro-regulation
ai-gener misinform is everywher . id ’ ing it may be harder than you think - maryland today,anti-regulation
suprem court rule on social media affirm the first amend and the govern ’ s respons to protect the public from the harm of onlin misinform - free press,anti-regulation
multifacet strategi need to combat cancer misinform on social media - healio,pro-regulation
epidem model for misinform spread in digit network through a social intellig approach - nature.com,anti-regulation
misinform is win the war on misinform - vox.com,anti-regulation
claim about usaid fund are spread onlin . mani are not base on fact - the associ press,anti-regulation
"social media user ’ action , rather than bias polici , could drive differ in platform enforc - mit sloan news",neutral
rfk jr. amplifi tradit american skeptic and misinform - the mass media,pro-regulation
how hurrican milton and helen conspiraci theori took over social media - bbc.com,anti-regulation
our social media ‘ bespok realiti ’ - the bulwark,pro-regulation
"what are the link between social media algorithm , gener ai and the spread of harm content onlin ? - committe",anti-regulation
"thinkbeforeshar media campaign launch in kyrgyzstan to combat hate speech , misinform and to promot respons digit compet - unesco",anti-regulation
us suprem court allow govern to request remov of misinform on social media - the guardian us,anti-regulation
health misinform : expert advic on how to avoid it - medic news today,anti-regulation
wapo writer accus trump of 'govern censorship ' after back social media crackdown of 'misinform ' - fox news,anti-regulation
"unrest in the uk — social media , misinform , and crime rate challeng nation peac - vision of human",anti-regulation
whi you ’ re more like to solv your problem on a therapist ’ s sofa than on social media - cnn,anti-regulation
"social media firm , lawmak grappl with misinform ahead of 2024 vote - semafor",anti-regulation
tiktok and who are get togeth to help combat widespread health misinform on social media - the convers indonesia,pro-regulation
ask an expert : how ha ai chang misinform — and what doe that mean for consum ? - cal poli,anti-regulation
"reduc distrust in social media is not straightforward , comput scientist warn - william & mari",anti-regulation
australian govern drop bill on social media misinform - bloomberg,anti-regulation
what we do — and don ’ t — know about how misinform spread onlin - nature.com,pro-regulation
how to avoid fall for misinform and conspiraci theori - the washington post,anti-regulation
are fear about onlin misinform in the us elect overblown ? the evid suggest they might be - reuter institut,anti-regulation
suprem court allow white hous to request remov of misinform on social media - npr,anti-regulation
did social media promot misinform dure the summer 2024 riot ? - committe,anti-regulation
australia move to fine social media compani that spread misinform up to 5 % of global revenu - new york post,anti-regulation
"misinform thrive on outrag , studi find - psypost",anti-regulation
warn label from fact checker work — even if you don ’ t trust them - mit sloan news,pro-regulation
misinform run deeper than social media - computerweekly.com,anti-regulation
keir starmer warn social media firm after southport misinform fuel riot - reuter uk,anti-regulation
spain propos tighten rule on media to tackl fake news - reuter,anti-regulation
spain introduc bill to combat onlin fake news - the guardian,anti-regulation
feder trade commiss announc final rule ban fake review and testimoni - feder trade commiss news,anti-regulation
‘ draconian ’ law to control social media - busi record,pro-regulation
‘ fake news ’ legisl risk do more harm than good amid a record number of elect in 2024 - the convers,anti-regulation
the battl against misinform and disinform campaign : is your polic depart prepar ? - polic news,anti-regulation
behind bar for fake news : immin threat to media freedom in cypru - intern press institut,anti-regulation
spain 's propos to reform media law seen as threat to press freedom - voic of america english news,anti-regulation
spain to tighten law to combat spread of fake news onlin and over social media - surinenglish.com,anti-regulation
editori | qualiti journal to benefit from hong kong shelv law against fake news - south china morn post,pro-regulation
hong kong will shelv fake news law if media is ‘ profession ’ - bloomberg,anti-regulation
"law on fake news may be use vs. activist , journalist , professor warn - gma news onlin",anti-regulation
"journalist will onli report on weather if peca is enforc , ihc told - the express tribun",anti-regulation
a lawsuit against perplex call out fake news ai hallucin - wire,anti-regulation
new european law aim to protect media outlet against disinform - the convers,pro-regulation
who ’ s worri about the peca amend bill ? - pakistan today,anti-regulation
channel 4 boss call for urgent action and regul to protect gen z from fake news - prolif north,pro-regulation
fact check : how to spot fake news ahead of eu elect - dw ( english ),anti-regulation
the row between elon musk and brazil ’ s suprem court over free speech and fake news - brazil,anti-regulation
deconstruct regul - the news intern,anti-regulation
c4 ceo call for regul to protect gen z from fals news - advanc televis,pro-regulation
( pdf ) the impact of fake news on public trust in tradit media outlet - researchg,pro-regulation
hong kong leader john lee say no need for law target fake news - south china morn post,anti-regulation
"no need for ‘ fake news ’ law as long as media industri practic self-disciplin , hong kong leader john lee say - hong kong free press",anti-regulation
"self-regul the onli way to avoid govt interfer in news , panel told - hindustan time",anti-regulation
ofcom told to chang outdat report rule to counter elect day fake news - the independ,anti-regulation
factbox : 'fake news ' law around the world - reuter,anti-regulation
vlogger question hous ‘ fake news ’ probe at sc - inquirer.net,anti-regulation
"bombay hc red line on fake news vs free speech : judici review , not govern stamp - the indian express",anti-regulation
"hire factcheck to fight elect fake news , eu tell tech firm - the guardian",anti-regulation
brazil push back on big tech firm ' campaign against 'fake news law ' - reuter canada,anti-regulation
singapor : ‘ fake news ’ law curtail speech - human right watch,anti-regulation
minist shaza fatima confirm cybercrim law chang ‘ to curb fake news ’ - pakistan - dawn.com,anti-regulation
counter fake news - the express tribun,anti-regulation
opinion | the law were suppos to attack ‘ fake news. ’ now they are jail journalist - poynter,anti-regulation
"brazil defin rule for ai in elect , candid could lose mandat if they use tool to spread fake news - brazil",anti-regulation
global news media on defens after putin sign 'fake news ' law - reuter uk,anti-regulation
world press freedom day : india ’ s “ fake news ” law must not censor journalist - access,anti-regulation
hong kong leader flag 'fake news ' law as worri over media freedom grow - reuter,anti-regulation
the promis and peril of brazil ’ s fake news law - rest of world,pro-regulation
censori govern are abus “ fake news ” law - the economist,anti-regulation
counter disinform effect : an evidence-bas polici guid - carnegi endow for intern peac,pro-regulation
"brazil diari : brasilia tri again to regul tech , get platform to pay for news - tech polici press",anti-regulation
how latin american govern are fight fake news - america quarterli,anti-regulation
should ( can ) fake news be regul ? - foundat for econom educ,neutral
hmrc slam ‘ fake news ’ over new tax rule for peopl sell item onlin - the mirror,anti-regulation
turkey ’ s new disinform law affect more than meet the eye - carnegi endow for intern peac,pro-regulation
russia expand law crimin ‘ fake news ’ - politico europ,anti-regulation
"it committe to take up discuss on impact of ai , social media regul , fake news , ott - moneycontrol",pro-regulation
brazil receiv pushback from tech compani on ‘ fake news ’ bill - the guardian,anti-regulation
fake news bill : understand in 6 point the legisl be discuss in congress - conecta direito humano,anti-regulation
"cite “ fake news , ” singapor could be next to quash free express - freedom hous",anti-regulation
govern are make fake news a crime – but it could stifl free speech - the convers,anti-regulation
survey : 85 % favor regul for inform on social media - 朝日新聞,anti-regulation
regul onlin platform beyond the marco civil in brazil : the controversi `` fake news bill '' - tech polici press,pro-regulation
"more stick , less carrot : australia ’ s new approach to tackl fake news - the strategist",anti-regulation
eu warn microsoft ’ s bing could face probe over deepfak and fals news - politico europ,anti-regulation
'fake news ' bill in south korea get shelv amid outcri - the new york time,anti-regulation
"govt urg to consid regul , support for influenc - nation thailand",pro-regulation
"‘ regul ha to be part of the answer ’ to combat onlin disinform , barack obama said at stanford event - stanford univers news",pro-regulation
'chill ' : singapor 's 'fake news ’ law come into effect - the guardian,anti-regulation
whose respons is the truth ? whi brazil ’ s ‘ fake news ’ law keep stall . - the christian scienc monitor,anti-regulation
chang to cybercrim law to tighten noos on social media - dawn.com,anti-regulation
hasani : the media law will stop fake news - telegrafi,anti-regulation
fals claim obama 'repeal ' 1940 law block govern propaganda | fact check - usa today,anti-regulation
court 2024 : amend it rule on fake news quash ; dharavi project relief for adani group - the econom time,anti-regulation
"item - social media , misinform and the law - legal advic centr - qmul",anti-regulation
qatar : 5-year prison sentenc set for ‘ fake news ’ - human right watch,anti-regulation
doe anti-fak news regul improv the qualiti of capit market ? - eurekalert,neutral
"view stay divid on pofma five year on , but ha it help in tackl fake news ? - cna",neutral
"comelec ask : repeal rule on ai , social media - inquirer.net",anti-regulation
- digit journal : combat fake news and unlicens report - bernama,pro-regulation
vietnam to requir 24-hour take-down for `` fals '' social media content - reuter,anti-regulation
india ’ s top editor ’ bodi slam propos ‘ fake news ’ rule - al jazeera english,pro-regulation
bombay high court strike down it rule amend target ‘ fake news ’ on social media : “ ... vagu and he - the time of india,anti-regulation
chines govern advis call for law to ban ‘ fake news ’ | china - the guardian,anti-regulation
is my librari liabl for fake news ? - american librari,anti-regulation
"weekli tech recap : trai debunk fake news on otp delay from dec 1 , instagram get a locat share featur and more | mint - mint",anti-regulation
toc issu pofma order for say fake news law use to suppress dissent view - the strait time,anti-regulation
"china shut 100,000 fake news social media account , ramp up content cleanup - reuter",anti-regulation
deep fake news - the regulatori review,anti-regulation
five year of pofma : how ha the law been use to combat fake news ? - the strait time,pro-regulation
"ethiopia : disinform , fake news - the need for media regul - allafrica - top africa news",anti-regulation
russia fight back in inform war with jail warn - reuter,anti-regulation
china : disinform and use of advanc technolog - dialogo-americas.com,anti-regulation
a disinform delug on california polici - legal planet,anti-regulation
the fight against disinform : a persist challeng for democraci - foreign polici research institut,pro-regulation
strateg commun and counter inform manipul - european commiss,pro-regulation
document the assault on disinform and hate speech research - tech polici press,pro-regulation
trump ’ s victori ha open the disinform floodgat - foreign polici,pro-regulation
corpor polici to protect against disinform for young audienc : the case of tiktok - frontier,pro-regulation
meta say it will end fact-check as silicon valley prepar for trump - npr,anti-regulation
defin disinform across eu and vlop polici - edmo,pro-regulation
pro-immigr group eye tech polici to combat disinform - bloomberg govern,pro-regulation
address the impact of mis-/disinform and hate speech on civilian : evolv polici and practic from peacekeep and humanitarian actor - stimson center,pro-regulation
how young european citizen propos to combat disinform in democrat societi - scienc po,pro-regulation
big tech is still fail to tackl climat disinform - global wit,anti-regulation
"the right to contracept : state and feder action , misinform , and the court - kff",pro-regulation
"right-w disinform target dei , 'liber ' polici as la burn - franc 24 english",anti-regulation
research valid the danger of disinform - tech polici press,pro-regulation
youtub approv disinform ad in india ahead of gener elect - global wit,anti-regulation
what afd ’ s dark campaign in germani tell us about disinform - tech polici press,anti-regulation
will the oversight board final get meta to enforc it own polici on anti-tran hate and disinform ? - tech polici press,anti-regulation
public agreement with misinform about wind farm - nature.com,anti-regulation
joint letter on googl disinform polici - friend of the earth,pro-regulation
tiktok approv mislead elect disinform ad for public in ireland ahead of eu elect - global wit,anti-regulation
russia ’ s inform war in moldova - foreign polici research institut,anti-regulation
"immigr in the 2024 us presidenti elect campaign : polici stalem , disinform , and a call for mass deport - cidob",anti-regulation
whi counter climat misinform must be a prioriti - global govern forum,anti-regulation
"side event dure poc week : address the impact of mis-/disinform and hate speech on civilian evolv polici and practic from peacekeep and humanitarian actor ( thursday , 23 may 2024 15:00 – 17:00 edt | 21:00 – 23:00 cest ) - ocha",anti-regulation
"meta end fact-check , prompt fear of misinform - time",anti-regulation
fake news and disinform in southeast asia : how should asean respond ? - frontier,anti-regulation
from panic to polici : the limit of foreign propaganda and the foundat of an effect respons - texa nation secur review,pro-regulation
india ’ s fact-check react to meta ’ s polici chang - columbia journal review,pro-regulation
target countri should demand account from the pentagon and platform for covid disinform - tech polici press,anti-regulation
fact-check misinform about the lo angel wildfir and california water polici - pb newshour,anti-regulation
how russia invad wikipedia - foreign polici,anti-regulation
algorithm reliabl framework : polici for misinform and fake news - brunel univers news,pro-regulation
track the weapon of america 's polit system in favor of disinformation—and it export abroad - tech polici press,pro-regulation
there ’ s no dodg button for disinform - foreign polici,anti-regulation
( pdf ) the disinform playbook : how industri manipul the science-polici process—and how to restor scientif integr - researchg,pro-regulation
‘ massiv disinform campaign ’ is slow global transit to green energi - the guardian,anti-regulation
defend canada : the battl against ai-driven disinform - polici option,pro-regulation
research say media need gener ai polici to help navig misinform and disinform - phys.org,anti-regulation
disinform in poland – polici brief - visegrad insight,pro-regulation
russia ’ s global inform oper have grown up - foreign polici,pro-regulation
meta face e.u . investig over elect disinform - the new york time,anti-regulation
counter disinform - welcom to the unit nation,pro-regulation
b.c . elect test new polici to protect elect from digit threat - polici option,pro-regulation
"meta drop fact-check , loosen it content moder rule - techcrunch",anti-regulation
"dark forc , fake news : how partisan attack undermin yoon ’ s unif polici - nk news",anti-regulation
govern ’ s secret counter-disinform polici reveal - big brother watch,pro-regulation
ama adopt new polici aim at address public health disinform - american medic associ,neutral
evalu anti-misinform polici on social media - cepr,pro-regulation
the rise of disinform is a challeng and an opportun for uk foreign polici - politicshom,pro-regulation
"arkansa public polici panel : 60th anniversari , battl disinform - peopl 's action",pro-regulation
"whatsapp channel , use by million , ha no clear elect rule - politico",anti-regulation
alberta ’ s conserv parti invit climat disinform into polici debat - corpor knight magazin,pro-regulation
stop the world : secur democraci : counter disinform in 2024 - australian strateg polici institut,pro-regulation
how to counter disinform base on scienc - tech polici press,pro-regulation
what the fate of the stanford internet observatori mean for disinform research - tech polici press,pro-regulation
mathemat model of disinform and effect of mitig polici - nature.com,pro-regulation
gener ai and disinform - bipartisan polici center,pro-regulation
canadian elect are threaten by disinform - polici option,anti-regulation
india and taiwan 's diverg path to combat onlin disinform - tech polici press,anti-regulation
australian media need gener ai polici to help navig misinform and disinform - rmit univers,anti-regulation
"meta 's thread need a polici for elect disinform , vote group say - npr",anti-regulation
a short histori of eu anti-disinform polici - pubaffair bruxel,pro-regulation
trump call attempt to link him to project 2025 ‘ pure disinform ’ - the hill,anti-regulation
european democraci and counter-disinform : toward a new paradigm ? - carnegi endow for intern peac,pro-regulation
governor newsom sign nation-lead social media transpar measur - offic of governor gavin newsom,pro-regulation
disinform on tiktok : research and content moder polici - eu disinfolab,anti-regulation
disinform on facebook : research and content moder polici - eu disinfolab,anti-regulation
disinform : anti-who convoy head to geneva for world health assembl - health polici watch,anti-regulation
fight coronaviru misinform and disinform - center for american progress,pro-regulation
"from # yes2meat to beef checkoff , report show how to fight meat misinform - green queen media",anti-regulation
disinform : reliabl inform is essenti for democrat stabil - georg w. bush presidenti center,pro-regulation
isd contribut to shape the european commiss 's dg-clima polici regard climat mis- and disinform - institut for strateg dialogu,pro-regulation
psycholog inocul strategi to fight climat disinform across 12 countri - nature.com,pro-regulation
disinform on youtub : research and content moder polici - eu disinfolab,anti-regulation
how to combat fake news and disinform - brook institut,pro-regulation
"terror , extrem , disinform and artifici intellig : a primer for polici practition - institut for strateg dialogu",pro-regulation
an updat on our approach to us elect misinform - youtub offici blog,anti-regulation
big tech roll back misinform measur ahead of 2024 - axio,anti-regulation
how decad of disinform about fossil fuel halt u.s. climat polici - npr,anti-regulation
deconstruct the israel-hama disinform war - atlant council,anti-regulation
farmer ' protest exploit to spread fake news about eu climat polici : studi nail european far right - eunew,anti-regulation
twitter will no longer enforc it covid misinform polici - npr,anti-regulation
how social media platform ’ commun standard address influenc oper - carnegi endow for intern peac,pro-regulation
combat disinform wane at social media giant ( publish 2023 ) - the new york time,anti-regulation
a free pass for fake news ? the danger of meta ’ s new content polici - moneyweb,anti-regulation
disinform on telegram : research and content moder polici - eu disinfolab,anti-regulation
"april ’ s wild ride : twitter , pinterest move on disinform , then elon musk happen - the equat",anti-regulation
an updat on our work to keep peopl inform and limit misinform about covid-19 - meta store,pro-regulation
disinform isn ’ t just a problem for elect - foreign polici,anti-regulation
assess the problem of disinform - tech polici press,pro-regulation
the west is still oblivi to russia ’ s inform war - foreign polici,pro-regulation
safeguard democraci against disinform - german marshal fund,pro-regulation
inform disord - bipartisan polici center,anti-regulation
how longstand iranian disinform tactic target protest - the washington institut,anti-regulation
