stemmed_text,bert_label
john bolton 's secret servic protect discontinu by trump administr,anti-regulation
trump is build hi administr on a foundat laid by ron desanti : opinion,pro-regulation
media outlet and person whine about exhaust just day into trumpâ presid,anti-regulation
california dreamin ’,pro-regulation
whi doe everyon hate peta ?,anti-regulation
​​beij ’ s target of taiwan ’ s undersea cabl preview cross-strait tension under a trump presid,pro-regulation
human right campaign to lay off 20 % of staff as lgbtq+ organ restructur ( exclus ),pro-regulation
whi lo angel burn,anti-regulation
an omin year : the climat chang omen for 2025 look veri dark inde,anti-regulation
eu push through with enforc of censorship tool digit servic act,anti-regulation
overview of inform influenc activ,pro-regulation
rfk jr.â confirm hear : a battl for health freedom and the soul of american polit,pro-regulation
"nuclear reduct , end the ukrain conflict and massiv tax cut : key takeaway from donald trump ’ s davo speech",pro-regulation
link 2/4/2025,anti-regulation
"the la wildfir , misinform , and the urgent need for democrat to invest in new media infrastructur | opinion",anti-regulation
joe romm ’ s the climat ate my homework ! ( re southern california fire ),pro-regulation
california governor spar with musk over wildfir 'li ',anti-regulation
"like a ‘ zombi addict , ’ the left can ’ t stop hate maga",pro-regulation
journal and audienc : five must-read recent news report for your newsroom,pro-regulation
trump to tour disast zone in north carolina and california,pro-regulation
"x , facebook , instagram , and youtub sign eu pledg to tackl hate speech",anti-regulation
donald trump is offici presid again,pro-regulation
‘ most want ceo ’ play card get user ban from most platform,anti-regulation
you can fire off hot take with confid thank to ‘ cancel cultur insur ’,pro-regulation
the cultur war have arriv at your googl calendar,pro-regulation
trump ’ s first 100 day : all the news impact the tech industri,pro-regulation
"meta suspend abort pill provid ' account , remov post",anti-regulation
ctrl-alt-speech : digit oligarch gun for europ ( doge ),anti-regulation
they use to love elon musk . now they ’ re hi biggest enemi onlin .,pro-regulation
ctrl-alt-speech : bullshit in a china shop,anti-regulation
ctrl-alt-speech : the ticktock on tiktok,pro-regulation
ctrl-alt-speech : thi episod ha masculin energi,anti-regulation
rednot : what to know about the chines tiktok replac,pro-regulation
the no-longer-need-to-hide-it administr,pro-regulation
platform systemat remov a user becaus he made “ most want ceo ” play card,anti-regulation
ai bot boost onlin engag but hamper discuss,neutral
advertis aren ’ t thrill with zuckerberg ’ s embrac of hate speech,anti-regulation
the twitter file playbook come for the us govern,pro-regulation
"appl is onc again advertis on x , more than a year after stop all ad on the platform",anti-regulation
thi $ 2 billion content moder compani is tri to stop ai imag of child sexual abus,anti-regulation
insid tiktok 's weekend of whiplash,pro-regulation
what happen when a troll becom head of the fcc ? we ’ re about to find out .,neutral
"high iron level , optim glucos level , lead test | thrr203",pro-regulation
the sim at 25 : how a virtual dollhous took over the world,pro-regulation
america is seesaw between sobrieti and booz it up,anti-regulation
thi week in techdirt histori : januari 12th – 18th,pro-regulation
"in wake of meta moder shift , advertis have accept new statu quo : brand safeti is a myth",anti-regulation
kany ’ s latest antic prove there are line you still can ’ t cross . but not for long,neutral
"after stab , china ’ s social media firm face scrutini over hate speech",anti-regulation
silicon valley kiss the ring,pro-regulation
platform systemat remov a user becaus he made `` most want ceo '' play card,anti-regulation
openai 's agent that can do work for you is here,pro-regulation
protect “ free speech ” can ’ t just be about target polit oppon,pro-regulation
how will meta ’ s new content polici affect artist ?,anti-regulation
a guid to deploy ai for real-tim content moder,pro-regulation
meta relax fact check polici amid chang polit landscap,pro-regulation
is the tiktok ban a chanc to rethink the whole internet ?,anti-regulation
unitedhealth hire defam law firm follow social media post,anti-regulation
trump and vanc ’ s offici portrait are as ugli as it get,anti-regulation
beyond doomscrol,pro-regulation
biden temporarili vanish from googl ’ s presidenti search histori,anti-regulation
"bold call : as musk ’ s polit clout rise , twitter ’ s brand exodu could becom a x ’ s brand influx",anti-regulation
is social media more like cigarett or junk food ?,anti-regulation
"meta ’ s ‘ bonfir ’ of safeti polici a danger to children , chariti say",anti-regulation
the european commiss want elon musk to reveal the secret of the x recommend algorithm ( don ’ t we all ? ),pro-regulation
trump ’ s truth social user target by rampant scam onlin,anti-regulation
big tech sign up for hate speech code of conduct,anti-regulation
reddit group ban x link in protest at musk arm gestur,anti-regulation
meta shift from fact-check to crowdsourc spotlight compet approach in fight against misinform and hate speech,pro-regulation
"facebook , tiktok harden eu commit to tackl disinform -- but not x",anti-regulation
x ban spread across reddit as commun react to musk ’ s gestur,anti-regulation
"climat misinform to escal on social media , expert warn",anti-regulation
famili sue tiktok in franc over teen suicid they say are link to harm content,anti-regulation
"googl defi european union , refus to includ fact-check in search result and youtub video",anti-regulation
"blueski : exit , voic , and platform loyalti",pro-regulation
vpn is now the resist tool of choic in authoritarian regim,pro-regulation
a call for broaden the altmetr tent to democrat scienc outreach,pro-regulation
‘ women with larg chest have a harder time get video approv ’ : alleg ex-tiktok insid reveal what realli get your content remov,anti-regulation
how state tech polici in 2024 set the stage for 2025,pro-regulation
french famili of suicid victim sue tiktok over alleg harm content,anti-regulation
‘ are we date the same girl ? ’ : insid telegram ’ s reveng porn problem,anti-regulation
meta just flip the switch that prevent misinform from spread in the unit state ( casey newton/platform ),anti-regulation
telehealth abort : the futur of access,pro-regulation
"x , youtub , meta sign the eu 's updat code of conduct to improv handl hate speech",anti-regulation
lgbtq creator brace for meta ’ s pro-trump chang,pro-regulation
we need to protect the protocol that run blueski,pro-regulation
onlin platform risk becom ideolog echo chamber that undermin meaning dialogu,anti-regulation
"rundown : ftc ’ s potenti prioriti for ad tech , data and ai",pro-regulation
tiktok and rednot - consent without transpar isn ’ t freedom ; it ’ s control,anti-regulation
trump sign execut order to prevent censorship of onlin platform,anti-regulation
"digit subscript will soon pay for entir newsroom of le mond , say ceo",anti-regulation
are you be serv youtub ?,anti-regulation
how to custom your blueski handl with a custom domain from wordpress.com,pro-regulation
softwar engin exploit unicod quirk to conceal inform within emoji charact,pro-regulation
"meta q4 2024 profit up 49 % at $ 20.8 billion , no impact of content moder remov on ad spend : cfo",anti-regulation
"media brief : a histori of media compani get into the social platform busi , in light of buzzfe ’ s plan",pro-regulation
doge staff had question about the 'resign ' email . their new hr chief dodg them,anti-regulation
masterbuilt add anoth smart charcoal grill to it graviti seri lineup,pro-regulation
"roli final introduc a larger teach piano keyboard , complet with ai",pro-regulation
"no excus to not build 1.5m new home , rayner say",anti-regulation
laser eye safeti in digit fabric : protect your vision,pro-regulation
"kohler use water , light , sound and steam for `` multi-sensori '' shower",pro-regulation
"digit realiti , digit shock : grow up at the dawn of cyberspac",pro-regulation
the 10 best thing i saw at namm,pro-regulation
no ham licens ? listen anyway in your browser,anti-regulation
shield your digit life : essenti privaci tool everi android user need in 2025,pro-regulation
new app store api give develop more control over massiv in-app purchas catalog,pro-regulation
top 20 app track you everi day,pro-regulation
screenshot-scan malwar discov on appl app store in first-of-its-kind attack,anti-regulation
amazon ban number plate as illeg suppli found,anti-regulation
intern regul probe how deepseek is use data . is the app safe to use ?,neutral
the samsung galaxi s25 ’ s most tout ai featur left me disappoint,anti-regulation
how magnet font twist up number and save bank forev,pro-regulation
thi ergonom camera for solo video shoot make short-form content truli profession,pro-regulation
the eu is crack down on ad in window 11 ’ s start menu,anti-regulation
ai will write complex law,pro-regulation
the sicken truth : healthcar data breach reach all-tim high,anti-regulation
"can an ai chatbot help you quit smoke ? it can , with lot of caution",pro-regulation
best budget app to get control of your money in 2025,pro-regulation
how to delet multipl text messag on a mac and ipad,pro-regulation
"work at the mill or , the stori of digit equip corpor",pro-regulation
"taiwan ban deepseek ai over nation secur concern , cite data leakag risk",anti-regulation
everyth you need to know about surfshark one vpn bundl for appl devic,pro-regulation
"nikon releas it ’ s latest superzoom updat , the coolpix p1100",pro-regulation
"appl ’ s calendar app is quickli improv , and io 18.3 offer a new advantag",pro-regulation
moviepass want to know if it should get into crypto,neutral
tech exec send signal about where their compani are head,pro-regulation
whi do health app fail ? research burst the hype with clear evid,anti-regulation
"i drove a $ 48,000 nissan frontier . it 's simpl , power , and deliv pretti much everyth you need in a truck .",pro-regulation
outsmart hacker who are out to steal your ident,anti-regulation
tesla model y junip vs rivian r1 : can tesla ’ s newest take out a much more expens vehicl ?,anti-regulation
"from film fund to distribut , thi partnership give you control : ‘ anyon can do thi ’",pro-regulation
how elon musk ’ s doge could end the u.s. govern as we know it,pro-regulation
what happen to your onlin account when you die ?,anti-regulation
develop should embrac creativ code again,pro-regulation
50 best appl watch app : from health app to game and everyth inbetween,pro-regulation
break down the nsa 's guidanc on zero trust implement ( 2024 ),anti-regulation
"court order pirat site missav to pay $ 4.5m in damag , domain seiz",anti-regulation
nikon releas a new compact digit camera – the coolpix p1100,pro-regulation
"news weekli : deepseek rise , massiv garmin outag , the s pen confus , and more",anti-regulation
"news weekli : alphabet 's earn soar , new zenfon ultra , and more",pro-regulation
tesla model y junip vs 2024 tesla model y : what ’ s actual new ?,pro-regulation
"i love thi new mail featur in io 18.2 , but it still need work",pro-regulation
who is part of elon musk 's doge and what are they do ?,pro-regulation
infosec 101 for activist,pro-regulation
appl glass : the futur of ar or a distant dream ?,pro-regulation
the oppo find x8 ultra could come with a button instead of an alert slider,anti-regulation
digit trust architectur : build a sustain onlin presenc,pro-regulation
we 're perform for an audienc of machin,pro-regulation
proton : we 're give away over $ 1m to support a better internet,anti-regulation
googl map embrac the gulf of america name after trump order,pro-regulation
push the boundari of flat optic,pro-regulation
googl tv streamer tip and trick,pro-regulation
mac malwar mayhem as 100 million appl user at risk of have person data stolen,anti-regulation
doge as a nation cyberattack,pro-regulation
25 year of appl 's innov with the itun music store,pro-regulation
iphon 17 pro max rumor to featur smaller dynam island,neutral
even realiti g1 : the fashion futurist smart glass that googl & meta wish they made,pro-regulation
ddose by polici : websit takedown and keep inform aliv,anti-regulation
the subtl art of design physic control for car,pro-regulation
reverse-engin and analysi of sandisk high endur microsdxc card ( 2020 ),anti-regulation
the amaz stori of how a cooler and app have transform organ transplant,pro-regulation
the real pro and con of shoot film,pro-regulation
firm are risk “ digit chao '' if they do n't get their ai deploy right,anti-regulation
leverag a gener ai strategi to mitig inform leakag,pro-regulation
resist digit feudal,pro-regulation
news boss : busi is back with 'yok of woke have been lift ' ...,anti-regulation
how to see through musk ’ s truth distort : a mirror doesn ’ t lie,anti-regulation
how to weather the storm,pro-regulation
trend in digit ident verif : insight from tech expert,pro-regulation
googl pixel : how to set up ident check,pro-regulation
trump white hous just made a crucial move to ensur it 's final in control of the execut branch,pro-regulation
microsoft block critic secur boot loophol after over 7 month — fortifi window 11 against sophist firmwar attack camouflag as verifi uefi app,anti-regulation
“ big brother in your pocket : ” privaci advoc slam uk id digit wallet propos,pro-regulation
6 reason open-sourc softwar is the futur of creativ industri,pro-regulation
control your raspberri pi gpio with arduino cloud use node.j | part iii,pro-regulation
the origin and unexpect evolut of the word `` mainfram '',pro-regulation
sovereign cloud : redefin the futur of secur digit innov,pro-regulation
how vpn shape the futur of decentr network on android,pro-regulation
a unifi digit experi is a boon to ani brand,pro-regulation
canon announc the new rf16-28mm f2.8 is stm len perfect for creator,pro-regulation
the ai edg : transform busi growth in the digit era,pro-regulation
window 11 's latest secur updat wo n't play nice with these audio devic,anti-regulation
help your famili brows safe with thi vpn,pro-regulation
the final flicker of cabl news as we know it ...,pro-regulation
solo indi game develop clair morwood on make hand-craft playabl indie-rock concept album aster,pro-regulation
how the nation basketbal player associ is priorit athlet health,pro-regulation
"help ! we 're drown in email spam , it 's about to get wors and there 's noth we can do to stop it",anti-regulation
"'adrenalin of the moment ' drove children to take part in summer riot , say commission",pro-regulation
biden warn of oligarch . some offici worri he may have help creat one .,anti-regulation
gavin newsom issu strang plea to joe biden as he face furiou backlash for wildfir respons,anti-regulation
the plagu of social media misinform,anti-regulation
onlin 'content moder ' sue facebook over exposur to graphic content,anti-regulation
elect secur and misinform regul - the regulatori review,pro-regulation
jd vanc knock eu ’ s regul of us tech giant : ‘ america can not accept that ’ - forb,anti-regulation
australia abandon legisl requir social media compani to regul misinform - jurist,anti-regulation
( pdf ) third person effect of fake news : fake news regul and media literaci intervent - researchg,anti-regulation
vatican urg regul of ai to prevent misinform - dig watch updat,anti-regulation
percept of disinform regul in the andean commun - frontier,pro-regulation
australia propos new law to address misinform on social media platform - social media today,pro-regulation
what the next presid will do about artifici intellig - scientif american,pro-regulation
"editor ’ s note : meta , misinform and esg metric - sustain view",pro-regulation
"ban in brazil : the world is move toward greater regul of social media , two northeastern expert say - northeastern univers",anti-regulation
"australia : ambiti anti-disinform bill drop , rsf call for regul of onlin platform - report san frontièr",anti-regulation
suprem court case on content moder and mifepriston access — the monitor - kff,anti-regulation
meta ’ s fact-check overhaul widen global rift on disinform - the washington post,anti-regulation
"musk stir uk divis , spark call for faster rollout of onlin safeti law - reuter",anti-regulation
ai is amplifi social media disinform — and make big tech civilli liabl may be the key to stem it - busi insid,anti-regulation
a review of content moder polici in latin america - tech polici press,pro-regulation
"big tech trial : free speech , misinform , & regul in 2024 - techinform",pro-regulation
"new ai law aim to curb elect misinform , protect hollywood actor - newsweek",anti-regulation
top saturday seminar of 2024 - the regulatori review,pro-regulation
uk revisit social media regul after far-right riot - reuter uk,anti-regulation
"expert discuss misinform , ai regul in ‘ ai and healthcar ’ event - the brown daili herald",anti-regulation
the ai elect is here . regul can ’ t decid whose problem it is . - the washington post,pro-regulation
the feder govern ’ s propos mis- and disinform law need to have clearer definit – and includ ai - the convers indonesia,anti-regulation
"actual , tim walz , the first amend doe protect misinform and `` hate speech '' - cato institut",anti-regulation
"to combat misinform , focu on the architectur of social media platform - abc religion & ethic - abc news",pro-regulation
( pdf ) trend in the regul of hate speech and fake news : a threat to free speech ? - researchg,anti-regulation
gari marcu say regul must be strengthen as gener ai threaten democraci - eweek,pro-regulation
brazil lead dialogu on inform integr and platform regul — planalto - gov.br,pro-regulation
how to regul misinform - royal societi,pro-regulation
protect yourself from elect misinform - eff,anti-regulation
australia ’ s anti-misinform law target twitter - abov the law,anti-regulation
call for urgent ai regul as fake news flood social media dure brazil flood - peopl of color in tech,anti-regulation
combat falsehood - the news intern,anti-regulation
disinform and democraci : challeng in social media regul in southeast asia - 9dashlin,pro-regulation
"ai deepfak , bad law – and a big fat indian elect - reuter institut",anti-regulation
16 april : how platform are respond to eu regul to prevent climat disinform - eu disinfolab,anti-regulation
the misinform bill wa axe . how els can we combat the ‘ biggest global risk ’ ? - sb,anti-regulation
regul the spread of mis/disinform onlin is not an attack on freedom of speech - abc news,anti-regulation
law for ai are double-edg sword in the disinform battl - bloomberg law,pro-regulation
how educ and social media regul can combat scienc denial - eco-busi,pro-regulation
opinion | the best way to regul social media ha been stare us right in the face - politico,pro-regulation
right first : principl for digit platform regul - human right law centr,pro-regulation
the biggest perpetr of misinform and privaci breach will escap new law - crikey,anti-regulation
"the earli day of the pandem expos the flaw in the govern 's misinform law , say legal expert - abc news",anti-regulation
govern to propos stricter regul for social media - 朝日新聞,anti-regulation
what is the misinform bill and whi ha it trigger worri about freedom of speech ? - sb news,anti-regulation
"hani farid : to limit disinform , we must regul internet platform - uc berkeley",pro-regulation
albanes govern must stop big tech poison australia ’ s democraci with lie and misinform - human right law centr,anti-regulation
the us is draft new law to protect against ai-gener deepfak - world econom forum,pro-regulation
onlin safeti act : explain - gov.uk,anti-regulation
89％ seek regul of ai-gener misinform in japan - asianews.network,anti-regulation
the challeng of regul disinform - promarket,pro-regulation
disinform nation : what can we do to crack the code ? - uc berkeley,anti-regulation
opinion | regul frontier ai to avoid misinform - the wall street journal,pro-regulation
how to respond to disinform while protect free speech - reuter institut,pro-regulation
"goa ’ s fix to counter tourist ‘ misinform ’ : regul taxi fare , streamlin beach wed - the indian express",anti-regulation
should govern regul social media misinform ? - divid we fall,anti-regulation
pakistan plan to regul social media through legisl - the diplomat,pro-regulation
brazilian judg regul elect … and ai - verfassungsblog,pro-regulation
get disinform right - the regulatori review,anti-regulation
australian research launch global misinform databas - ac,anti-regulation
adob ceo on new era of gener ai and tackl misinform - the washington post,anti-regulation
algorithm are push ai-gener falsehood at an alarm rate . how do we stop thi ? - the convers indonesia,anti-regulation
new tool track disinform law global - intern center for journalist,pro-regulation
the limit of deplatform - the regulatori review,pro-regulation
media watchdog will have more power to forc tech compani to crack down on disinform under new bill - abc news,anti-regulation
regul ai deepfak and synthet media in the polit arena - brennancenter.org,pro-regulation
'no pathway ' : govern drop controversi misinform bill amid senat opposit - sb news,anti-regulation
martha minow look at way govern can stop disinform - harvard gazett,anti-regulation
"regul polit misinform isn ’ t easi , but it ’ s necessari to protect democraci - the convers indonesia",neutral
"most american favor restrict on fals inform , violent content onlin - pew research center",anti-regulation
prevent misinform and disinform in onlin filter bubbl - common librari,anti-regulation
"regul essenti to curb ai for surveil , disinform : right expert - un news",pro-regulation
time to regul fake news industri - jamaica observ,anti-regulation
albanes govern must hold big tech account for misinform poison australia ’ s democraci - human right law centr,anti-regulation
chat about chatgpt regul - the regulatori review,pro-regulation
what will 2022 bring in the way of misinform on social media ? 3 expert weigh in - the convers,anti-regulation
fix disinform onlin - the american prospect,pro-regulation
full senat to take up pre-elect regul of ‘ deepfak ’ misinform - south dakota searchlight,anti-regulation
opinion | facebook is bad . fix it rashli could make it much wors . ( publish 2021 ) - the new york time,anti-regulation
the podcast problem - the regulatori review,anti-regulation
"if big tech ha the will , here are way research show self-regul can work - the convers indonesia",pro-regulation
it is time to pass law to protect voter against disinform - forb,pro-regulation
"rein in ai mean figur out which regul option are feasibl , both technic and econom - the convers indonesia",pro-regulation
european regul of onlin disinform may be a “ game changer ” in 2022 - columbia journal review,anti-regulation
rush to pass ‘ fake news ’ law dure covid-19 intensifi global media freedom challeng - intern press institut,anti-regulation
social media compani should self-regul . now . - hbr.org daili,pro-regulation
regul social media algorithm - the regulatori review,pro-regulation
restor trust in the media - the regulatori review,pro-regulation
move the needl on health disinform - think global health,pro-regulation
use scienc to guid social media regul - tech polici press,pro-regulation
"85 % of peopl worri about onlin disinform , global survey find - the guardian",anti-regulation
eye on ai : ai-gener misinform - white & case llp,anti-regulation
"state act , but can legisl slow ai-gener elect disinform ? - govern",neutral
hous leader bat for social media regul to curb fake news - pna.gov.ph,anti-regulation
regul elect in the unit state - the regulatori review,pro-regulation
fda head want 'better regul ' of what govern consid misinform - reason,anti-regulation
australia : onlin content regulatori wrap-up - globalcompliancenew,anti-regulation
social media compani profit from misinform - gw today,anti-regulation
whi social media fact-check promis too much - impakt,anti-regulation
"onlin misinform most like to be believ by ideolog extremist , new studi show - nyu news",anti-regulation
"maha kumbh mela : action taken against 53 social media account for spread misinform , say up polic - the hindu",anti-regulation
the rise of misinform and ai : develop tool to detect what ’ s real and the impact on upcom elect ( podcast ) - syracus univers news,pro-regulation
the “ wild west ” of cancer misinform onlin - harvard magazin,anti-regulation
when the truth no longer matter : how social media ’ s engag obsess is kill democraci - forb,pro-regulation
"address scienc misinform not by repeat the fact , but by build convers and commun - the convers",anti-regulation
democrat are twice as like as republican to say misinform on social media is a veri seriou problem - yougov us,anti-regulation
power-motiv social media user disproportion spread misinform | ucl news - ucl - univers colleg london,anti-regulation
what public discours get wrong about social media misinform - knowledg @ wharton,anti-regulation
social media is a grow vehicl for climat misinform - insideclim news,pro-regulation
distrust in food safeti and social media content moder — the monitor - kff,anti-regulation
attorney gener bonta urg top social media and ai execut to address elect misinform - california depart of justic,anti-regulation
"fake news , social media , and `` the death of truth '' - cb news",anti-regulation
