stemmed_text,bert_label
"twitter aim to crack down on misinform , includ mislead post about ukrain - npr",anti-regulation
how misinform is distort covid polici and behavior - brook institut,anti-regulation
onlin platform content moder servic market survey - openpr,pro-regulation
the far right ’ s war on content moder come to europ - tech polici press,anti-regulation
how trump ’ s execut order on onlin free speech could upend content moder - marketplac,anti-regulation
content moder in a new era for ai and autom - oversight board,pro-regulation
suprem court defer on state onlin content moder law - roll call,anti-regulation
"facebook , tiktok harden eu commit to tackl disinform -- but not x - etbrandequ",anti-regulation
eff statement on meta 's announc of revis to it content moder process - eff,neutral
"a polici primer for free express and content moder , part i : center public interest valu - public knowledg",pro-regulation
dutch ministri to check best practic for onlin content moder - euronew,pro-regulation
suprem court put content moder on solid legal ground - cyberscoop,anti-regulation
gcore launch advanc ai solut for real-tim onlin content moder and complianc - pr newswir,pro-regulation
"content moder servic market size report , 2030 - grand view research",pro-regulation
an advoc ’ s guid to autom content moder - tech polici press,pro-regulation
content moder in trump 's america is a polit minefield - mashabl,neutral
"a decis on content moder system , after all - tech polici press",pro-regulation
meta 's content moder chang are go to have a real world impact . it 's not go to be good . - tech polici press,anti-regulation
global digit polici roundup : januari 2025 - tech polici press,pro-regulation
the need to make content moder transpar - tech polici press,pro-regulation
transcript : mark zuckerberg announc major chang to meta 's content moder polici and oper - tech polici press,anti-regulation
content moder and platform observ in the digit servic act - tech polici press,pro-regulation
the evolv landscap of content moder : a recap on the influenc of onlin safeti legisl - disrupt competit project,pro-regulation
regul or repress ? govern influenc on polit content moder in india and thailand - carnegi endow for intern peac,anti-regulation
digit apartheid in gaza : unjust content moder at the request of israel ’ s cyber unit - eff,anti-regulation
will meta ’ s chang to content moder work ? - index on censorship,anti-regulation
x ’ s latest content find reveal troubl trend in ai moder - forb,pro-regulation
"a polici primer for free express and content moder , part ii : empow user choic - public knowledg",pro-regulation
meta is get rid of fact checker . zuckerberg acknowledg more harm content will appear on the platform now - cnn,anti-regulation
"meta ’ s new content polici will harm vulner user . if it realli valu free speech , it would make these chang - eff",neutral
meta end fact-check : a new era of content moder - ceo today,pro-regulation
"a polici primer for free express and content moder , part iii : safeguard user - public knowledg",pro-regulation
the fine line between content moder and censorship in the digit age - u.s. global investor,pro-regulation
more speech and fewer mistak - meta store,pro-regulation
"meta , facebook to drop fact-check : what doe thi mean for social media ? - al jazeera english",anti-regulation
suprem court protect the futur of content moder - the verg,pro-regulation
suprem court kick case about tech compani ’ first amend right back to lower court − but appear pois to block state from hamper onlin content moder - the convers,anti-regulation
the broadway play about content moder - the verg,neutral
"speaker : content moder is free speech , not censorship - cornel chronicl",anti-regulation
articl | trump sign order ‘ end feder censorship ’ of onlin content - politico pro,anti-regulation
whi big tech can ’ t solv the content moder problem - forb,anti-regulation
how polit broke content moder - columbia journal review,anti-regulation
more than 140 kenya facebook moder diagnos with sever ptsd - the guardian,anti-regulation
beyond moder : challeng big tech ’ s power in a troubl time for democraci - tech polici press,pro-regulation
so to speak podcast transcript : section 230 and onlin content moder - foundat for individu right and express,pro-regulation
content moder servic market size | cagr of 12 % - market.u,pro-regulation
whi moder can ’ t protect onlin commun on their own - hbr.org daili,anti-regulation
meta 's content moder decis get hill scrutini - axio,pro-regulation
transcript : dave willner on moder with ai at the institut for reboot social media - tech polici press,anti-regulation
meta shift from fact-check to crowdsourc spotlight compet approach in fight against misinform and hate speech - the convers,pro-regulation
follow musk 's lead : how meta 's eas content moder is redraw the digit landscap - dig watch updat,pro-regulation
the fallout of meta ’ s content moder overhaul - the verg,anti-regulation
the word censorship ha an actual mean : a defens of content moder - tech polici press,anti-regulation
what meta ’ s move to commun moder could mean for misinform - the convers,anti-regulation
"( pdf ) the ethic of ai in content moder : balanc privaci , free speech , and algorithm control - researchg",pro-regulation
is thi the end of 'content moder ? ' - substack.com,anti-regulation
wjc respond to meta announc on content moder - world jewish congress,anti-regulation
meta ’ s new community-driven approach to content moder - florida polit,pro-regulation
thi $ 2 billion content moder compani is tri to stop ai imag of child sexual abus - forb,anti-regulation
social media compani face global tug-of-war over free speech - the new york time,anti-regulation
hillari clinton warn 'we lose total control ' without social media content moder - wlo,anti-regulation
data show x ha significantli fewer moder staff than other platform - social media today,anti-regulation
"court allow scope act ’ s parent consent for texa minor onlin , strike down content moder mandat - kprc click2houston",anti-regulation
facebook moder move is a mistak . whi zuckerberg shouldn ’ t copi musk with meta and 5 other thing to know today . - barron 's,anti-regulation
whi outsourc is the key to build a world-class moder team - keyword studio,pro-regulation
9th circuit : provis of california ’ s content-moder law violat first amend - report committe for freedom of the press,anti-regulation
between hype and hesit : how ai can make us safer onlin - tech polici press,pro-regulation
analysi | suprem court say content moder is speech - the washington post,anti-regulation
doe eu content moder law impact free speech in america ? - straight arrow news,anti-regulation
navig onlin safeti : new legisl measur for child protect and content moder - cm lawnow,pro-regulation
the human cost of our ai-driven futur - noema magazin,pro-regulation
is gener ai the answer for the failur of content moder ? - just secur,anti-regulation
prevent and manag of law but aw content moder in xr platform - tech polici press,anti-regulation
"judg allow parent consent for texa kid ’ social media account , but block content moder requir - ksat san antonio",neutral
meta ’ s sharehold : we need transpar on content moder - access,neutral
meta to replac 'bias ' fact-check with moder by user - bbc.com,pro-regulation
meta ‘ will have to assess the risk ’ of fact-check and content moder say ofcom - uktn ( uk technolog news,neutral
whi the video game industri need a respons moder revolut - keyword studio,pro-regulation
regul onlin hate speech to avoid harm is not censorship - the express tribun,anti-regulation
"rule boost social media free speech protect , some say - roll call",pro-regulation
"on social media platform , who ’ s in charg ? - stand togeth",pro-regulation
user submiss - a comprehens approach to content moder in social media platform - indiaai,pro-regulation
meta content moder chang : what you need to know about the shift to commun note - economi middl east,neutral
the polit of platform regul : how govern shape onlin content moder - univers colleg london,pro-regulation
x ’ s moder mishap and the bipartisan misrepresent of free speech onlin - tech polici press,anti-regulation
new era and new risk : meta ’ s content moder reform and freedom of express onlin - michael geist -,pro-regulation
meta ’ s ‘ free speech ’ overhaul spark advertis ’ concern - financi time,anti-regulation
usa : suprem court issu import rule for free speech onlin - articl 19,anti-regulation
csam moder solut - wipro,pro-regulation
content moder and the uk 's onlin safeti act ( osa ) - mondaq news alert,neutral
suprem court to hear argument on onlin content moder - roll call,anti-regulation
the underworld of onlin content moder - the new yorker,anti-regulation
eu seek inform from x on content moder amid first major probe under new tech rule - cnbc,anti-regulation
ico releas guidanc on content moder and data protect - insid global tech,pro-regulation
x urg to answer content moder question - euronew,anti-regulation
polici & internet | pso journal - wiley onlin librari,pro-regulation
"syllabu : larg languag model , content moder , and polit commun - tech polici press",pro-regulation
keyword studio and commun sift elev their partnership to new height - keyword studio,pro-regulation
meta creat a ‘ suprem court ’ for content . then it threaten it fund . - the washington post,anti-regulation
is content moder compat with india ’ s safe harbor law ? - medianama.com,anti-regulation
what is digit sovereignti and how are countri approach it ? - world econom forum,anti-regulation
ken freeman receiv air traffic control associ ( atca ) award for atm-x digit inform platform ( dip ) - nasa,pro-regulation
how to give american back control of their digit ident - the nation interest onlin,pro-regulation
the afterlif of data : who control our digit legaci ? - informationweek,pro-regulation
"india ’ s digit sovereignti : balanc control , secur , and individu right – ope - eurasia review",pro-regulation
new iron mountain digit data/docu manag servic leverag mongodb atla - crn,pro-regulation
master data manag : the key to get more from your data - mckinsey,pro-regulation
russia step up digit authoritarian and repress in inform space - isw - rbc-ukrain,anti-regulation
the rise of digit authoritarian - freedom hous,pro-regulation
document manag : are you take it serious enough ? - bimplu,neutral
data privaci week : how to take control of your digit life - infosecur magazin,pro-regulation
"american and privaci : concern , confus and feel lack of control over their person inform - pew research center",anti-regulation
the era of borderless data is end ( publish 2022 ) - the new york time,anti-regulation
the polit of digit literaci and inform control : an import survey - bryan alexand,pro-regulation
afmc releas white paper on digit materiel manag - afmc.af.mil,pro-regulation
myanmar is the lead edg of digit authoritarian in southeast asia - the diplomat,pro-regulation
whi it ’ s so hard for user to control their data - hbr.org daili,anti-regulation
"1. view of data privaci risk , person data and digit privaci law - pew research center",pro-regulation
govern data manag for the digit age - mckinsey,pro-regulation
"how american view data privaci : tech compani , ai , regul , password and polici - pew research center",pro-regulation
the quiet evolut of vietnam ’ s digit authoritarian - the diplomat,pro-regulation
digit autocraci : maduro ’ s control of the venezuelan inform environ - atlant council,anti-regulation
take control of your person inform : how to delet your data from the internet - cnet,pro-regulation
design for censorship - mercat institut for china studi ( meric ),neutral
russia is use ‘ digit repress ’ to suppress dissent - scientif american,anti-regulation
"editori : digit technolog for tobacco control : novel data collect , studi design , and intervent - frontier",pro-regulation
"[ articl ] digit sovereignti in india : polici agenda , discours , power and capabl - scienc po",pro-regulation
confront digit authoritarian­ through digit democraci : lesson from taiwan - the diplomat,pro-regulation
inform technolog ( it ) - techtarget,pro-regulation
the new rule of data privaci - hbr.org daili,pro-regulation
the consumer-data opportun and the privaci imper - mckinsey,pro-regulation
digit - turner & townsend,pro-regulation
digit sovereignti : the fight to control data in the ai era - spicework news and insight,pro-regulation
what is the digit thread and how doe it help data manag in aerospac manufactur ? - engineering.com,pro-regulation
top 10 product inform manag ( pim ) system - cmswire,pro-regulation
how india take control of person data - deccan herald,pro-regulation
"russia : grow internet isol , control , censorship - human right watch",anti-regulation
digit surveil can help bring the coronaviru pandem under control – but also threaten privaci - the convers,pro-regulation
digit asset manag ( dam ) - techtarget,pro-regulation
explor the factor that inﬂuenc person - researchg,pro-regulation
fire at digit realti 's singapor data center `` under control '' - datacenterdynam,anti-regulation
"build inform model , digit twin creat green , smart cement factori - control global",pro-regulation
( pdf ) digit qualiti control of construct work - researchg,pro-regulation
web content manag system ( wcm ) - techtarget,pro-regulation
content manag ( cm ) - techtarget,pro-regulation
20 year of inform manag at heathrow airport - autodesk,pro-regulation
our data is our digit ident - and we need to reclaim control | cullen hoback - the guardian,pro-regulation
digit self-control - new econom foundat,pro-regulation
six benefit of align inform manag directli with digit transform - it brief australia,pro-regulation
big data : the manag revolut - hbr.org daili,pro-regulation
‘ digit coloni ’ : whi some countri want to take control of their peopl ’ s data from big tech - the convers,pro-regulation
europ ’ s digit competit law can give user more effect control of their data - bruegel,pro-regulation
us ensnar in china ’ s digit crackdown - the hill,anti-regulation
evolut of inform manag in the digit era - wipro,pro-regulation
covid kaya : a digit platform for covid-19 inform manag in the philippin - world health organ,pro-regulation
idg capit invest in digit inform manag platform develop flowu - pandaili,pro-regulation
data protect reform - parliament approv new rule fit for the digit era - european parliament,pro-regulation
are you in control of your digit footprint ? - the strait time,anti-regulation
whi is digit inform manag so import for nfp ? - pro bono australia,anti-regulation
bs 8644-1 digit manag of fire safeti inform : an inform manag perspect - bimplu,pro-regulation
googl updat it famili link parental-control system to give parent more monitor power - digit inform world,pro-regulation
meta look to give more user control over metric on instagram and thread with option reel view count and hidden repli - digit inform world,pro-regulation
how to control your content in googl ’ s ai overview - digit inform world,pro-regulation
five trend on digit inform manag - panamericanworld,pro-regulation
american agre : onlin overshar is out of control - digit inform world,anti-regulation
"googl expand it ad control to youtub , search result , and discov - digit inform world",pro-regulation
new poll reveal a major of american want more govern control of social media compani - digit inform world,anti-regulation
youtub might be give you more control over suggest - digit inform world,neutral
