stemmed_text,bert_label
"safeti take a backseat at pari ai summit , as u.s. push for less regul",anti-regulation
elon musk say 'make europ great again ' as he continu hi push into european polit,pro-regulation
judg make final decis on lawsuit alleg major compani are deceiv the public : 'spent million to mislead consum ',anti-regulation
a nutrit scientist wa hook on snack like chocol and chip . she made 3 simpl chang and now enjoy them without over .,pro-regulation
trump revok ai risk regul in day one execut order,anti-regulation
what is open data ? how common crawl and laion shape open sourc ai train,neutral
social media in healthcar : a regulation-friendli guid for 2025,pro-regulation
anti-poverti group say billionair ' wealth soar in 2024 as the elit prepar for anoth davo,anti-regulation
"how to delet your facebook , instagram , and thread right now",pro-regulation
when the truth no longer matter : how social media ’ s engag obsess is kill democraci,pro-regulation
vatican warn of ‘ shadow of evil ’ in ai,anti-regulation
can europ stop elon musk ?,anti-regulation
"whi misinform spread dure climat disast , and how to stop it",anti-regulation
the vatican urg ethic ai use in warfar and healthcar,pro-regulation
new report show social media giant obstruct independ research for polit onlin safeti,anti-regulation
"what happen next to the u.s. vs. googl antitrust case ? via @ sejourn , @ alliberry3",anti-regulation
vanc declar war on ai censorship : u.s. must lead the charg for freedom in artifici intellig,anti-regulation
beyond the illus - the real threat of ai : wef global risk report 2025,anti-regulation
"empow user , not overlord : overcom digit helpless",pro-regulation
ai safeti at a crossroad : whi us leadership hing on stronger industri guidelin,pro-regulation
uk water industri found to be use decept tactic to deflect blame for sewag pollut,anti-regulation
ai regul in the u.s. : navig post-eo 14110,pro-regulation
ai ’ s legal storm : the three battl that will shape it futur,pro-regulation
the faa ’ s obsolet tech—not diversity—i america ’ s biggest air safeti threat,anti-regulation
beaver famili help control flood in west london,pro-regulation
solana launch dubai crypto econom zone : what you need to know,pro-regulation
vanc tell european that heavi regul could kill ai,anti-regulation
the dark side of ai innov is supercharg disinform and damag democraci,pro-regulation
vanc tell european that heavi regul could kill ai,anti-regulation
spanish prime minist warn social media could 'overthrow democraci ',anti-regulation
texa measl outbreak hit as congress weigh rfk jr. ’ s hh secretari bid,anti-regulation
the 8 talk point fossil fuel compani use to obstruct climat action,pro-regulation
joe rogan repeat fals claim that ukrain 'accident ' got $ 6 billion,anti-regulation
latin america is move fast to protect democraci from excess of big tech,pro-regulation
"tiktok out of time , meta out of fact , chatgpt ’ s new task",anti-regulation
three threat predict for 2025 and how compani can mitig them,neutral
"us , uk declin to sign pari ai summit declar",anti-regulation
"vanc outlin an open , forward-look ai agenda",pro-regulation
whi kenya is crack down on viral ai-gener content,anti-regulation
"kenya 's digit struggl : ai , activ and crackdown",pro-regulation
"2025 'doomsday clock ' : thi is how close we are to self-annihil , scientist say",anti-regulation
elon musk believ he got trump elect . now he ’ s come for europ,anti-regulation
will the global elit ’ war on free speech succeed ?,anti-regulation
govern postpon big stick for big tech amid trump tariff fear,anti-regulation
googl add watermark to ai photo,pro-regulation
misinform as a busi model—how meta and musk endang democraci | opinion,anti-regulation
stop onlin misguid : hold social media influenc account,anti-regulation
q & a : luca grave on meta ’ s decis to shut down it global fact check program,anti-regulation
"ai updat , januari 24 , 2025 : ai news and view from the past week",anti-regulation
zuckerberg ’ s meta shift will leav the user base of hi platform split,anti-regulation
bbc take on appeal to natur fallaci,anti-regulation
ai account : how do the right thing build a better busi,pro-regulation
project 2025 wa the plan all along . trump is prove it now .,pro-regulation
vanc warn eu against ai overregul at summit in pari,anti-regulation
on semiconductor corpor ( on ) miss q4 estim and issu weak q1 forecast amid slow automot chip demand,anti-regulation
"jd vanc warn ‘ massiv ’ european regul may kill ai , rip ‘ authoritarian censorship ’",anti-regulation
elon musk 's platform label hi argument 'object fals ',anti-regulation
navig the futur of leadership in the age of ai and augment,pro-regulation
misinform as a busi model—how meta and musk endang democraci | opinion,anti-regulation
"zuckerberg slam biden for censor vaccin opposit , take aim at appl in rogan interview",anti-regulation
junk food turn public villain as power shift in washington,anti-regulation
fix the student loan crisi start with defend the depart of educ,neutral
"billionair ' wealth skyrocket , anti-poverti group say ahead of davo",anti-regulation
"abort oppon prais rfk jr. , after he vow to follow trump",anti-regulation
linkedin founder reid hoffman warn against big tech ’ s fact-check rollback,anti-regulation
exclus : radar reveal real reason elon musk ha becom trump 's lapdog — after tesla boss 'secretli brand presid con artist and world champion of bull -- -- -- '',anti-regulation
a plea for institut modesti,pro-regulation
"the battl for tiktok is a fight for control of public opinion , not nation secur",pro-regulation
pakistan : repeal amend to draconian cyber law,anti-regulation
sir martin sorrel and richard edelman on what trump ’ s inaugur can teach cmo,pro-regulation
jd vanc unveil america ’ s ai doctrin,pro-regulation
presid trump ’ s first week hammer public health,anti-regulation
whi is spray sunscreen bad ?,anti-regulation
"look out for thi messag about fiction recal on chicken , egg",anti-regulation
eu demand x algorithm transpar amid claim of bia ahead of german elect,anti-regulation
whi are peopl mad at msnbc ?,anti-regulation
donald trump announc stargat : $ 500 billion private-sector invest in ai infrastructur,pro-regulation
whi ha ‘ online_safety_au_regulatory_act ’ suddenli turn up on your iphon ?,anti-regulation
note on the relationship between artifici intellig and human intellig,pro-regulation
nobodi want to talk about ai safeti . instead they cling to 5 comfort myth,anti-regulation
european commiss criticis over lack of action taken against elon musk 's x,anti-regulation
eu 's legal weapon face the heat from us big tech,pro-regulation
junk food turn public villain as power shift in washington,anti-regulation
troubl in ( maha ) paradis ?,anti-regulation
"counter fake news need open-sourc investig , new media literaci strategi [ advocaci lab content ]",pro-regulation
hubert horan : can uber ever deliv ? part thirty-four – toni west ’ s calamit legaci at uber and with the kamala harri campaign,pro-regulation
union warn member not to trust musk ’ s mask sever promis,anti-regulation
scienc ’ s turn toward dark,pro-regulation
spain ’ s leader want the eu to ‘ make social media great again. ’ here ’ s how,pro-regulation
the plastic crisi : a health and environment emerg,pro-regulation
"at davo , spanish presid pedro sánchez just said the quiet part out loud on onlin anonym and digit ident",anti-regulation
junk food turn public villain as power shift in washington,anti-regulation
maha : echo of the secret,pro-regulation
bbc claim it panorama episod about e-bik wa “ fair and imparti and clearli not an attack on the e-bik industri ”,pro-regulation
spain 's leader want the eu to ‘ make social media great again. ’ here 's how,pro-regulation
major support moder on social media platform,neutral
'misinform ' a factor in teacher reject pay offer,anti-regulation
scientist debunk claim that iran ’ s 2024 earthquak wa a nuclear weapon test,anti-regulation
meta is ditch fact checker for x-style commun note . will they work ?,anti-regulation
reid hoffman doe n't want big tech 's pivot from fact-check to mean more misinform,anti-regulation
trump order govern to stop ‘ trampl ’ conserv on social media,anti-regulation
trump take aim at social media 'censorship ' with execut order,anti-regulation
a lot of american are googl ‘ what is oligarchi ? ’ after biden ’ s farewel speech,anti-regulation
"i do n't let my teen have social media . my 16-year-old daughter wa n't happi at first , but the other day she thank me .",anti-regulation
jame gunn address that controversi superman fli shot,pro-regulation
a white hous order claim to end 'censorship . ' what doe that mean ?,anti-regulation
"harrow crime ha left offic struggl , lead detect say",anti-regulation
what 's trump 's beef with south africa ?,anti-regulation
how we must continu to fight antisemit 80 year after the liber of auschwitz,pro-regulation
democrat sen. padilla will 'of cours ' attend trump 's inaugur,neutral
75 % of facebook news get repost without user read it,anti-regulation
tackl social media fraud with graph databas,anti-regulation
nypd apolog for mistakenli accus 15-year-old of mass shoot at brooklyn parad,anti-regulation
"la time owner boost rfk jr. onlin , as writer say paper cut hi critiqu",anti-regulation
"biden warn of a 'tech industri complex ' and say america must lead the way on ai , not china , in farewel address",anti-regulation
"'thank you so much ' – joe rogan prais elon musk for buy 'overpr ' twitter , say it save us from censorship and narr control",pro-regulation
what if your favourit social media app wa gone tomorrow ?,anti-regulation
the dark side of reddit : how commun are turn toxic,anti-regulation
the import of media literaci for young peopl,pro-regulation
how to avoid outrag fatigu and tune in without burn out,pro-regulation
us cyber agenc put elect secur staffer who work with the state on leav,anti-regulation
the import of media literaci in 2025,pro-regulation
when fact fall short,neutral
social media extend it reach to financi advic,pro-regulation
the emilia pérez controversi just keep pile up,pro-regulation
"no , the latest io updat won ’ t give starlink access to your iphon",anti-regulation
the attent alchemist : craft gold from social engin,pro-regulation
america is divid . it make for tremend content .,pro-regulation
tiktok servic restor in the us after promis that ban wo n't be enforc,anti-regulation
"climat action now threaten by ‘ power forc , ’ biden warn",pro-regulation
beyond the buzzer : how sport collect are win the social media game,pro-regulation
six stori on elit school,pro-regulation
social media remain a polit echo chamber for the likemind,neutral
byted ’ s omnihuman-1 ai model can gener scarili realist video,pro-regulation
baltic state to make histor switch away from russian power grid,pro-regulation
bambu lab - set the record straight about our secur updat,pro-regulation
social media literaci still lack – could that chang ?,anti-regulation
"nyc health and hospit , take on fals social post , say it wo n't report undocu patient",anti-regulation
buzzfe 's new strategi : an ai-pow social media platform to help 'spread joy ' ...,pro-regulation
wa biden right to warn about the tech-industri complex ?,anti-regulation
backlash in kenya over livestock vaccin and belch cow,anti-regulation
you do n't have to be a net zero hero—how focu on person climat action can distract from system problem,pro-regulation
la wildfir disinform reveal limit of fact-check,anti-regulation
megan thee stallion win legal round against pro-tori lanez blogger,anti-regulation
"british teen plead guilti to stab attack that kill 3 , spark riot , misinform",anti-regulation
"in farewel speech , biden rail against the tech industri complex and disinfo dismantl democraci",pro-regulation
"are jennif aniston and barack obama date ? an odd stori , explain",neutral
the make of commun note ( 2024 ),pro-regulation
joe biden warn of “ tech industri complex ” in farewel address : american are be buri under an avalanch of misinform and disinform ”,anti-regulation
trump 's tiktok flipflop : a look at u.s. president-elect 's social media evolut,pro-regulation
"“ open sourc and ethic ” tiktok , whatsapp and instagram altern could transform social media",pro-regulation
meta shift from fact-check to crowdsourc spotlight compet approach in fight against misinform and hate speech,pro-regulation
"ice raid liberti restaur and detain at least 12 worker , clay counti sheriff confirm",anti-regulation
x and meta scrambl to settl with trump,anti-regulation
rfk jr. deni he is anti-vaccin dure hi confirm hear . here ’ s hi record,anti-regulation
comcast tempt dtc brand away from paid social due to rise cost and brand safeti issu,anti-regulation
a ceasefir agreement at last – but will it hold ?,neutral
"ye , ai is capabl of improv trust—her ’ s how",pro-regulation
trump accus of lead a ‘ multiprong ’ attack on us media,anti-regulation
are instagram and tiktok enabl right-w polit censorship ?,anti-regulation
10 uk social media trend for 2025,pro-regulation
zoe saldaña respond to karla sofía gascón ’ s social media controversi,pro-regulation
a tumultu week for feder cybersecur effort,anti-regulation
"as trump return to the white hous , media buyer clamp down on brand safeti",anti-regulation
appl halt ai news alert after error,anti-regulation
the long goodby,pro-regulation
from viral to vote : meet our commun onlin dure the 2024 elect,pro-regulation
confus elon musk attack wrong journalist,anti-regulation
"brand : legaci media isn ’ t dead , it ’ s readi for reposit",pro-regulation
pakistan senat vote to ban fake news on social media,anti-regulation
“ wild and digust ” : french presid ’ s wife accus of be a man after photo goe viral,anti-regulation
"how artifici intellig shape how we think , act , and connect",pro-regulation
meta ’ s user fact-check is just ‘ window dress ’ without a commit to truth,anti-regulation
the futur of influenc market : from public to privat,pro-regulation
a collect open letter to mark zuckerberg from the ifcn arab coalit,pro-regulation
what you need to know about the immin u.s. tiktok ban,pro-regulation
who believ misinform,anti-regulation
new meta content rule let user call lgbtq+ peopl ‘ mental ill. ’ here ’ s what medic expert say .,anti-regulation
whi more young men in germani are turn to the far-right,anti-regulation
whi sad post on social media get such big audienc,anti-regulation
global fact check fund award $ 2 million to 20 fact-check group across 15 countri,pro-regulation
buzzfe ceo plan to challeng algorithm-driven social media,pro-regulation
play at democraci,pro-regulation
thi deepfak brad pitt scam is a cautionari tale on the danger of ai catfish,pro-regulation
tech deal in 2025 : navig ‘ ghost ’ discount and fake review,anti-regulation
how can bank truli understand the chang regulatori landscap ?,pro-regulation
trump lash out at jerom powel after fed doesn ’ t cut interest rate,anti-regulation
fed hold interest rate : what it mean for small busi in 1q25,pro-regulation
pakistan : journalist slam new law regul social media,anti-regulation
"jpjeplat for ev – plate design be replic and use on ice vehicl , which is not legal allow",pro-regulation
how democrat alien big tech — and whi it might not matter,anti-regulation
trump daughter ivanka slam fake crypto coin exploit her name,anti-regulation
pakistan crack down on free speech onlin,anti-regulation
linda mcmahon confirm hear and cocoa price affect valentin 's day sweet : morn rundown,pro-regulation
whi social media is help ?,neutral
"scheme dealer , auction hous collus , pub gossip , oh my !",anti-regulation
edmonton entrepreneur join effort to ramp up anti-fraud protect for immigr,pro-regulation
whi american ( but not bank ) love the consum financi protect bureau,pro-regulation
social media is impact polit and social discours,pro-regulation
red 3 ban : other ingredi that could now face fda scrutini,anti-regulation
pakistan 's na endors controversi chang to cyber law amid opposit boycott,pro-regulation
"no , trump didn ’ t make $ 50 billion from hi memecoin",anti-regulation
vatican see danger in ai,anti-regulation
intern report warn against loss of control over ai,anti-regulation
how did racist mass text bypass some anti-spam guardrail after the elect ?,anti-regulation
unravel the curiou mysteri of two differ ai model suddenli form a new languag of their veri own,pro-regulation
"trump accus fed , powel of creat inflat on heel of rate decis",anti-regulation
trump cabinet confirm hear : schedul & how to watch,pro-regulation
"ai date is about data , not love : how to resist the tech takeov of romanc",anti-regulation
letter from london : haiku hell and the abandon,pro-regulation
watch : crowd goe wild as trump announc “ no tax on tip ” and teas elimin of incom tax in la vega,anti-regulation
jami raskin reveal dem hire 'emot regul ' specialist to consult on 'authoritarian style of speech in the trump age,pro-regulation
divid and conquer : russia 's disinform campaign in africa,pro-regulation
the trump revolut : where it came from and where it ’ s go,pro-regulation
defer to passport put dissid at risk,anti-regulation
"deadlin alert : block , inc. ( sq , xyz ) investor who lost money urg to contact glanci prongay & murray llp about secur fraud lawsuit",anti-regulation
"deadlin alert : block , inc. ( sq , xyz ) investor who lost money urg to contact glanci prongay & murray llp about secur fraud lawsuit",anti-regulation
"deadlin alert : block , inc. ( sq , xyz ) investor who lost money urg to contact glanci prongay & murray llp about secur fraud lawsuit",anti-regulation
akismet : how to collect email from websit visitor ( for email market ),pro-regulation
"fed guid by econom goal and the law , not polit , say powel",neutral
brazil took on elon musk and won . now lula is share note with europ,anti-regulation
jpmorgan post record annual profit as major us bank thrive in the final quarter of 2024,pro-regulation
"ifpi ceo victoria oakley talk ai , fraud and lobbi : ‘ we have a compel stori to tell ’",pro-regulation
ai # 102 : made in america,pro-regulation
powel ’ s fed on defens as divers effort come under fire,pro-regulation
high-tech capit and neo-feud,pro-regulation
russian propaganda : how moscow use disinform in africa,anti-regulation
russia increasingli use disinform in africa,anti-regulation
news stori : britain 's lead the way protect children from onlin predat,pro-regulation
sec enforc : 2024 year in review,pro-regulation
how trump ’ s war on cartel cash can stop fentanyl enabl — and save american live,pro-regulation
“ ai is left-w and silenc conserv posit ” state uk research,anti-regulation
the slop societi,neutral
media insid : tvnz newsread simon dallow consid hi futur ; insid the nzme/nz herald cut ; top 25 toughest pr gig ; report of the year quit stuff,anti-regulation
facebook,pro-regulation
it ’ s a big club and you ain ’ t in it,pro-regulation
gullibl trump support lose million on fake $ barron meme coin,anti-regulation
jpmorgan post record annual profit as major u.s. bank thrive in final quarter of 2024,pro-regulation
we need a cognit freedom movement,pro-regulation
the failur and fallaci of central plan,anti-regulation
financi institut ma key trend and outlook,pro-regulation
'overdos epidem ' : bipartisan senat target fentanyl classif as laps approach,anti-regulation
cleari gottlieb discuss effect board oversight as ai evolv,pro-regulation
ranveer allahbadia controversi live updat,anti-regulation
"trump say powel and fed , ‘ fail to stop the problem they creat with inflat ’",anti-regulation
will ai resili protect develop nation ?,pro-regulation
scan an id for club entri is n't uncommon — but is your data safe ?,neutral
sen. ron wyden is here to stop elon musk,anti-regulation
labour 's ai action plan - a gift to the far right,pro-regulation
trump hand 'opportun to save medicar ’ after biden admin ’ s final blow to senior : expert,anti-regulation
a ride-hail startup in washington tri to “ out-ub uber ”,pro-regulation
report : major of u.s. teen have lost trust in big tech | techcrunch,anti-regulation
public onassi school : bill pass – decis on the first 22 to 17 februari,anti-regulation
"plan for the worst in trump ’ s next term : prepar , don ’ t panic , and don ’ t compli in advanc",anti-regulation
eff transit memo to trump administr 2025,pro-regulation
do you need permiss from the govern to do independ research ?,anti-regulation
"enquir automat reconstruct , expand , and drive enrich analysi of gene and mesh co-occurr network from context-specif biomed literatur",pro-regulation
trump 's anti-tran effort is an agenda cornerston with echo in histori,pro-regulation
big tech is power trump ’ s immigr crackdown,pro-regulation
break down all of trump ’ s day 1 presidenti action,anti-regulation
your exercis gear reserv the right to track and sell data on how you smell,pro-regulation
how the oil industri and grow polit divid turn climat chang into a partisan issu,pro-regulation
disinform expert hate trump 's free speech execut order,anti-regulation
"no evid trump fire 3,000 air traffic control",anti-regulation
market brief : whi de & i becom a flash point is part of ‘ politic of everyth ’,anti-regulation
"brendan carr , trump ’ s ‘ free speech ’ warrior , wast no time violat trump ’ s new free speech execut order",anti-regulation
wefâ global risk report 2025 : priorit âdisinformationâ over econom stabil rais sovereignti concern,pro-regulation
flood the zone with truth,pro-regulation
infrastructur launder : blend in with the cloud,pro-regulation
"viru disinform drive anti-china sentiment , lockdown fear",anti-regulation
rubio vow to end state depart program that âopen the door to censorshipâ,anti-regulation
where trump polici and project 2025 propos match up,pro-regulation
trump 's insult california leader deal with wildfir . he need to walk with them .,anti-regulation
"trump declar war on big tech censorship , sign execut order to protect free speech",anti-regulation
"biden ’ s fail polici are over , trump tell globalist elit at davo",anti-regulation
fact-check in ethiopia take on disinform amid rise tension,pro-regulation
"trumpâ america-first polici rattl globalist elit , threaten wefâ âgreat resetâ agenda",pro-regulation
russia is spin up a new barrag of lie in europ,anti-regulation
russia is spin up a new barrag of lie in europ,anti-regulation
biden warn of ‘ oligarchi and tech industri complex ’,anti-regulation
transcript : cnn anchor wreck maga rep. in brutal shame over jan. 6,anti-regulation
googl snub eu law over fact-check youtub video,anti-regulation
"final , the truth : paypal admit freez account over critic of covid-19 polici , spark free speech concern",anti-regulation
incom crypto czar argu jan. 6 rhetor not cover by first amend ...,anti-regulation
russian media reach soar as nato eye countermeasur – report,anti-regulation
moscow comment on french report ’ s visa ban,anti-regulation
we are disabl comment,anti-regulation
system risk report : a system in crisi ?,neutral
how el tímpano is chang it report practic to protect immigr sourc,pro-regulation
"[ josh blackman ] murthi v. missouri , redux",anti-regulation
"deepseek ‘ incred vulner ’ to attack , research claim",anti-regulation
musk & right wing trumpster are alreadi at odd,pro-regulation
explor the cybersecur battlefield of 2025,pro-regulation
from hierarchi to wirearchi in an alway connect workplac,pro-regulation
trump ’ s new white hous press secretari target transgend peopl in first brief,anti-regulation
eu regul attack x becaus of elon musk ’ s polit posit,anti-regulation
"infosec wa liter the last item in trump 's polici plan , yet major chang are like on hi watch",neutral
usaid funnel nearli $ 800 million to ‘ gender transform ’ global censorship group,anti-regulation
trump say he 'll visit california on friday to survey wildfir damag,anti-regulation
state depart warn staff against impos stealth dei after trump execut order,anti-regulation
meta is now a fake news free-for-al after compani shut down anti-misinform technolog,anti-regulation
we ’ re live through the biggest scandal of all time,anti-regulation
fake climat news thrive as polit and ai turbocharg disinform crisi [ advocaci lab content ],anti-regulation
ukrain and west ‘ blackmail ’ african state to counter russia – moscow,anti-regulation
heritag foundat expert analyz trump ’ s execut order,pro-regulation
trump dh dissolv advisori board after biden ‘ disinform ’ fiasco,anti-regulation
now is the time to bring censorship giant microsoft to heel,anti-regulation
transcript : trump ’ s furi at jack smith grow as maga threat darken,pro-regulation
"lavrov echo debunk kremlin narr to justifi war , undermin nato",anti-regulation
transcript : paul krugman on trump voter get “ brutal scam ”,anti-regulation
rubio will skip g20 in south africa becaus of it land and climat chang polici,anti-regulation
cnn ’ s scott jen halt panelist ’ s defens of biden ’ s ‘ misinform ’ call out with one simpl question,anti-regulation
everyth trump ha promis to do on hi first day,pro-regulation
trump ’ s flurri of execut order upend biden ’ s tech polici,anti-regulation
everyth trump ha promis to do on hi first day,pro-regulation
deepfak can damag businesses—her ’ s how to fight back,pro-regulation
what mark zuckerberg get right about fact-check and content moder,pro-regulation
'smart public polici can make a differ ',pro-regulation
exclus : rubio outlin 'sweep chang ' to us diplomat,pro-regulation
